### ISSUE TITLE
Tun模式下无法访问WSL服务

### ISSUE THREAD

**Issue by FlyDut** [SagerNet/sing-box#4029]
### Operating system

Windows

### System version

Windows11 25H2

### Installation type

Third-party graphical clients that advertise themselves as using sing-box (Windows)

### If you are using a graphical client, please provide the version of the client.

v2rayN 7.19.5

### Version

```shell
1.13.7
```

### Description

开启tun模式后，在wsl下启动docker服务后，如postgreSQL，redis均无法正常访问
已经检查系统代理设置、路由设置，对于保留地址的访问都已经配置直连，且tpc已成功建立握手，但是实际连不上。
抓包后发现，在tun接管数据后，会进行包收集，合并成一个大的tcp包转发，导致服务无法正常的处理数据

### Reproduction

singbox的处理
13:44:40.695364 eth3  In  IP 172.18.0.2.redis > 172.18.0.1.48021: Flags [S.], seq 3715345412, ack 3729259349, win 65535, options [mss 8960,nop,wscale 8,sackOK,TS val 596123707 ecr 2011896226], length 0
13:44:40.695395 eth3  Out IP 172.18.0.1.48021 > 172.18.0.2.redis: Flags [.], ack 1, win 490, options [nop,nop,TS val 2011896315 ecr 596123707], length 0
13:44:40.695537 eth3  Out IP 172.18.0.1.48021 > 172.18.0.2.redis: Flags [P.], seq 1:196, ack 1, win 490, options [nop,nop,TS val 2011896315 ecr 596123707], length 195: RESP "auth" "redis密码" "client" "setname" "127.0.0.1@6379" "config" "get" "databases" "scan" "0" "MATCH" "*" "COUNT" "500" "info"

系统和clash的处理
13:47:24.422549 br-c84a2a85afed Out IP 172.18.0.1.46491 > 172.18.0.2.redis: Flags [.], ack 1, win 502, options [nop,nop,TS val 2012050823 ecr 1630049913], length 0
13:47:24.422549 vethd7a83b3 Out IP 172.18.0.1.46491 > 172.18.0.2.redis: Flags [.], ack 1, win 502, options [nop,nop,TS val 2012050823 ecr 1630049913], length 0
13:47:24.425275 loopback0 In  IP localhost.56396 > localhost.redis: Flags [P.], seq 1:33, ack 1, win 255, length 32: RESP "auth" "redis密码"
13:47:24.425299 loopback0 Out IP localhost.redis > localhost.56396: Flags [.], ack 33, win 502, length 0
13:47:24.425344 br-c84a2a85afed Out IP 172.18.0.1.46491 > 172.18.0.2.redis: Flags [P.], seq 1:33, ack 1, win 502, options [nop,nop,TS val 2012050825 ecr 1630049913], length 32: RESP "auth" "redis密码"
13:47:24.425347 vethd7a83b3 Out IP 172.18.0.1.46491 > 172.18.0.2.redis: Flags [P.], seq 1:33, ack 1, win 502, options [nop,nop,TS val 2012050825 ecr 1630049913], length 32: RESP "auth" "redis密码"
13:47:24.425363 vethd7a83b3 P   IP 172.18.0.2.redis > 172.18.0.1.46491: Flags [.], ack 33, win 509, options [nop,nop,TS val 1630049915 ecr 2012050825], length 0
13:47:24.425366 br-c84a2a85afed In  IP 172.18.0.2.redis > 172.18.0.1.46491: Flags [.], ack 33, win 509, options [nop,nop,TS val 1630049915 ecr 2012050825], length 0
13:47:24.425646 loopback0 In  IP localhost.56396 > localhost.redis: Flags [P.], seq 33:83, ack 1, win 255, length 50: RESP "client" "setname" "127.0.0.1@6379"
13:47:24.425653 loopback0 Out IP localhost.redis > localhost.56396: Flags [.], ack 83, win 502, length 0
13:47:24.425700 br-c84a2a85afed Out IP 172.18.0.1.46491 > 172.18.0.2.redis: Flags [P.], seq 33:83, ack 1, win 502, options [nop,nop,TS val 2012050826 ecr 1630049915], length 50: RESP "client" "setname" "127.0.0.1@6379"
13:47:24.425702 vethd7a83b3 Out IP 172.18.0.1.46491 > 172.18.0.2.redis: Flags [P.], seq 33:83, ack 1, win 502, options [nop,nop,TS val 2012050826 ecr 1630049915], length 50: RESP "client" "setname" "127.0.0.1@6379"
13:47:24.425706 vethd7a83b3 P   IP 172.18.0.2.redis > 172.18.0.1.46491: Flags [.], ack 83, win 509, options [nop,nop,TS val 1630049916 ecr 2012050826], length 0
13:47:24.425708 br-c84a2a85afed In  IP 172.18.0.2.redis > 172.18.0.1.46491: Flags [.], ack 83, win 509, options [nop,nop,TS val 1630049916 ecr 2012050826], length 0
13:47:24.425855 loopback0 In  IP localhost.56396 > localhost.redis: Flags [P.], seq 83:123, ack 1, win 255, length 40: RESP "config" "get" "databases"
13:47:24.425862 loopback0 Out IP localhost.redis > localhost.56396: Flags [.], ack 123, win 502, length 0
13:47:24.425910 br-c84a2a85afed Out IP 172.18.0.1.46491 > 172.18.0.2.redis: Flags [P.], seq 83:123, ack 1, win 502, options [nop,nop,TS val 2012050826 ecr 1630049916], length 40: RESP "config" "get" "databases"
13:47:24.425911 vethd7a83b3 Out IP 172.18.0.1.46491 > 172.18.0.2.redis: Flags [P.], seq 83:123, ack 1, win 502, options [nop,nop,TS val 2012050826 ecr 1630049916], length 40: RESP "config" "get" "databases"
13:47:24.425916 vethd7a83b3 P   IP 172.18.0.2.redis > 172.18.0.1.46491: Flags [.], ack 123, win 509, options [nop,nop,TS val 1630049916 ecr 2012050826], length 0
13:47:24.425918 br-c84a2a85afed In  IP 172.18.0.2.redis > 172.18.0.1.46491: Flags [.], ack 123, win 509, options [nop,nop,TS val 1630049916 ecr 2012050826], length 0
13:47:24.426204 loopback0 In  IP localhost.56396 > localhost.redis: Flags [P.], seq 123:182, ack 1, win 255, length 59: RESP "scan" "0" "MATCH" "*" "COUNT" "500"
13:47:24.426211 loopback0 Out IP localhost.redis > localhost.56396: Flags [.], ack 182, win 502, length 0
13:47:24.426267 br-c84a2a85afed Out IP 172.18.0.1.46491 > 172.18.0.2.redis: Flags [P.], seq 123:182, ack 1, win 502, options [nop,nop,TS val 2012050826 ecr 1630049916], length 59: RESP "scan" "0" "MATCH" "*" "COUNT" "500"
13:47:24.426269 vethd7a83b3 Out IP 172.18.0.1.46491 > 172.18.0.2.redis: Flags [P.], seq 123:182, ack 1, win 502, options [nop,nop,TS val 2012050826 ecr 1630049916], length 59: RESP "scan" "0" "MATCH" "*" "COUNT" "500"

### Logs

```shell

```

### Supporter

- [ ] I am a [sponsor](https://github.com/sponsors/nekohasekai/)

### Integrity requirements

- [x] I confirm that I have read the documentation, understand the meaning of all the configuration items I wrote, and did not pile up seemingly useful options or default values.
- [x] I confirm that I have provided the server and client configuration files and process that can be reproduced locally, instead of a complicated client configuration file that has been stripped of sensitive data.
- [x] I confirm that I have provided the simplest configuration that can be used to reproduce the error I reported, instead of depending on remote servers, TUN, graphical interface clients, or other closed-source software.
- [x] I confirm that I have provided the complete configuration files and logs, rather than just providing parts I think are useful out of confidence in my own intelligence.
