### ISSUE TITLE
tun模式下,本机和下挂的机器都无法ping外网

### ISSUE THREAD

**Issue by hkargc** [SagerNet/sing-box#3883]
### 操作系统

Linux

### 系统版本

Rockylinux 10

### 安装类型

sing-box 原始命令行程序

### 版本

```shell
[root@localhost sing-box]$ sing-box version
sing-box version 1.13.2

Environment: go1.25.7 linux/amd64
Tags: with_gvisor,with_quic,with_dhcp,with_wireguard,with_utls,with_acme,with_clash_api,with_tailscale,with_ccm,with_ocm,with_naive_outbound,badlinkname,tfogo_checklinkname0,with_musl
Revision: c0d45aebfadae9988e160c761f32e9edf8e0d8e4
CGO: enabled
```

### 描述

本机和下挂的机器都能正常访问外网,ping外网超时,内网正常

### 重现方式

```json
{
	"log": {
		"disabled": false,
		"level": "warn",
		"output": "/opt/logs/sing-box.log",
		"timestamp": true
	},
	"dns": {
		"servers": [{
				"type": "https",
				"tag": "AliDNS",
				"server": "223.5.5.5",
				"server_port": 443,
				"path": "/dns-query",
				"detour": "direct-out"
			}],
		"rules": [],
		"final": "AliDNS",
		"strategy": "ipv4_only",
		"disable_cache": false,
		"disable_expire": false
	},
	"ntp": {
		
	},
	"certificate": {},
	"endpoints": [],
	"inbounds": [{
			"type": "tun",
			"tag": "tun-in",
			"interface_name": "sing-tun",
			"address": [
				"172.18.0.1/30"
			],
			"auto_route": true,
			"auto_redirect": true,
			"strict_route": true,
			"stack": "gvisor"
		}],
	"outbounds": [ {
			"type": "direct",
			"tag": "direct-out",
			"bind_interface": "eth-wan",
			"domain_resolver": "AliDNS"
		}],
	"route": {
		"rules": [{
				"network": ["icmp"],
				"action": "bypass"
			},{
				"action": "sniff",
				"sniffer": ["dns"],
				"timeout": "300ms"
			}, {
				"protocol": ["dns"],
				"action": "hijack-dns"
			}
		],
		"rule_set": [],
		"final": "direct-out",
		"auto_detect_interface": false,
		"default_interface": "eth-wan",
		"default_domain_resolver": "AliDNS"
	},
	"services": [],
	"experimental": {
		
	}
}
```

以上是还原该问题的完整配置
auto_redirect 为 true :  可以上网,不能ping
auto_redirect 为false:   无法上网,可以ping

### 日志

```shell
tcpdump: verbose output suppressed, use -v[v]... for full protocol decode
listening on eth-wan, link-type EN10MB (Ethernet), snapshot length 262144 bytes
10:08:55.431441 IP localhost.localdomain > 1.14.242.168: ICMP echo request, id 65534, seq 3409, length 40
10:08:55.443421 IP 1.14.242.168 > localhost.localdomain: ICMP echo reply, id 65534, seq 3409, length 40
10:08:56.051413 IP localhost.localdomain > 1.14.242.49: ICMP echo request, id 65534, seq 3410, length 40
10:08:56.066302 IP 1.14.242.49 > localhost.localdomain: ICMP echo reply, id 65534, seq 3410, length 40


从tcpdump看已经收到回包了,只是没有把回报返回给请求方
```

### 支持我们

- [ ] 我已经 [赞助](https://github.com/sponsors/nekohasekai/)

### 完整性要求

- [x] 我保证阅读了文档，了解所有我编写的配置文件项的含义，而不是大量堆砌看似有用的选项或默认值。
- [x] 我保证提供了可以在本地重现该问题的服务器、客户端配置文件与流程，而不是一个脱敏的复杂客户端配置文件。
- [x] 我保证提供了可用于重现我报告的错误的最简配置，而不是依赖远程服务器、TUN、图形界面客户端或者其他闭源软件。
- [x] 我保证提供了完整的配置文件与日志，而不是出于对自身智力的自信而仅提供了部分认为有用的部分。

**Comment by xiandu999-yu** [comment]
试了一下把auto_redirect和strict_route关了，差点登不上OpenWrt后台...
