### ISSUE TITLE
Wireguard keepalives stops working when device is put to sleep (screen turned off) (clone of #3401)

### ISSUE THREAD

**Issue by mustkara** [SagerNet/sing-box#3402]
### Operating system

Android

### System version

16

### Installation type

sing-box for Android Graphical Client

### If you are using a graphical client, please provide the version of the client.

All versions

### Version

```shell

```

### Description

This is a clone of the closed ticket https://github.com/SagerNet/sing-box/issues/3401.

I am using the stock Android firmware on pixel 9 so not a custom rom or anything non-standard.
As requested, will provide the reproduction steps with a config below.

This is not related to some custom rom bug but rather looks like a bug on the golang compiler itself. As mentioned on the linked ticket (https://github.com/celzero/rethink-app/issues/2170).

Please note that this does not happen on the official wireguard app which seem to be build with a patched golang compiler to prevent it from ignoring the time spent during the device asleep (the patch to switch to CLOCK_BOOTTIME instead of CLOCK_MONOTONIC) so it works there but I did not see it working as expected on any other wireguard capable app.

Please take the time to go through the discussion on the ticket above with details about the golang compiler patch:

https://git.zx2c4.com/wireguard-android/tree/tunnel/tools/libwg-go/goruntime-boottime-over-monotonic.diff?h=1.0.20250531

### Reproduction

Create a minimal  config with a wireguard endpoint wihth keepalive enabled. No inbound traffic is expected as we only want to observe keepalives:
```
{
  "endpoints": [
    {
      "type": "wireguard",
      "tag": "wgtag",
      "mtu": 1380,
      "address": "192.168.202.22/32",
      "private_key": "wg private key",
      "peers": [
        {
          "address": "serverip",
          "port": 12345,
          "public_key": "server public key"
          "allowed_ips": "0.0.0.0/0",
          "persistent_keepalive_interval": 5
        }
      ]
    }
  ],
  "inbounds": [
    {
      "type": "socks",
      "tag": "socks-in",
      "listen": "127.0.0.1",
      "listen_port": 9052
    }
  ],
  "outbounds": [
    {
      "type": "direct",
      "tag": "direct"
    }
  ]
}
```

On remote endpoint, observe keepalive activity with tcpdump after finding out the source port selected by the sing-box:
```
#  wg show wg0
.
.
peer: <peer public key>
  endpoint: 192.168.178.1:34952
  allowed ips: 192.168.202.22/32
  latest handshake: 3 minutes, 21 seconds ago
  transfer: 51.15 MiB received, 1.37 GiB sent
.
.

```

When the screen is turned on, observe that keepalives are coming in every 5 seconds on remote server and they stop when the screen is turned off and resume after turning the screen on again (note: device needs to be unplugged from power supply to trigger sleeping):
```
# tcpdump -i wlo1 -nl port 34952 -Q in
tcpdump: verbose output suppressed, use -v[v]... for full protocol decode
listening on wlo1, link-type EN10MB (Ethernet), snapshot length 262144 bytes
15:52:46.890850 IP 192.168.178.1.34952 > 192.168.1.10.10111: UDP, length 32
15:52:51.930943 IP 192.168.178.1.34952 > 192.168.1.10.10111: UDP, length 32
15:52:56.984632 IP 192.168.178.1.34952 > 192.168.1.10.10111: UDP, length 32
15:53:01.918817 IP 192.168.178.1.34952 > 192.168.1.10.10111: UDP, length 32
.
.  no keepalives when the screen off and then they continue after turning the screen back on
.
.
15:54:01.003613 IP 192.168.178.1.34952 > 192.168.1.10.10111: UDP, length 32
15:54:05.937603 IP 192.168.178.1.34952 > 192.168.1.10.10111: UDP, length 32
```

### Logs

```shell

```

### Supporter

- [ ] I am a [sponsor](https://github.com/sponsors/nekohasekai/)

### Integrity requirements

- [x] I confirm that I have read the documentation, understand the meaning of all the configuration items I wrote, and did not pile up seemingly useful options or default values.
- [x] I confirm that I have provided the server and client configuration files and process that can be reproduced locally, instead of a complicated client configuration file that has been stripped of sensitive data.
- [x] I confirm that I have provided the simplest configuration that can be used to reproduce the error I reported, instead of depending on remote servers, TUN, graphical interface clients, or other closed-source software.
- [x] I confirm that I have provided the complete configuration files and logs, rather than just providing parts I think are useful out of confidence in my own intelligence.

**Comment by mustkara** [comment]
An update from my side: I finally managed to build the sing-box app and run on my own device. I patched the golang with the change I mentioned previously for CLOCK_BOOTTIME but it causes some other issues, specifically "go get" calls are failing with the change. With the idea that it might still work if I do the "go get"s with vanilla go binary, I managed to build the "libbox.aar" but still I do not see any improvement on my device. So, issue might be something else.

**Comment by mustkara** [comment]
Another update: I have no idea what was wrong in my previous trial but building the SFA app with a patched golang (go version go1.25.1) fixes the issue but I also had to make other changes:
 -  onPauseUpdated() @ transport/wireguard/endpoint.go: disable wireguard iface up/down on device pause/wake 
 - NewTimer() @ sagernet/wireguard-go@v0.0.1-beta.7/device/timers.go: disable the sagernet change to stop the timers on pause:
```
                if pauseManager := peer.device.pauseManager; pauseManager != nil { 
                        pauseManager.WaitActive()
                }
```

**Comment by Danstiv** [comment]
Reproducible on 1.12.12

**Comment by Danstiv** [comment]
Reproducible on 1.12.19

**Comment by imjuzcy** [comment]
For anyone interested, here is my script to build `sing-box-for-android` with patched Go in Docker container using image `ubuntu:24.04`:

<details>
<summary>Build script</summary>

```shell

#!/bin/bash

# Environment variables
export NDK_VERSION=28.0.13004108
export GO_VERSION=1.26.0
export SING_BOX_TAG=v1.13.0-rc.4
export WIREGUARD_GO_TAG=v0.0.2-beta.1

export ANDROID_HOME=/opt/android-sdk
export ANDROID_NDK_HOME=${ANDROID_HOME}/ndk/${NDK_VERSION}
export GOROOT=/opt/go
export GOPATH=/root/go
export PATH=${GOROOT}/bin:${GOPATH}/bin:${ANDROID_HOME}/cmdline-tools/latest/bin:${ANDROID_HOME}/platform-tools:${PATH}

# Install dependencies
apt-get update && apt-get install -y \
    git \
    wget \
    curl \
    unzip \
    build-essential \
    openjdk-25-jdk-headless \
    patch \
    && rm -rf /var/lib/apt/lists/*

# 1. Install Android SDK and NDK
mkdir -p /opt
cd /opt
mkdir -p ${ANDROID_HOME}/cmdline-tools \
    && wget -q https://dl.google.com/android/repository/commandlinetools-linux-11076708_latest.zip -O cmdline-tools.zip \
    && unzip -q cmdline-tools.zip -d /tmp \
    && yes | /tmp/cmdline-tools/bin/sdkmanager --sdk_root="$ANDROID_HOME" 'cmdline-tools;latest' \
    && rm -r cmdline-tools.zip /tmp/cmdline-tools

# Install SDK packages (Platform 36, Build-Tools 36.0.0, NDK 28)
yes | sdkmanager "platforms;android-36" "build-tools;36.0.0" "ndk;${NDK_VERSION}" "platform-tools"

# 2. Build Go 1.26.0 from Source with Patch
mkdir -p /opt/go-bootstrap
cd /opt/go-bootstrap
wget -O /tmp/go.tar.gz -q https://go.dev/dl/go${GO_VERSION}.linux-amd64.tar.gz \
    && tar -C . --strip-components=1 -xf /tmp/go.tar.gz

# Download Go Source
mkdir -p /opt
cd /opt
wget -q https://go.dev/dl/go${GO_VERSION}.src.tar.gz \
    && tar -xf go${GO_VERSION}.src.tar.gz \
    && rm go${GO_VERSION}.src.tar.gz

# Download and Apply the Patch
mkdir -p /opt/go
cd /opt/go
wget -O - -q https://git.zx2c4.com/wireguard-android/plain/tunnel/tools/libwg-go/goruntime-boottime-over-monotonic.diff | patch -p1

# Compile Go
mkdir -p /opt/go/src
cd /opt/go/src
GOROOT_BOOTSTRAP=/opt/go-bootstrap ./make.bash

mkdir -p /build/wireguard-go
cd /build/wireguard-go
git clone https://github.com/SagerNet/wireguard-go.git . \
    && git checkout ${WIREGUARD_GO_TAG}
sed -i '/pauseManager.WaitActive()/d' device/timers.go

# 3. Setup Build Directory for sing-box
mkdir -p /build/sing-box
cd /build/sing-box
# Clone sing-box and checkout the specific tag
git clone --recurse-submodules https://github.com/SagerNet/sing-box.git . \
    && git checkout ${SING_BOX_TAG} \
    && git submodule update --init --recursive
sed -i -e '/e.device.Down()/d' -e '/e.device.Up()/d' transport/wireguard/endpoint.go
go mod edit -replace github.com/sagernet/wireguard-go=../wireguard-go

# 4. Build the Go Library (libbox.aar)
sed -i -e '/java version should be openjdk 17/d' cmd/internal/build_libbox/main.go \
    && make lib_install

# 'make lib_android' builds the AAR file using the NDK
ANDROID_TARGET=android/arm64 make lib_android

# Move the generated AAR to the Android project libs folder
mkdir -p clients/android/app/libs \
    && mv libbox.aar clients/android/app/libs/

# 5. Build the APK
cd /build/sing-box/clients/android
sed -i 's/getProps("KEYSTORE_PASS")/System.getenv("KEYSTORE_PASS")/g' app/build.gradle.kts \
    && sed -i 's/getProps("ALIAS_NAME")/System.getenv("ALIAS_NAME")/g' app/build.gradle.kts \
    && sed -i 's/getProps("ALIAS_PASS")/System.getenv("KEYSTORE_PASS")/g' app/build.gradle.kts
cp /data/signing/release.keystore /build/sing-box/clients/android/app/release.keystore
./gradlew assembleOtherRelease
cp -r ./app/build/outputs/apk/other/release /data
```

</details>

You'll have to sign the APK yourself by providing your own keystore, of course.

```
docker run --rm -it -v /home/fedora/sing-box:/data:z --secret sing-box-keystore-pass,type=env,target=KEYSTORE_PASS --env ALIAS_NAME=release ubuntu:24.04
```

Also, duplicate of #3546 ?

**Comment by Danstiv** [comment]
Reproducible on 1.13.9.

**Comment by Danstiv** [comment]
Reproducible on 1.13.13.

**Comment by Danstiv** [comment]
Reproducible on 1.13.19.
