### ISSUE TITLE
having sing-box manage a tunnel with strict rdp fails

### ISSUE THREAD

**Issue by anewusers** [SagerNet/sing-box#3039]
### Operating system

Linux

### System version

Debian Bookworm

### Installation type

Original sing-box Command Line

### If you are using a graphical client, please provide the version of the client.

N/A

### Version

```shell
sing-box version
sing-box version 1.12.0-beta.19
 
Environment: go1.24.3 linux/amd64
Tags: with_gvisor,with_quic,with_dhcp,with_wireguard,with_utls,with_acme,with_clash_api,with_tailscale
Revision: b9092f666e6bd041f53dbe02169d1048d83fc1fb
CGO: disabled
```

### Description

```shell
6.1.0-31-amd64

PRETTY_NAME="Debian GNU/Linux 12 (bookworm)"
NAME="Debian GNU/Linux"
VERSION_ID="12"
VERSION="12 (bookworm)"
VERSION_CODENAME=bookworm
ID=debian
HOME_URL="https://www.debian.org/"
SUPPORT_URL="https://www.debian.org/support"
BUG_REPORT_URL="https://bugs.debian.org/"
```

When Sing-box is configured with a ```TUN``` inbound interface using ```strict_route: true```, the xrdp service fails to establish a session. Log shows the xrdp process (listening on port 3389) times out when attempting to connect to the xrdp-sesman process on the loopback interface (```127.0.0.1:3350``` or ```::1:3350```).

This failure occurs even when Sing-box routing rules are in place to explicitly allow loopback traffic and/or traffic from xrdp and xrdp-sesman processes to use a direct-out path.

The RDP connection works correctly when Sing-box is not running or when the TUN inbound has strict_route: false.

turning off strict mode allows the connection but I am not sure what else could slip through. I tried allowing those ephimeral ip addresses to allow rdp and rdp-sesman to communicate but they just do not.

The traffic never seems to make it back into sing-box as there are no logs there, only tcp dump allows me to get a glimpse into what's happening.

### Reproduction

I am using socks5 proxy in this case.

```json
{
    "log": {
        "disabled": false,
        "level": "warn",
        "timestamp": true
    },
    "dns": {
        "servers": [
            {
                "type": "tcp",
                "tag": "google",
                "server": "8.8.8.8",
                "detour": "socks-out",
                "server_port": 53
            }
        ],
        "final": "google",
        "rules": [
        ]
    },
    "inbounds": [
        {
            "type": "tun",
            "tag": "tun-in",
            "interface_name": "tun0",
            "address": [
              "x.x.x.x/30"
            ],
	    "mtu": 1500,
            "sniff": true,
            "auto_route": true,
            "auto_redirect": true,
            "strict_route": true //change this to false and the rdp works but I would prefer not to
        }
    ],
    "outbounds": [
        {
            "type": "socks",
            "tag": "socks-out",
            "version": "{socks_proxy_version}",
            "server": "{socks_proxy_ip_address}",
            "server_port": {socks_proxy_port},
            "username": "{socks_proxy_username}",
            "password": "{socks_proxy_password}",
            "domain_resolver": {
               "server": "google",
               "rewrite_ttl": 60
            }
        },
        {
          "type": "direct",
          "tag": "direct-out"
        },
        {
          "type": "block",
          "tag": "block-out"
        }
    ],
    "route": {
        "auto_detect_interface": true,
        "rules": [
            { //trying stuff
                "network": "loopback",
                "outbound": "direct-out"
            },
            {     //trying stuff
                "source_port": [3389, 3350],
                "outbound": "direct-out"
            },
            {  //trying stuff
               "port": [3389, 3350],
               "outbound": "direct-out"
            },
          {  //trying stuff
            "ip_version": 6,
            "outbound": "block-out"
          },
          {
            "protocol": "quic",
            "outbound": "block-out"
          },
          {
            "protocol": "dns",
            "action": "hijack-dns"
          },
          {
            "outbound": "socks-out"
          }
        ],
	"final": "block-out"
    }
}
```

### Logs

```shell
12:00:45.575264 IP (tos 0x0, ttl 64, id 16759, offset 0, flags [DF], proto TCP (6), length 60)
    127.0.0.1.34938 > 127.0.0.1.3389: Flags [S], cksum 0xfe30 (incorrect -> 0xbdb7), seq 312254568, win 65495, options [mss 65495,sackOK,TS val 2853281660 ecr 0,nop,wscale 7], length 0
12:00:45.575286 IP (tos 0x0, ttl 64, id 0, offset 0, flags [DF], proto TCP (6), length 60)
    127.0.0.1.3389 > 127.0.0.1.34938: Flags [S.], cksum 0xfe30 (incorrect -> 0x0aec), seq 2444744576, ack 312254569, win 65483, options [mss 65495,sackOK,TS val 2853281660 ecr 2853281660,nop,wscale 7], length 0
12:00:45.575308 IP (tos 0x0, ttl 64, id 16760, offset 0, flags [DF], proto TCP (6), length 52)
    127.0.0.1.34938 > 127.0.0.1.3389: Flags [.], cksum 0xfe28 (incorrect -> 0x31a8), ack 1, win 512, options [nop,nop,TS val 2853281660 ecr 2853281660], length 0
12:00:45.575533 IP (tos 0x0, ttl 64, id 16761, offset 0, flags [DF], proto TCP (6), length 71)
    127.0.0.1.34938 > 127.0.0.1.3389: Flags [P.], cksum 0xfe3b (incorrect -> 0x1f8e), seq 1:20, ack 1, win 512, options [nop,nop,TS val 2853281660 ecr 2853281660], length 19
12:00:45.575555 IP (tos 0x0, ttl 64, id 9541, offset 0, flags [DF], proto TCP (6), length 52)
    127.0.0.1.3389 > 127.0.0.1.34938: Flags [.], cksum 0xfe28 (incorrect -> 0x3195), ack 20, win 512, options [nop,nop,TS val 2853281660 ecr 2853281660], length 0
12:00:45.578801 IP (tos 0x0, ttl 64, id 9542, offset 0, flags [DF], proto TCP (6), length 71)
    127.0.0.1.3389 > 127.0.0.1.34938: Flags [P.], cksum 0xfe3b (incorrect -> 0x0c54), seq 1:20, ack 20, win 512, options [nop,nop,TS val 2853281664 ecr 2853281660], length 19
12:00:45.578811 IP (tos 0x0, ttl 64, id 16762, offset 0, flags [DF], proto TCP (6), length 52)
    127.0.0.1.34938 > 127.0.0.1.3389: Flags [.], cksum 0xfe28 (incorrect -> 0x317a), ack 20, win 512, options [nop,nop,TS val 2853281664 ecr 2853281664], length 0
12:00:47.991310 IP (tos 0x0, ttl 64, id 34539, offset 0, flags [DF], proto TCP (6), length 1091)
    127.0.0.1.3389 > 127.0.0.1.50164: Flags [P.], cksum 0x0238 (incorrect -> 0x824e), seq 2101884220:2101885259, ack 3359159210, win 512, options [nop,nop,TS val 2853284076 ecr 2853273692], length 1039
12:00:47.991338 IP (tos 0x0, ttl 64, id 0, offset 0, flags [DF], proto TCP (6), length 40)
    127.0.0.1.50164 > 127.0.0.1.3389: Flags [R], cksum 0x64c9 (correct), seq 3359159210, win 0, length 0
12:00:48.644929 IP (tos 0x0, ttl 64, id 16763, offset 0, flags [DF], proto TCP (6), length 1607)
    127.0.0.1.34938 > 127.0.0.1.3389: Flags [P.], cksum 0x043c (incorrect -> 0xf0ac), seq 20:1575, ack 20, win 512, options [nop,nop,TS val 2853284730 ecr 2853281664], length 1555
12:00:48.650097 IP (tos 0x0, ttl 64, id 9543, offset 0, flags [DF], proto TCP (6), length 1444)
    127.0.0.1.3389 > 127.0.0.1.34938: Flags [P.], cksum 0x0399 (incorrect -> 0xdf06), seq 20:1412, ack 1575, win 512, options [nop,nop,TS val 2853284735 ecr 2853284730], length 1392
12:00:48.650128 IP (tos 0x0, ttl 64, id 16764, offset 0, flags [DF], proto TCP (6), length 52)
    127.0.0.1.34938 > 127.0.0.1.3389: Flags [.], cksum 0xfe28 (incorrect -> 0x0e03), ack 1412, win 502, options [nop,nop,TS val 2853284735 ecr 2853284735], length 0
12:00:48.652162 IP (tos 0x0, ttl 64, id 16765, offset 0, flags [DF], proto TCP (6), length 132)
    127.0.0.1.34938 > 127.0.0.1.3389: Flags [P.], cksum 0xfe78 (incorrect -> 0x04ff), seq 1575:1655, ack 1412, win 512, options [nop,nop,TS val 2853284737 ecr 2853284735], length 80
12:00:48.652466 IP (tos 0x0, ttl 64, id 9544, offset 0, flags [DF], proto TCP (6), length 307)
    127.0.0.1.3389 > 127.0.0.1.34938: Flags [P.], cksum 0xff27 (incorrect -> 0xe217), seq 1412:1667, ack 1655, win 512, options [nop,nop,TS val 2853284737 ecr 2853284737], length 255
12:00:48.652594 IP (tos 0x0, ttl 64, id 9545, offset 0, flags [DF], proto TCP (6), length 307)
    127.0.0.1.3389 > 127.0.0.1.34938: Flags [P.], cksum 0xff27 (incorrect -> 0x46ad), seq 1667:1922, ack 1655, win 512, options [nop,nop,TS val 2853284737 ecr 2853284737], length 255
12:00:48.652622 IP (tos 0x0, ttl 64, id 16766, offset 0, flags [DF], proto TCP (6), length 52)
    127.0.0.1.34938 > 127.0.0.1.3389: Flags [.], cksum 0xfe28 (incorrect -> 0x0ba7), ack 1922, win 512, options [nop,nop,TS val 2853284737 ecr 2853284737], length 0
12:00:48.666295 IP (tos 0x0, ttl 64, id 16767, offset 0, flags [DF], proto TCP (6), length 541)
    127.0.0.1.34938 > 127.0.0.1.3389: Flags [P.], cksum 0x0012 (incorrect -> 0x7f39), seq 1655:2144, ack 1922, win 512, options [nop,nop,TS val 2853284751 ecr 2853284737], length 489
12:00:48.667820 IP (tos 0x0, ttl 64, id 9546, offset 0, flags [DF], proto TCP (6), length 183)
    127.0.0.1.3389 > 127.0.0.1.34938: Flags [P.], cksum 0xfeab (incorrect -> 0x5aed), seq 1922:2053, ack 2144, win 512, options [nop,nop,TS val 2853284753 ecr 2853284751], length 131
12:00:48.669385 IP (tos 0x0, ttl 64, id 16768, offset 0, flags [DF], proto TCP (6), length 86)
    127.0.0.1.34938 > 127.0.0.1.3389: Flags [P.], cksum 0xfe4a (incorrect -> 0x6286), seq 2144:2178, ack 2053, win 512, options [nop,nop,TS val 2853284754 ecr 2853284753], length 34
12:00:48.669732 IP (tos 0x0, ttl 64, id 16769, offset 0, flags [DF], proto TCP (6), length 82)
    127.0.0.1.34938 > 127.0.0.1.3389: Flags [P.], cksum 0xfe46 (incorrect -> 0x3dd3), seq 2178:2208, ack 2053, win 512, options [nop,nop,TS val 2853284755 ecr 2853284753], length 30
12:00:48.669769 IP (tos 0x0, ttl 64, id 9547, offset 0, flags [DF], proto TCP (6), length 52)
    127.0.0.1.3389 > 127.0.0.1.34938: Flags [.], cksum 0xfe28 (incorrect -> 0x08d8), ack 2208, win 512, options [nop,nop,TS val 2853284755 ecr 2853284754], length 0
12:00:48.669818 IP (tos 0x0, ttl 64, id 9548, offset 0, flags [DF], proto TCP (6), length 85)
    127.0.0.1.3389 > 127.0.0.1.34938: Flags [P.], cksum 0xfe49 (incorrect -> 0x5cca), seq 2053:2086, ack 2208, win 512, options [nop,nop,TS val 2853284755 ecr 2853284754], length 33
12:00:48.671143 IP (tos 0x0, ttl 64, id 16770, offset 0, flags [DF], proto TCP (6), length 86)
    127.0.0.1.34938 > 127.0.0.1.3389: Flags [P.], cksum 0xfe4a (incorrect -> 0xa454), seq 2208:2242, ack 2086, win 512, options [nop,nop,TS val 2853284756 ecr 2853284755], length 34
12:00:48.671218 IP (tos 0x0, ttl 64, id 9549, offset 0, flags [DF], proto TCP (6), length 89)
    127.0.0.1.3389 > 127.0.0.1.34938: Flags [P.], cksum 0xfe4d (incorrect -> 0xba45), seq 2086:2123, ack 2242, win 512, options [nop,nop,TS val 2853284756 ecr 2853284756], length 37
12:00:48.672787 IP (tos 0x0, ttl 64, id 16771, offset 0, flags [DF], proto TCP (6), length 86)
    127.0.0.1.34938 > 127.0.0.1.3389: Flags [P.], cksum 0xfe4a (incorrect -> 0xd3bc), seq 2242:2276, ack 2123, win 512, options [nop,nop,TS val 2853284758 ecr 2853284756], length 34
12:00:48.672847 IP (tos 0x0, ttl 64, id 9550, offset 0, flags [DF], proto TCP (6), length 89)
    127.0.0.1.3389 > 127.0.0.1.34938: Flags [P.], cksum 0xfe4d (incorrect -> 0x5dad), seq 2123:2160, ack 2276, win 512, options [nop,nop,TS val 2853284758 ecr 2853284758], length 37
12:00:48.674354 IP (tos 0x0, ttl 64, id 16772, offset 0, flags [DF], proto TCP (6), length 86)
    127.0.0.1.34938 > 127.0.0.1.3389: Flags [P.], cksum 0xfe4a (incorrect -> 0x7a26), seq 2276:2310, ack 2160, win 512, options [nop,nop,TS val 2853284759 ecr 2853284758], length 34
12:00:48.674426 IP (tos 0x0, ttl 64, id 9551, offset 0, flags [DF], proto TCP (6), length 89)
    127.0.0.1.3389 > 127.0.0.1.34938: Flags [P.], cksum 0xfe4d (incorrect -> 0x296c), seq 2160:2197, ack 2310, win 512, options [nop,nop,TS val 2853284759 ecr 2853284759], length 37
12:00:48.676786 IP (tos 0x0, ttl 64, id 16773, offset 0, flags [DF], proto TCP (6), length 86)
    127.0.0.1.34938 > 127.0.0.1.3389: Flags [P.], cksum 0xfe4a (incorrect -> 0x490d), seq 2310:2344, ack 2197, win 512, options [nop,nop,TS val 2853284762 ecr 2853284759], length 34
12:00:48.676845 IP (tos 0x0, ttl 64, id 9552, offset 0, flags [DF], proto TCP (6), length 89)
    127.0.0.1.3389 > 127.0.0.1.34938: Flags [P.], cksum 0xfe4d (incorrect -> 0xff81), seq 2197:2234, ack 2344, win 512, options [nop,nop,TS val 2853284762 ecr 2853284762], length 37
12:00:48.678361 IP (tos 0x0, ttl 64, id 16774, offset 0, flags [DF], proto TCP (6), length 86)
    127.0.0.1.34938 > 127.0.0.1.3389: Flags [P.], cksum 0xfe4a (incorrect -> 0xda06), seq 2344:2378, ack 2234, win 512, options [nop,nop,TS val 2853284763 ecr 2853284762], length 34
12:00:48.678494 IP (tos 0x0, ttl 64, id 9553, offset 0, flags [DF], proto TCP (6), length 89)
    127.0.0.1.3389 > 127.0.0.1.34938: Flags [P.], cksum 0xfe4d (incorrect -> 0x1896), seq 2234:2271, ack 2378, win 512, options [nop,nop,TS val 2853284763 ecr 2853284763], length 37
12:00:48.680289 IP (tos 0x0, ttl 64, id 16775, offset 0, flags [DF], proto TCP (6), length 86)
    127.0.0.1.34938 > 127.0.0.1.3389: Flags [P.], cksum 0xfe4a (incorrect -> 0x08f3), seq 2378:2412, ack 2271, win 512, options [nop,nop,TS val 2853284765 ecr 2853284763], length 34
12:00:48.680357 IP (tos 0x0, ttl 64, id 9554, offset 0, flags [DF], proto TCP (6), length 89)
    127.0.0.1.3389 > 127.0.0.1.34938: Flags [P.], cksum 0xfe4d (incorrect -> 0x4ae1), seq 2271:2308, ack 2412, win 512, options [nop,nop,TS val 2853284765 ecr 2853284765], length 37
12:00:48.682265 IP (tos 0x0, ttl 64, id 16776, offset 0, flags [DF], proto TCP (6), length 425)
    127.0.0.1.34938 > 127.0.0.1.3389: Flags [P.], cksum 0xff9d (incorrect -> 0x3c61), seq 2412:2785, ack 2308, win 512, options [nop,nop,TS val 2853284767 ecr 2853284765], length 373
12:00:48.682350 IP (tos 0x0, ttl 64, id 9555, offset 0, flags [DF], proto TCP (6), length 411)
    127.0.0.1.3389 > 127.0.0.1.34938: Flags [P.], cksum 0xff8f (incorrect -> 0x0a30), seq 2308:2667, ack 2785, win 512, options [nop,nop,TS val 2853284767 ecr 2853284767], length 359
12:00:48.684039 IP (tos 0x0, ttl 64, id 16777, offset 0, flags [DF], proto TCP (6), length 231)
    127.0.0.1.34938 > 127.0.0.1.3389: Flags [P.], cksum 0xfedb (incorrect -> 0xed68), seq 2785:2964, ack 2667, win 512, options [nop,nop,TS val 2853284769 ecr 2853284767], length 179
12:00:48.684070 IP (tos 0x0, ttl 64, id 9556, offset 0, flags [DF], proto TCP (6), length 108)
    127.0.0.1.3389 > 127.0.0.1.34938: Flags [P.], cksum 0xfe60 (incorrect -> 0x738e), seq 2667:2723, ack 2964, win 512, options [nop,nop,TS val 2853284769 ecr 2853284769], length 56
12:00:48.684085 IP (tos 0x0, ttl 64, id 9557, offset 0, flags [DF], proto TCP (6), length 499)
    127.0.0.1.3389 > 127.0.0.1.34938: Flags [P.], cksum 0xffe7 (incorrect -> 0x64c8), seq 2723:3170, ack 2964, win 512, options [nop,nop,TS val 2853284769 ecr 2853284769], length 447
12:00:48.684099 IP (tos 0x0, ttl 64, id 16778, offset 0, flags [DF], proto TCP (6), length 52)
    127.0.0.1.34938 > 127.0.0.1.3389: Flags [.], cksum 0xfe28 (incorrect -> 0x016a), ack 3170, win 512, options [nop,nop,TS val 2853284769 ecr 2853284769], length 0
12:00:48.685806 IP (tos 0x0, ttl 64, id 16779, offset 0, flags [DF], proto TCP (6), length 636)
    127.0.0.1.34938 > 127.0.0.1.3389: Flags [P.], cksum 0x0071 (incorrect -> 0x7358), seq 2964:3548, ack 3170, win 512, options [nop,nop,TS val 2853284771 ecr 2853284769], length 584
12:00:48.686107 IP (tos 0x0, ttl 64, id 16780, offset 0, flags [DF], proto TCP (6), length 300)
    127.0.0.1.34938 > 127.0.0.1.3389: Flags [P.], cksum 0xff20 (incorrect -> 0xb4a0), seq 3548:3796, ack 3170, win 512, options [nop,nop,TS val 2853284771 ecr 2853284769], length 248
12:00:48.686365 IP (tos 0x0, ttl 64, id 9558, offset 0, flags [DF], proto TCP (6), length 110)
    127.0.0.1.3389 > 127.0.0.1.34938: Flags [P.], cksum 0xfe62 (incorrect -> 0x09b2), seq 3170:3228, ack 3796, win 507, options [nop,nop,TS val 2853284771 ecr 2853284771], length 58
12:00:48.686379 IP (tos 0x0, ttl 64, id 9559, offset 0, flags [DF], proto TCP (6), length 114)
    127.0.0.1.3389 > 127.0.0.1.34938: Flags [P.], cksum 0xfe66 (incorrect -> 0x421f), seq 3228:3290, ack 3796, win 507, options [nop,nop,TS val 2853284771 ecr 2853284771], length 62
12:00:48.686387 IP (tos 0x0, ttl 64, id 9560, offset 0, flags [DF], proto TCP (6), length 114)
    127.0.0.1.3389 > 127.0.0.1.34938: Flags [P.], cksum 0xfe66 (incorrect -> 0x1adf), seq 3290:3352, ack 3796, win 507, options [nop,nop,TS val 2853284771 ecr 2853284771], length 62
12:00:48.686391 IP (tos 0x0, ttl 64, id 16781, offset 0, flags [DF], proto TCP (6), length 52)
    127.0.0.1.34938 > 127.0.0.1.3389: Flags [.], cksum 0xfe28 (incorrect -> 0xfdad), ack 3290, win 512, options [nop,nop,TS val 2853284771 ecr 2853284771], length 0
12:00:48.686401 IP (tos 0x0, ttl 64, id 9561, offset 0, flags [DF], proto TCP (6), length 114)
    127.0.0.1.3389 > 127.0.0.1.34938: Flags [P.], cksum 0xfe66 (incorrect -> 0x7689), seq 3352:3414, ack 3796, win 512, options [nop,nop,TS val 2853284771 ecr 2853284771], length 62
12:00:48.686426 IP (tos 0x0, ttl 64, id 16782, offset 0, flags [DF], proto TCP (6), length 52)
    127.0.0.1.34938 > 127.0.0.1.3389: Flags [.], cksum 0xfe28 (incorrect -> 0xfd31), ack 3414, win 512, options [nop,nop,TS val 2853284771 ecr 2853284771], length 0
12:00:48.686435 IP (tos 0x0, ttl 64, id 9562, offset 0, flags [DF], proto TCP (6), length 81)
    127.0.0.1.3389 > 127.0.0.1.34938: Flags [P.], cksum 0xfe45 (incorrect -> 0x0fb7), seq 3414:3443, ack 3796, win 512, options [nop,nop,TS val 2853284771 ecr 2853284771], length 29
12:00:48.686457 IP (tos 0x0, ttl 64, id 9563, offset 0, flags [DF], proto TCP (6), length 108)
    127.0.0.1.3389 > 127.0.0.1.34938: Flags [P.], cksum 0xfe60 (incorrect -> 0x80da), seq 3443:3499, ack 3796, win 512, options [nop,nop,TS val 2853284771 ecr 2853284771], length 56
12:00:48.686476 IP (tos 0x0, ttl 64, id 16783, offset 0, flags [DF], proto TCP (6), length 52)
    127.0.0.1.34938 > 127.0.0.1.3389: Flags [.], cksum 0xfe28 (incorrect -> 0xfcdc), ack 3499, win 512, options [nop,nop,TS val 2853284771 ecr 2853284771], length 0
12:00:48.687935 IP (tos 0x0, ttl 64, id 16784, offset 0, flags [DF], proto TCP (6), length 101)
    127.0.0.1.34938 > 127.0.0.1.3389: Flags [P.], cksum 0xfe59 (incorrect -> 0xa46d), seq 3796:3845, ack 3499, win 512, options [nop,nop,TS val 2853284773 ecr 2853284771], length 49
12:00:48.692877 IP (tos 0x0, ttl 64, id 9564, offset 0, flags [DF], proto TCP (6), length 260)
    127.0.0.1.3389 > 127.0.0.1.34938: Flags [P.], cksum 0xfef8 (incorrect -> 0xfdaf), seq 3499:3707, ack 3845, win 512, options [nop,nop,TS val 2853284778 ecr 2853284773], length 208
12:00:48.694320 IP (tos 0x0, ttl 64, id 9565, offset 0, flags [DF], proto TCP (6), length 298)
    127.0.0.1.3389 > 127.0.0.1.34938: Flags [P.], cksum 0xff1e (incorrect -> 0x9dbd), seq 3707:3953, ack 3845, win 512, options [nop,nop,TS val 2853284779 ecr 2853284773], length 246
12:00:48.694351 IP (tos 0x0, ttl 64, id 16785, offset 0, flags [DF], proto TCP (6), length 52)
    127.0.0.1.34938 > 127.0.0.1.3389: Flags [.], cksum 0xfe28 (incorrect -> 0xfad6), ack 3953, win 512, options [nop,nop,TS val 2853284779 ecr 2853284778], length 0
12:00:48.913180 IP (tos 0x0, ttl 64, id 16786, offset 0, flags [DF], proto TCP (6), length 105)
    127.0.0.1.34938 > 127.0.0.1.3389: Flags [P.], cksum 0xfe5d (incorrect -> 0x7497), seq 3845:3898, ack 3953, win 512, options [nop,nop,TS val 2853284998 ecr 2853284778], length 53
12:00:48.954764 IP (tos 0x0, ttl 64, id 9566, offset 0, flags [DF], proto TCP (6), length 52)
    127.0.0.1.3389 > 127.0.0.1.34938: Flags [.], cksum 0xfe28 (incorrect -> 0xf8c0), ack 3898, win 512, options [nop,nop,TS val 2853285040 ecr 2853284998], length 0
12:00:55.222354 IP (tos 0x0, ttl 64, id 16787, offset 0, flags [DF], proto TCP (6), length 84)
    127.0.0.1.34938 > 127.0.0.1.3389: Flags [P.], cksum 0xfe48 (incorrect -> 0x3805), seq 3898:3930, ack 3953, win 512, options [nop,nop,TS val 2853291307 ecr 2853285040], length 32
12:00:55.222374 IP (tos 0x0, ttl 64, id 9567, offset 0, flags [DF], proto TCP (6), length 52)
    127.0.0.1.3389 > 127.0.0.1.34938: Flags [.], cksum 0xfe28 (incorrect -> 0xc780), ack 3930, win 512, options [nop,nop,TS val 2853291307 ecr 2853291307], length 0
12:00:55.229356 IP (tos 0x0, ttl 64, id 16788, offset 0, flags [DF], proto TCP (6), length 84)
    127.0.0.1.34938 > 127.0.0.1.3389: Flags [P.], cksum 0xfe48 (incorrect -> 0x3a6d), seq 3930:3962, ack 3953, win 512, options [nop,nop,TS val 2853291314 ecr 2853291307], length 32
12:00:55.229371 IP (tos 0x0, ttl 64, id 9568, offset 0, flags [DF], proto TCP (6), length 52)
    127.0.0.1.3389 > 127.0.0.1.34938: Flags [.], cksum 0xfe28 (incorrect -> 0xc752), ack 3962, win 512, options [nop,nop,TS val 2853291314 ecr 2853291314], length 0
12:00:55.236655 IP (tos 0x0, ttl 64, id 16789, offset 0, flags [DF], proto TCP (6), length 84)
    127.0.0.1.34938 > 127.0.0.1.3389: Flags [P.], cksum 0xfe48 (incorrect -> 0x3ccc), seq 3962:3994, ack 3953, win 512, options [nop,nop,TS val 2853291321 ecr 2853291314], length 32
12:00:55.236670 IP (tos 0x0, ttl 64, id 9569, offset 0, flags [DF], proto TCP (6), length 52)
    127.0.0.1.3389 > 127.0.0.1.34938: Flags [.], cksum 0xfe28 (incorrect -> 0xc724), ack 3994, win 512, options [nop,nop,TS val 2853291321 ecr 2853291321], length 0
12:00:55.243285 IP (tos 0x0, ttl 64, id 16790, offset 0, flags [DF], proto TCP (6), length 84)
    127.0.0.1.34938 > 127.0.0.1.3389: Flags [P.], cksum 0xfe48 (incorrect -> 0xcffa), seq 3994:4026, ack 3953, win 512, options [nop,nop,TS val 2853291328 ecr 2853291321], length 32
12:00:55.243301 IP (tos 0x0, ttl 64, id 9570, offset 0, flags [DF], proto TCP (6), length 52)
    127.0.0.1.3389 > 127.0.0.1.34938: Flags [.], cksum 0xfe28 (incorrect -> 0xc6f6), ack 4026, win 512, options [nop,nop,TS val 2853291328 ecr 2853291328], length 0
12:00:55.250639 IP (tos 0x0, ttl 64, id 16791, offset 0, flags [DF], proto TCP (6), length 84)
    127.0.0.1.34938 > 127.0.0.1.3389: Flags [P.], cksum 0xfe48 (incorrect -> 0xdac7), seq 4026:4058, ack 3953, win 512, options [nop,nop,TS val 2853291335 ecr 2853291328], length 32
12:00:55.250652 IP (tos 0x0, ttl 64, id 9571, offset 0, flags [DF], proto TCP (6), length 52)
    127.0.0.1.3389 > 127.0.0.1.34938: Flags [.], cksum 0xfe28 (incorrect -> 0xc6c8), ack 4058, win 512, options [nop,nop,TS val 2853291335 ecr 2853291335], length 0
12:00:55.259361 IP (tos 0x0, ttl 64, id 16792, offset 0, flags [DF], proto TCP (6), length 84)
    127.0.0.1.34938 > 127.0.0.1.3389: Flags [P.], cksum 0xfe48 (incorrect -> 0xd20b), seq 4058:4090, ack 3953, win 512, options [nop,nop,TS val 2853291344 ecr 2853291335], length 32
12:00:55.259373 IP (tos 0x0, ttl 64, id 9572, offset 0, flags [DF], proto TCP (6), length 52)
    127.0.0.1.3389 > 127.0.0.1.34938: Flags [.], cksum 0xfe28 (incorrect -> 0xc696), ack 4090, win 512, options [nop,nop,TS val 2853291344 ecr 2853291344], length 0
12:00:55.266402 IP (tos 0x0, ttl 64, id 16793, offset 0, flags [DF], proto TCP (6), length 84)
    127.0.0.1.34938 > 127.0.0.1.3389: Flags [P.], cksum 0xfe48 (incorrect -> 0x0581), seq 4090:4122, ack 3953, win 512, options [nop,nop,TS val 2853291351 ecr 2853291344], length 32
12:00:55.266413 IP (tos 0x0, ttl 64, id 9573, offset 0, flags [DF], proto TCP (6), length 52)
    127.0.0.1.3389 > 127.0.0.1.34938: Flags [.], cksum 0xfe28 (incorrect -> 0xc668), ack 4122, win 512, options [nop,nop,TS val 2853291351 ecr 2853291351], length 0
12:00:55.278758 IP (tos 0x0, ttl 64, id 16794, offset 0, flags [DF], proto TCP (6), length 84)
    127.0.0.1.34938 > 127.0.0.1.3389: Flags [P.], cksum 0xfe48 (incorrect -> 0xe92b), seq 4122:4154, ack 3953, win 512, options [nop,nop,TS val 2853291364 ecr 2853291351], length 32
12:00:55.278771 IP (tos 0x0, ttl 64, id 9574, offset 0, flags [DF], proto TCP (6), length 52)
    127.0.0.1.3389 > 127.0.0.1.34938: Flags [.], cksum 0xfe28 (incorrect -> 0xc62e), ack 4154, win 512, options [nop,nop,TS val 2853291364 ecr 2853291364], length 0
12:00:55.280201 IP (tos 0x0, ttl 64, id 16795, offset 0, flags [DF], proto TCP (6), length 84)
    127.0.0.1.34938 > 127.0.0.1.3389: Flags [P.], cksum 0xfe48 (incorrect -> 0x9cba), seq 4154:4186, ack 3953, win 512, options [nop,nop,TS val 2853291365 ecr 2853291364], length 32
12:00:55.280214 IP (tos 0x0, ttl 64, id 9575, offset 0, flags [DF], proto TCP (6), length 52)
    127.0.0.1.3389 > 127.0.0.1.34938: Flags [.], cksum 0xfe28 (incorrect -> 0xc60c), ack 4186, win 512, options [nop,nop,TS val 2853291365 ecr 2853291365], length 0
12:00:55.286477 IP (tos 0x0, ttl 64, id 16796, offset 0, flags [DF], proto TCP (6), length 84)
    127.0.0.1.34938 > 127.0.0.1.3389: Flags [P.], cksum 0xfe48 (incorrect -> 0x0b89), seq 4186:4218, ack 3953, win 512, options [nop,nop,TS val 2853291371 ecr 2853291365], length 32
12:00:55.286490 IP (tos 0x0, ttl 64, id 9576, offset 0, flags [DF], proto TCP (6), length 52)
    127.0.0.1.3389 > 127.0.0.1.34938: Flags [.], cksum 0xfe28 (incorrect -> 0xc5e0), ack 4218, win 512, options [nop,nop,TS val 2853291371 ecr 2853291371], length 0
12:00:55.293829 IP (tos 0x0, ttl 64, id 16797, offset 0, flags [DF], proto TCP (6), length 84)
    127.0.0.1.34938 > 127.0.0.1.3389: Flags [P.], cksum 0xfe48 (incorrect -> 0x9937), seq 4218:4250, ack 3953, win 512, options [nop,nop,TS val 2853291379 ecr 2853291371], length 32
12:00:55.293842 IP (tos 0x0, ttl 64, id 9577, offset 0, flags [DF], proto TCP (6), length 52)
    127.0.0.1.3389 > 127.0.0.1.34938: Flags [.], cksum 0xfe28 (incorrect -> 0xc5b0), ack 4250, win 512, options [nop,nop,TS val 2853291379 ecr 2853291379], length 0
12:00:55.300957 IP (tos 0x0, ttl 64, id 16798, offset 0, flags [DF], proto TCP (6), length 84)
    127.0.0.1.34938 > 127.0.0.1.3389: Flags [P.], cksum 0xfe48 (incorrect -> 0x61cd), seq 4250:4282, ack 3953, win 512, options [nop,nop,TS val 2853291386 ecr 2853291379], length 32
12:00:55.300968 IP (tos 0x0, ttl 64, id 9578, offset 0, flags [DF], proto TCP (6), length 52)
    127.0.0.1.3389 > 127.0.0.1.34938: Flags [.], cksum 0xfe28 (incorrect -> 0xc582), ack 4282, win 512, options [nop,nop,TS val 2853291386 ecr 2853291386], length 0
12:00:55.307875 IP (tos 0x0, ttl 64, id 16799, offset 0, flags [DF], proto TCP (6), length 84)
    127.0.0.1.34938 > 127.0.0.1.3389: Flags [P.], cksum 0xfe48 (incorrect -> 0x924b), seq 4282:4314, ack 3953, win 512, options [nop,nop,TS val 2853291393 ecr 2853291386], length 32
12:00:55.307885 IP (tos 0x0, ttl 64, id 9579, offset 0, flags [DF], proto TCP (6), length 52)
    127.0.0.1.3389 > 127.0.0.1.34938: Flags [.], cksum 0xfe28 (incorrect -> 0xc554), ack 4314, win 512, options [nop,nop,TS val 2853291393 ecr 2853291393], length 0
12:00:55.314990 IP (tos 0x0, ttl 64, id 16800, offset 0, flags [DF], proto TCP (6), length 84)
    127.0.0.1.34938 > 127.0.0.1.3389: Flags [P.], cksum 0xfe48 (incorrect -> 0x0c1c), seq 4314:4346, ack 3953, win 512, options [nop,nop,TS val 2853291400 ecr 2853291393], length 32
12:00:55.315002 IP (tos 0x0, ttl 64, id 9580, offset 0, flags [DF], proto TCP (6), length 52)
    127.0.0.1.3389 > 127.0.0.1.34938: Flags [.], cksum 0xfe28 (incorrect -> 0xc526), ack 4346, win 512, options [nop,nop,TS val 2853291400 ecr 2853291400], length 0
12:00:55.321499 IP (tos 0x0, ttl 64, id 16801, offset 0, flags [DF], proto TCP (6), length 84)
    127.0.0.1.34938 > 127.0.0.1.3389: Flags [P.], cksum 0xfe48 (incorrect -> 0x8341), seq 4346:4378, ack 3953, win 512, options [nop,nop,TS val 2853291406 ecr 2853291400], length 32
12:00:55.321510 IP (tos 0x0, ttl 64, id 9581, offset 0, flags [DF], proto TCP (6), length 52)
    127.0.0.1.3389 > 127.0.0.1.34938: Flags [.], cksum 0xfe28 (incorrect -> 0xc4fa), ack 4378, win 512, options [nop,nop,TS val 2853291406 ecr 2853291406], length 0
12:00:55.328654 IP (tos 0x0, ttl 64, id 16802, offset 0, flags [DF], proto TCP (6), length 84)
    127.0.0.1.34938 > 127.0.0.1.3389: Flags [P.], cksum 0xfe48 (incorrect -> 0x790d), seq 4378:4410, ack 3953, win 512, options [nop,nop,TS val 2853291413 ecr 2853291406], length 32
12:00:55.328665 IP (tos 0x0, ttl 64, id 9582, offset 0, flags [DF], proto TCP (6), length 52)
    127.0.0.1.3389 > 127.0.0.1.34938: Flags [.], cksum 0xfe28 (incorrect -> 0xc4cc), ack 4410, win 512, options [nop,nop,TS val 2853291413 ecr 2853291413], length 0
12:00:55.335754 IP (tos 0x0, ttl 64, id 16803, offset 0, flags [DF], proto TCP (6), length 84)
    127.0.0.1.34938 > 127.0.0.1.3389: Flags [P.], cksum 0xfe48 (incorrect -> 0x32db), seq 4410:4442, ack 3953, win 512, options [nop,nop,TS val 2853291421 ecr 2853291413], length 32
12:00:55.350031 IP (tos 0x0, ttl 64, id 16804, offset 0, flags [DF], proto TCP (6), length 84)
    127.0.0.1.34938 > 127.0.0.1.3389: Flags [P.], cksum 0xfe48 (incorrect -> 0x0ad1), seq 4442:4474, ack 3953, win 512, options [nop,nop,TS val 2853291435 ecr 2853291413], length 32
12:00:55.354745 IP (tos 0x0, ttl 64, id 16805, offset 0, flags [DF], proto TCP (6), length 84)
    127.0.0.1.34938 > 127.0.0.1.3389: Flags [P.], cksum 0xfe48 (incorrect -> 0x0acc), seq 4442:4474, ack 3953, win 512, options [nop,nop,TS val 2853291440 ecr 2853291413], length 32
12:00:55.354758 IP (tos 0x0, ttl 64, id 9583, offset 0, flags [DF], proto TCP (6), length 64)
    127.0.0.1.3389 > 127.0.0.1.34938: Flags [.], cksum 0xfe34 (incorrect -> 0x0575), ack 4474, win 512, options [nop,nop,TS val 2853291440 ecr 2853291421,nop,nop,sack 1 {4442:4474}], length 0
12:00:55.364485 IP (tos 0x0, ttl 64, id 16806, offset 0, flags [DF], proto TCP (6), length 84)
    127.0.0.1.34938 > 127.0.0.1.3389: Flags [P.], cksum 0xfe48 (incorrect -> 0x5207), seq 4474:4506, ack 3953, win 512, options [nop,nop,TS val 2853291449 ecr 2853291440], length 32
12:00:55.364494 IP (tos 0x0, ttl 64, id 9584, offset 0, flags [DF], proto TCP (6), length 52)
    127.0.0.1.3389 > 127.0.0.1.34938: Flags [.], cksum 0xfe28 (incorrect -> 0xc424), ack 4506, win 512, options [nop,nop,TS val 2853291449 ecr 2853291449], length 0
12:00:55.378509 IP (tos 0x0, ttl 64, id 16807, offset 0, flags [DF], proto TCP (6), length 84)
    127.0.0.1.34938 > 127.0.0.1.3389: Flags [P.], cksum 0xfe48 (incorrect -> 0x7219), seq 4506:4538, ack 3953, win 512, options [nop,nop,TS val 2853291463 ecr 2853291449], length 32
12:00:55.378521 IP (tos 0x0, ttl 64, id 9585, offset 0, flags [DF], proto TCP (6), length 52)
    127.0.0.1.3389 > 127.0.0.1.34938: Flags [.], cksum 0xfe28 (incorrect -> 0xc3e8), ack 4538, win 512, options [nop,nop,TS val 2853291463 ecr 2853291463], length 0
12:00:55.385397 IP (tos 0x0, ttl 64, id 16808, offset 0, flags [DF], proto TCP (6), length 84)
    127.0.0.1.34938 > 127.0.0.1.3389: Flags [P.], cksum 0xfe48 (incorrect -> 0x3709), seq 4538:4570, ack 3953, win 512, options [nop,nop,TS val 2853291470 ecr 2853291463], length 32
12:00:55.385405 IP (tos 0x0, ttl 64, id 9586, offset 0, flags [DF], proto TCP (6), length 52)
    127.0.0.1.3389 > 127.0.0.1.34938: Flags [.], cksum 0xfe28 (incorrect -> 0xc3ba), ack 4570, win 512, options [nop,nop,TS val 2853291470 ecr 2853291470], length 0
12:00:55.392593 IP (tos 0x0, ttl 64, id 16809, offset 0, flags [DF], proto TCP (6), length 84)
    127.0.0.1.34938 > 127.0.0.1.3389: Flags [P.], cksum 0xfe48 (incorrect -> 0x1e76), seq 4570:4602, ack 3953, win 512, options [nop,nop,TS val 2853291477 ecr 2853291470], length 32
12:00:55.392605 IP (tos 0x0, ttl 64, id 9587, offset 0, flags [DF], proto TCP (6), length 52)
    127.0.0.1.3389 > 127.0.0.1.34938: Flags [.], cksum 0xfe28 (incorrect -> 0xc38c), ack 4602, win 512, options [nop,nop,TS val 2853291477 ecr 2853291477], length 0
12:00:55.399718 IP (tos 0x0, ttl 64, id 16810, offset 0, flags [DF], proto TCP (6), length 84)
    127.0.0.1.34938 > 127.0.0.1.3389: Flags [P.], cksum 0xfe48 (incorrect -> 0x7a77), seq 4602:4634, ack 3953, win 512, options [nop,nop,TS val 2853291485 ecr 2853291477], length 32
12:00:55.399726 IP (tos 0x0, ttl 64, id 9588, offset 0, flags [DF], proto TCP (6), length 52)
    127.0.0.1.3389 > 127.0.0.1.34938: Flags [.], cksum 0xfe28 (incorrect -> 0xc35c), ack 4634, win 512, options [nop,nop,TS val 2853291485 ecr 2853291485], length 0
12:00:55.406751 IP (tos 0x0, ttl 64, id 16811, offset 0, flags [DF], proto TCP (6), length 84)
    127.0.0.1.34938 > 127.0.0.1.3389: Flags [P.], cksum 0xfe48 (incorrect -> 0xd09d), seq 4634:4666, ack 3953, win 512, options [nop,nop,TS val 2853291492 ecr 2853291485], length 32
12:00:55.406758 IP (tos 0x0, ttl 64, id 9589, offset 0, flags [DF], proto TCP (6), length 52)
    127.0.0.1.3389 > 127.0.0.1.34938: Flags [.], cksum 0xfe28 (incorrect -> 0xc32e), ack 4666, win 512, options [nop,nop,TS val 2853291492 ecr 2853291492], length 0
12:00:55.413949 IP (tos 0x0, ttl 64, id 16812, offset 0, flags [DF], proto TCP (6), length 84)
    127.0.0.1.34938 > 127.0.0.1.3389: Flags [P.], cksum 0xfe48 (incorrect -> 0x1596), seq 4666:4698, ack 3953, win 512, options [nop,nop,TS val 2853291499 ecr 2853291492], length 32
12:00:55.413962 IP (tos 0x0, ttl 64, id 9590, offset 0, flags [DF], proto TCP (6), length 52)
    127.0.0.1.3389 > 127.0.0.1.34938: Flags [.], cksum 0xfe28 (incorrect -> 0xc300), ack 4698, win 512, options [nop,nop,TS val 2853291499 ecr 2853291499], length 0
12:00:55.421051 IP (tos 0x0, ttl 64, id 16813, offset 0, flags [DF], proto TCP (6), length 84)
    127.0.0.1.34938 > 127.0.0.1.3389: Flags [P.], cksum 0xfe48 (incorrect -> 0xad61), seq 4698:4730, ack 3953, win 512, options [nop,nop,TS val 2853291506 ecr 2853291499], length 32
12:00:55.421059 IP (tos 0x0, ttl 64, id 9591, offset 0, flags [DF], proto TCP (6), length 52)
    127.0.0.1.3389 > 127.0.0.1.34938: Flags [.], cksum 0xfe28 (incorrect -> 0xc2d2), ack 4730, win 512, options [nop,nop,TS val 2853291506 ecr 2853291506], length 0
12:00:55.428142 IP (tos 0x0, ttl 64, id 16814, offset 0, flags [DF], proto TCP (6), length 84)
    127.0.0.1.34938 > 127.0.0.1.3389: Flags [P.], cksum 0xfe48 (incorrect -> 0x317d), seq 4730:4762, ack 3953, win 512, options [nop,nop,TS val 2853291513 ecr 2853291506], length 32
12:00:55.428156 IP (tos 0x0, ttl 64, id 9592, offset 0, flags [DF], proto TCP (6), length 52)
    127.0.0.1.3389 > 127.0.0.1.34938: Flags [.], cksum 0xfe28 (incorrect -> 0xc2a4), ack 4762, win 512, options [nop,nop,TS val 2853291513 ecr 2853291513], length 0
12:00:55.435230 IP (tos 0x0, ttl 64, id 16815, offset 0, flags [DF], proto TCP (6), length 84)
    127.0.0.1.34938 > 127.0.0.1.3389: Flags [P.], cksum 0xfe48 (incorrect -> 0x9e64), seq 4762:4794, ack 3953, win 512, options [nop,nop,TS val 2853291520 ecr 2853291513], length 32
12:00:55.435241 IP (tos 0x0, ttl 64, id 9593, offset 0, flags [DF], proto TCP (6), length 52)
    127.0.0.1.3389 > 127.0.0.1.34938: Flags [.], cksum 0xfe28 (incorrect -> 0xc276), ack 4794, win 512, options [nop,nop,TS val 2853291520 ecr 2853291520], length 0
12:00:55.442287 IP (tos 0x0, ttl 64, id 16816, offset 0, flags [DF], proto TCP (6), length 84)
    127.0.0.1.34938 > 127.0.0.1.3389: Flags [P.], cksum 0xfe48 (incorrect -> 0x3006), seq 4794:4826, ack 3953, win 512, options [nop,nop,TS val 2853291527 ecr 2853291520], length 32
12:00:55.442296 IP (tos 0x0, ttl 64, id 9594, offset 0, flags [DF], proto TCP (6), length 52)
    127.0.0.1.3389 > 127.0.0.1.34938: Flags [.], cksum 0xfe28 (incorrect -> 0xc248), ack 4826, win 512, options [nop,nop,TS val 2853291527 ecr 2853291527], length 0
12:00:55.449601 IP (tos 0x0, ttl 64, id 16817, offset 0, flags [DF], proto TCP (6), length 84)
    127.0.0.1.34938 > 127.0.0.1.3389: Flags [P.], cksum 0xfe48 (incorrect -> 0x3dc0), seq 4826:4858, ack 3953, win 512, options [nop,nop,TS val 2853291534 ecr 2853291527], length 32
12:00:55.449621 IP (tos 0x0, ttl 64, id 9595, offset 0, flags [DF], proto TCP (6), length 52)
    127.0.0.1.3389 > 127.0.0.1.34938: Flags [.], cksum 0xfe28 (incorrect -> 0xc21a), ack 4858, win 512, options [nop,nop,TS val 2853291534 ecr 2853291534], length 0
12:00:55.456556 IP (tos 0x0, ttl 64, id 16818, offset 0, flags [DF], proto TCP (6), length 84)
    127.0.0.1.34938 > 127.0.0.1.3389: Flags [P.], cksum 0xfe48 (incorrect -> 0xe66b), seq 4858:4890, ack 3953, win 512, options [nop,nop,TS val 2853291541 ecr 2853291534], length 32
12:00:55.456570 IP (tos 0x0, ttl 64, id 9596, offset 0, flags [DF], proto TCP (6), length 52)
    127.0.0.1.3389 > 127.0.0.1.34938: Flags [.], cksum 0xfe28 (incorrect -> 0xc1ec), ack 4890, win 512, options [nop,nop,TS val 2853291541 ecr 2853291541], length 0
12:00:55.463776 IP (tos 0x0, ttl 64, id 16819, offset 0, flags [DF], proto TCP (6), length 84)
    127.0.0.1.34938 > 127.0.0.1.3389: Flags [P.], cksum 0xfe48 (incorrect -> 0x59b2), seq 4890:4922, ack 3953, win 512, options [nop,nop,TS val 2853291549 ecr 2853291541], length 32
12:00:55.463788 IP (tos 0x0, ttl 64, id 9597, offset 0, flags [DF], proto TCP (6), length 52)
    127.0.0.1.3389 > 127.0.0.1.34938: Flags [.], cksum 0xfe28 (incorrect -> 0xc1bc), ack 4922, win 512, options [nop,nop,TS val 2853291549 ecr 2853291549], length 0
12:00:55.478060 IP (tos 0x0, ttl 64, id 16820, offset 0, flags [DF], proto TCP (6), length 84)
    127.0.0.1.34938 > 127.0.0.1.3389: Flags [P.], cksum 0xfe48 (incorrect -> 0x3734), seq 4922:4954, ack 3953, win 512, options [nop,nop,TS val 2853291563 ecr 2853291549], length 32
12:00:55.478073 IP (tos 0x0, ttl 64, id 9598, offset 0, flags [DF], proto TCP (6), length 52)
    127.0.0.1.3389 > 127.0.0.1.34938: Flags [.], cksum 0xfe28 (incorrect -> 0xc180), ack 4954, win 512, options [nop,nop,TS val 2853291563 ecr 2853291563], length 0
12:00:55.485151 IP (tos 0x0, ttl 64, id 16821, offset 0, flags [DF], proto TCP (6), length 84)
    127.0.0.1.34938 > 127.0.0.1.3389: Flags [P.], cksum 0xfe48 (incorrect -> 0x20af), seq 4954:4986, ack 3953, win 512, options [nop,nop,TS val 2853291570 ecr 2853291563], length 32
12:00:55.526790 IP (tos 0x0, ttl 64, id 9599, offset 0, flags [DF], proto TCP (6), length 52)
    127.0.0.1.3389 > 127.0.0.1.34938: Flags [.], cksum 0xfe28 (incorrect -> 0xc128), ack 4986, win 512, options [nop,nop,TS val 2853291612 ecr 2853291570], length 0
12:00:55.855455 IP (tos 0x0, ttl 64, id 16822, offset 0, flags [DF], proto TCP (6), length 84)
    127.0.0.1.34938 > 127.0.0.1.3389: Flags [P.], cksum 0xfe48 (incorrect -> 0x4394), seq 4986:5018, ack 3953, win 512, options [nop,nop,TS val 2853291940 ecr 2853291612], length 32
12:00:55.855475 IP (tos 0x0, ttl 64, id 9600, offset 0, flags [DF], proto TCP (6), length 52)
    127.0.0.1.3389 > 127.0.0.1.34938: Flags [.], cksum 0xfe28 (incorrect -> 0xbe4e), ack 5018, win 512, options [nop,nop,TS val 2853291940 ecr 2853291940], length 0
12:00:55.862347 IP (tos 0x0, ttl 64, id 16823, offset 0, flags [DF], proto TCP (6), length 84)
    127.0.0.1.34938 > 127.0.0.1.3389: Flags [P.], cksum 0xfe48 (incorrect -> 0x5355), seq 5018:5050, ack 3953, win 512, options [nop,nop,TS val 2853291947 ecr 2853291940], length 32
12:00:55.862358 IP (tos 0x0, ttl 64, id 9601, offset 0, flags [DF], proto TCP (6), length 52)
    127.0.0.1.3389 > 127.0.0.1.34938: Flags [.], cksum 0xfe28 (incorrect -> 0xbe20), ack 5050, win 512, options [nop,nop,TS val 2853291947 ecr 2853291947], length 0
12:00:55.869527 IP (tos 0x0, ttl 64, id 16824, offset 0, flags [DF], proto TCP (6), length 84)
    127.0.0.1.34938 > 127.0.0.1.3389: Flags [P.], cksum 0xfe48 (incorrect -> 0x732f), seq 5050:5082, ack 3953, win 512, options [nop,nop,TS val 2853291954 ecr 2853291947], length 32
12:00:55.869542 IP (tos 0x0, ttl 64, id 9602, offset 0, flags [DF], proto TCP (6), length 52)
    127.0.0.1.3389 > 127.0.0.1.34938: Flags [.], cksum 0xfe28 (incorrect -> 0xbdf2), ack 5082, win 512, options [nop,nop,TS val 2853291954 ecr 2853291954], length 0
12:00:55.876604 IP (tos 0x0, ttl 64, id 16825, offset 0, flags [DF], proto TCP (6), length 84)
    127.0.0.1.34938 > 127.0.0.1.3389: Flags [P.], cksum 0xfe48 (incorrect -> 0x04fa), seq 5082:5114, ack 3953, win 512, options [nop,nop,TS val 2853291961 ecr 2853291954], length 32
12:00:55.876613 IP (tos 0x0, ttl 64, id 9603, offset 0, flags [DF], proto TCP (6), length 52)
    127.0.0.1.3389 > 127.0.0.1.34938: Flags [.], cksum 0xfe28 (incorrect -> 0xbdc4), ack 5114, win 512, options [nop,nop,TS val 2853291961 ecr 2853291961], length 0
12:00:55.883737 IP (tos 0x0, ttl 64, id 16826, offset 0, flags [DF], proto TCP (6), length 84)
    127.0.0.1.34938 > 127.0.0.1.3389: Flags [P.], cksum 0xfe48 (incorrect -> 0x8ff9), seq 5114:5146, ack 3953, win 512, options [nop,nop,TS val 2853291969 ecr 2853291961], length 32
12:00:55.883749 IP (tos 0x0, ttl 64, id 9604, offset 0, flags [DF], proto TCP (6), length 52)
    127.0.0.1.3389 > 127.0.0.1.34938: Flags [.], cksum 0xfe28 (incorrect -> 0xbd94), ack 5146, win 512, options [nop,nop,TS val 2853291969 ecr 2853291969], length 0
12:00:55.890901 IP (tos 0x0, ttl 64, id 16827, offset 0, flags [DF], proto TCP (6), length 84)
    127.0.0.1.34938 > 127.0.0.1.3389: Flags [P.], cksum 0xfe48 (incorrect -> 0xd3f1), seq 5146:5178, ack 3953, win 512, options [nop,nop,TS val 2853291976 ecr 2853291969], length 32
12:00:55.890915 IP (tos 0x0, ttl 64, id 9605, offset 0, flags [DF], proto TCP (6), length 52)
    127.0.0.1.3389 > 127.0.0.1.34938: Flags [.], cksum 0xfe28 (incorrect -> 0xbd66), ack 5178, win 512, options [nop,nop,TS val 2853291976 ecr 2853291976], length 0
12:00:55.897937 IP (tos 0x0, ttl 64, id 16828, offset 0, flags [DF], proto TCP (6), length 84)
    127.0.0.1.34938 > 127.0.0.1.3389: Flags [P.], cksum 0xfe48 (incorrect -> 0xf05a), seq 5178:5210, ack 3953, win 512, options [nop,nop,TS val 2853291983 ecr 2853291976], length 32
12:00:55.897945 IP (tos 0x0, ttl 64, id 9606, offset 0, flags [DF], proto TCP (6), length 52)
    127.0.0.1.3389 > 127.0.0.1.34938: Flags [.], cksum 0xfe28 (incorrect -> 0xbd38), ack 5210, win 512, options [nop,nop,TS val 2853291983 ecr 2853291983], length 0
12:00:55.905723 IP (tos 0x0, ttl 64, id 16829, offset 0, flags [DF], proto TCP (6), length 84)
    127.0.0.1.34938 > 127.0.0.1.3389: Flags [P.], cksum 0xfe48 (incorrect -> 0xedf2), seq 5210:5242, ack 3953, win 512, options [nop,nop,TS val 2853291991 ecr 2853291983], length 32
12:00:55.905734 IP (tos 0x0, ttl 64, id 9607, offset 0, flags [DF], proto TCP (6), length 52)
    127.0.0.1.3389 > 127.0.0.1.34938: Flags [.], cksum 0xfe28 (incorrect -> 0xbd08), ack 5242, win 512, options [nop,nop,TS val 2853291991 ecr 2853291991], length 0
12:00:55.912719 IP (tos 0x0, ttl 64, id 16830, offset 0, flags [DF], proto TCP (6), length 84)
    127.0.0.1.34938 > 127.0.0.1.3389: Flags [P.], cksum 0xfe48 (incorrect -> 0x4f38), seq 5242:5274, ack 3953, win 512, options [nop,nop,TS val 2853291997 ecr 2853291991], length 32
12:00:55.912733 IP (tos 0x0, ttl 64, id 9608, offset 0, flags [DF], proto TCP (6), length 52)
    127.0.0.1.3389 > 127.0.0.1.34938: Flags [.], cksum 0xfe28 (incorrect -> 0xbcdb), ack 5274, win 512, options [nop,nop,TS val 2853291998 ecr 2853291997], length 0
12:00:55.919802 IP (tos 0x0, ttl 64, id 16831, offset 0, flags [DF], proto TCP (6), length 84)
    127.0.0.1.34938 > 127.0.0.1.3389: Flags [P.], cksum 0xfe48 (incorrect -> 0xf441), seq 5274:5306, ack 3953, win 512, options [nop,nop,TS val 2853292005 ecr 2853291998], length 32
12:00:55.919812 IP (tos 0x0, ttl 64, id 9609, offset 0, flags [DF], proto TCP (6), length 52)
    127.0.0.1.3389 > 127.0.0.1.34938: Flags [.], cksum 0xfe28 (incorrect -> 0xbcac), ack 5306, win 512, options [nop,nop,TS val 2853292005 ecr 2853292005], length 0
12:00:55.926941 IP (tos 0x0, ttl 64, id 16832, offset 0, flags [DF], proto TCP (6), length 84)
    127.0.0.1.34938 > 127.0.0.1.3389: Flags [P.], cksum 0xfe48 (incorrect -> 0x290b), seq 5306:5338, ack 3953, win 512, options [nop,nop,TS val 2853292012 ecr 2853292005], length 32
12:00:55.926954 IP (tos 0x0, ttl 64, id 9610, offset 0, flags [DF], proto TCP (6), length 52)
    127.0.0.1.3389 > 127.0.0.1.34938: Flags [.], cksum 0xfe28 (incorrect -> 0xbc7e), ack 5338, win 512, options [nop,nop,TS val 2853292012 ecr 2853292012], length 0
12:00:55.933821 IP (tos 0x0, ttl 64, id 16833, offset 0, flags [DF], proto TCP (6), length 84)
    127.0.0.1.34938 > 127.0.0.1.3389: Flags [P.], cksum 0xfe48 (incorrect -> 0x5c61), seq 5338:5370, ack 3953, win 512, options [nop,nop,TS val 2853292019 ecr 2853292012], length 32
12:00:55.933835 IP (tos 0x0, ttl 64, id 9611, offset 0, flags [DF], proto TCP (6), length 52)
    127.0.0.1.3389 > 127.0.0.1.34938: Flags [.], cksum 0xfe28 (incorrect -> 0xbc50), ack 5370, win 512, options [nop,nop,TS val 2853292019 ecr 2853292019], length 0
12:00:55.941236 IP (tos 0x0, ttl 64, id 16834, offset 0, flags [DF], proto TCP (6), length 84)
    127.0.0.1.34938 > 127.0.0.1.3389: Flags [P.], cksum 0xfe48 (incorrect -> 0xfd29), seq 5370:5402, ack 3953, win 512, options [nop,nop,TS val 2853292026 ecr 2853292019], length 32
12:00:55.941248 IP (tos 0x0, ttl 64, id 9612, offset 0, flags [DF], proto TCP (6), length 52)
    127.0.0.1.3389 > 127.0.0.1.34938: Flags [.], cksum 0xfe28 (incorrect -> 0xbc22), ack 5402, win 512, options [nop,nop,TS val 2853292026 ecr 2853292026], length 0
12:00:55.948215 IP (tos 0x0, ttl 64, id 16835, offset 0, flags [DF], proto TCP (6), length 84)
    127.0.0.1.34938 > 127.0.0.1.3389: Flags [P.], cksum 0xfe48 (incorrect -> 0x4900), seq 5402:5434, ack 3953, win 512, options [nop,nop,TS val 2853292033 ecr 2853292026], length 32
12:00:55.948229 IP (tos 0x0, ttl 64, id 9613, offset 0, flags [DF], proto TCP (6), length 52)
    127.0.0.1.3389 > 127.0.0.1.34938: Flags [.], cksum 0xfe28 (incorrect -> 0xbbf4), ack 5434, win 512, options [nop,nop,TS val 2853292033 ecr 2853292033], length 0
12:00:55.955244 IP (tos 0x0, ttl 64, id 16836, offset 0, flags [DF], proto TCP (6), length 84)
    127.0.0.1.34938 > 127.0.0.1.3389: Flags [P.], cksum 0xfe48 (incorrect -> 0x4102), seq 5434:5466, ack 3953, win 512, options [nop,nop,TS val 2853292040 ecr 2853292033], length 32
12:00:55.955257 IP (tos 0x0, ttl 64, id 9614, offset 0, flags [DF], proto TCP (6), length 52)
    127.0.0.1.3389 > 127.0.0.1.34938: Flags [.], cksum 0xfe28 (incorrect -> 0xbbc6), ack 5466, win 512, options [nop,nop,TS val 2853292040 ecr 2853292040], length 0
12:00:55.962352 IP (tos 0x0, ttl 64, id 16837, offset 0, flags [DF], proto TCP (6), length 84)
    127.0.0.1.34938 > 127.0.0.1.3389: Flags [P.], cksum 0xfe48 (incorrect -> 0x3220), seq 5466:5498, ack 3953, win 512, options [nop,nop,TS val 2853292047 ecr 2853292040], length 32
12:00:55.962362 IP (tos 0x0, ttl 64, id 9615, offset 0, flags [DF], proto TCP (6), length 52)
    127.0.0.1.3389 > 127.0.0.1.34938: Flags [.], cksum 0xfe28 (incorrect -> 0xbb98), ack 5498, win 512, options [nop,nop,TS val 2853292047 ecr 2853292047], length 0
12:00:55.969601 IP (tos 0x0, ttl 64, id 16838, offset 0, flags [DF], proto TCP (6), length 84)
    127.0.0.1.34938 > 127.0.0.1.3389: Flags [P.], cksum 0xfe48 (incorrect -> 0x417d), seq 5498:5530, ack 3953, win 512, options [nop,nop,TS val 2853292054 ecr 2853292047], length 32
12:00:55.976263 IP (tos 0x0, ttl 64, id 16839, offset 0, flags [DF], proto TCP (6), length 84)
    127.0.0.1.34938 > 127.0.0.1.3389: Flags [P.], cksum 0xfe48 (incorrect -> 0x5e4a), seq 5530:5562, ack 3953, win 512, options [nop,nop,TS val 2853292061 ecr 2853292047], length 32
12:00:55.982738 IP (tos 0x0, ttl 64, id 16840, offset 0, flags [DF], proto TCP (6), length 84)
    127.0.0.1.34938 > 127.0.0.1.3389: Flags [P.], cksum 0xfe48 (incorrect -> 0x5e43), seq 5530:5562, ack 3953, win 512, options [nop,nop,TS val 2853292068 ecr 2853292047], length 32
12:00:55.982749 IP (tos 0x0, ttl 64, id 9616, offset 0, flags [DF], proto TCP (6), length 64)
    127.0.0.1.3389 > 127.0.0.1.34938: Flags [.], cksum 0xfe34 (incorrect -> 0xf3c7), ack 5562, win 512, options [nop,nop,TS val 2853292068 ecr 2853292054,nop,nop,sack 1 {5530:5562}], length 0
12:00:55.983223 IP (tos 0x0, ttl 64, id 16841, offset 0, flags [DF], proto TCP (6), length 84)
    127.0.0.1.34938 > 127.0.0.1.3389: Flags [P.], cksum 0xfe48 (incorrect -> 0xf8a7), seq 5562:5594, ack 3953, win 512, options [nop,nop,TS val 2853292068 ecr 2853292068], length 32
12:00:55.983235 IP (tos 0x0, ttl 64, id 9617, offset 0, flags [DF], proto TCP (6), length 52)
    127.0.0.1.3389 > 127.0.0.1.34938: Flags [.], cksum 0xfe28 (incorrect -> 0xbb0e), ack 5594, win 512, options [nop,nop,TS val 2853292068 ecr 2853292068], length 0
12:00:55.990603 IP (tos 0x0, ttl 64, id 16842, offset 0, flags [DF], proto TCP (6), length 84)
    127.0.0.1.34938 > 127.0.0.1.3389: Flags [P.], cksum 0xfe48 (incorrect -> 0x37d0), seq 5594:5626, ack 3953, win 512, options [nop,nop,TS val 2853292075 ecr 2853292068], length 32
12:00:55.990617 IP (tos 0x0, ttl 64, id 9618, offset 0, flags [DF], proto TCP (6), length 52)
    127.0.0.1.3389 > 127.0.0.1.34938: Flags [.], cksum 0xfe28 (incorrect -> 0xbae0), ack 5626, win 512, options [nop,nop,TS val 2853292075 ecr 2853292075], length 0
12:00:55.997529 IP (tos 0x0, ttl 64, id 16843, offset 0, flags [DF], proto TCP (6), length 84)
    127.0.0.1.34938 > 127.0.0.1.3389: Flags [P.], cksum 0xfe48 (incorrect -> 0x4945), seq 5626:5658, ack 3953, win 512, options [nop,nop,TS val 2853292082 ecr 2853292075], length 32
12:00:55.997538 IP (tos 0x0, ttl 64, id 9619, offset 0, flags [DF], proto TCP (6), length 52)
    127.0.0.1.3389 > 127.0.0.1.34938: Flags [.], cksum 0xfe28 (incorrect -> 0xbab2), ack 5658, win 512, options [nop,nop,TS val 2853292082 ecr 2853292082], length 0
12:00:56.004568 IP (tos 0x0, ttl 64, id 16844, offset 0, flags [DF], proto TCP (6), length 84)
    127.0.0.1.34938 > 127.0.0.1.3389: Flags [P.], cksum 0xfe48 (incorrect -> 0xfd73), seq 5658:5690, ack 3953, win 512, options [nop,nop,TS val 2853292089 ecr 2853292082], length 32
12:00:56.004576 IP (tos 0x0, ttl 64, id 9620, offset 0, flags [DF], proto TCP (6), length 52)
    127.0.0.1.3389 > 127.0.0.1.34938: Flags [.], cksum 0xfe28 (incorrect -> 0xba84), ack 5690, win 512, options [nop,nop,TS val 2853292089 ecr 2853292089], length 0
12:00:56.011637 IP (tos 0x0, ttl 64, id 16845, offset 0, flags [DF], proto TCP (6), length 84)
    127.0.0.1.34938 > 127.0.0.1.3389: Flags [P.], cksum 0xfe48 (incorrect -> 0xd0ba), seq 5690:5722, ack 3953, win 512, options [nop,nop,TS val 2853292096 ecr 2853292089], length 32
12:00:56.011648 IP (tos 0x0, ttl 64, id 9621, offset 0, flags [DF], proto TCP (6), length 52)
    127.0.0.1.3389 > 127.0.0.1.34938: Flags [.], cksum 0xfe28 (incorrect -> 0xba56), ack 5722, win 512, options [nop,nop,TS val 2853292096 ecr 2853292096], length 0
12:00:56.018822 IP (tos 0x0, ttl 64, id 16846, offset 0, flags [DF], proto TCP (6), length 84)
    127.0.0.1.34938 > 127.0.0.1.3389: Flags [P.], cksum 0xfe48 (incorrect -> 0xdc85), seq 5722:5754, ack 3953, win 512, options [nop,nop,TS val 2853292104 ecr 2853292096], length 32
12:00:56.018829 IP (tos 0x0, ttl 64, id 9622, offset 0, flags [DF], proto TCP (6), length 52)
    127.0.0.1.3389 > 127.0.0.1.34938: Flags [.], cksum 0xfe28 (incorrect -> 0xba26), ack 5754, win 512, options [nop,nop,TS val 2853292104 ecr 2853292104], length 0
12:00:56.025906 IP (tos 0x0, ttl 64, id 16847, offset 0, flags [DF], proto TCP (6), length 84)
    127.0.0.1.34938 > 127.0.0.1.3389: Flags [P.], cksum 0xfe48 (incorrect -> 0x29c5), seq 5754:5786, ack 3953, win 512, options [nop,nop,TS val 2853292111 ecr 2853292104], length 32
12:00:56.025914 IP (tos 0x0, ttl 64, id 9623, offset 0, flags [DF], proto TCP (6), length 52)
    127.0.0.1.3389 > 127.0.0.1.34938: Flags [.], cksum 0xfe28 (incorrect -> 0xb9f8), ack 5786, win 512, options [nop,nop,TS val 2853292111 ecr 2853292111], length 0
12:00:56.033131 IP (tos 0x0, ttl 64, id 16848, offset 0, flags [DF], proto TCP (6), length 84)
    127.0.0.1.34938 > 127.0.0.1.3389: Flags [P.], cksum 0xfe48 (incorrect -> 0x8adb), seq 5786:5818, ack 3953, win 512, options [nop,nop,TS val 2853292118 ecr 2853292111], length 32
12:00:56.033142 IP (tos 0x0, ttl 64, id 9624, offset 0, flags [DF], proto TCP (6), length 52)
    127.0.0.1.3389 > 127.0.0.1.34938: Flags [.], cksum 0xfe28 (incorrect -> 0xb9ca), ack 5818, win 512, options [nop,nop,TS val 2853292118 ecr 2853292118], length 0
12:00:56.040167 IP (tos 0x0, ttl 64, id 16849, offset 0, flags [DF], proto TCP (6), length 84)
    127.0.0.1.34938 > 127.0.0.1.3389: Flags [P.], cksum 0xfe48 (incorrect -> 0x081e), seq 5818:5850, ack 3953, win 512, options [nop,nop,TS val 2853292125 ecr 2853292118], length 32
12:00:56.040177 IP (tos 0x0, ttl 64, id 9625, offset 0, flags [DF], proto TCP (6), length 52)
    127.0.0.1.3389 > 127.0.0.1.34938: Flags [.], cksum 0xfe28 (incorrect -> 0xb99c), ack 5850, win 512, options [nop,nop,TS val 2853292125 ecr 2853292125], length 0
12:00:56.047207 IP (tos 0x0, ttl 64, id 16850, offset 0, flags [DF], proto TCP (6), length 84)
    127.0.0.1.34938 > 127.0.0.1.3389: Flags [P.], cksum 0xfe48 (incorrect -> 0x28fc), seq 5850:5882, ack 3953, win 512, options [nop,nop,TS val 2853292132 ecr 2853292125], length 32
12:00:56.047216 IP (tos 0x0, ttl 64, id 9626, offset 0, flags [DF], proto TCP (6), length 52)
    127.0.0.1.3389 > 127.0.0.1.34938: Flags [.], cksum 0xfe28 (incorrect -> 0xb96e), ack 5882, win 512, options [nop,nop,TS val 2853292132 ecr 2853292132], length 0
12:00:56.054328 IP (tos 0x0, ttl 64, id 16851, offset 0, flags [DF], proto TCP (6), length 84)
    127.0.0.1.34938 > 127.0.0.1.3389: Flags [P.], cksum 0xfe48 (incorrect -> 0x53df), seq 5882:5914, ack 3953, win 512, options [nop,nop,TS val 2853292139 ecr 2853292132], length 32
12:00:56.054337 IP (tos 0x0, ttl 64, id 9627, offset 0, flags [DF], proto TCP (6), length 52)
    127.0.0.1.3389 > 127.0.0.1.34938: Flags [.], cksum 0xfe28 (incorrect -> 0xb940), ack 5914, win 512, options [nop,nop,TS val 2853292139 ecr 2853292139], length 0
12:00:56.061438 IP (tos 0x0, ttl 64, id 16852, offset 0, flags [DF], proto TCP (6), length 84)
    127.0.0.1.34938 > 127.0.0.1.3389: Flags [P.], cksum 0xfe48 (incorrect -> 0x3a2c), seq 5914:5946, ack 3953, win 512, options [nop,nop,TS val 2853292146 ecr 2853292139], length 32
12:00:56.061446 IP (tos 0x0, ttl 64, id 9628, offset 0, flags [DF], proto TCP (6), length 52)
    127.0.0.1.3389 > 127.0.0.1.34938: Flags [.], cksum 0xfe28 (incorrect -> 0xb912), ack 5946, win 512, options [nop,nop,TS val 2853292146 ecr 2853292146], length 0
12:00:56.068757 IP (tos 0x0, ttl 64, id 16853, offset 0, flags [DF], proto TCP (6), length 84)
    127.0.0.1.34938 > 127.0.0.1.3389: Flags [P.], cksum 0xfe48 (incorrect -> 0xb15e), seq 5946:5978, ack 3953, win 512, options [nop,nop,TS val 2853292154 ecr 2853292146], length 32
12:00:56.068770 IP (tos 0x0, ttl 64, id 9629, offset 0, flags [DF], proto TCP (6), length 52)
    127.0.0.1.3389 > 127.0.0.1.34938: Flags [.], cksum 0xfe28 (incorrect -> 0xb8e2), ack 5978, win 512, options [nop,nop,TS val 2853292154 ecr 2853292154], length 0
12:00:56.075821 IP (tos 0x0, ttl 64, id 16854, offset 0, flags [DF], proto TCP (6), length 84)
    127.0.0.1.34938 > 127.0.0.1.3389: Flags [P.], cksum 0xfe48 (incorrect -> 0x653f), seq 5978:6010, ack 3953, win 512, options [nop,nop,TS val 2853292161 ecr 2853292154], length 32
12:00:56.075830 IP (tos 0x0, ttl 64, id 9630, offset 0, flags [DF], proto TCP (6), length 52)
    127.0.0.1.3389 > 127.0.0.1.34938: Flags [.], cksum 0xfe28 (incorrect -> 0xb8b4), ack 6010, win 512, options [nop,nop,TS val 2853292161 ecr 2853292161], length 0
12:00:56.082894 IP (tos 0x0, ttl 64, id 16855, offset 0, flags [DF], proto TCP (6), length 84)
    127.0.0.1.34938 > 127.0.0.1.3389: Flags [P.], cksum 0xfe48 (incorrect -> 0x18cc), seq 6010:6042, ack 3953, win 512, options [nop,nop,TS val 2853292168 ecr 2853292161], length 32
12:00:56.082903 IP (tos 0x0, ttl 64, id 9631, offset 0, flags [DF], proto TCP (6), length 52)
    127.0.0.1.3389 > 127.0.0.1.34938: Flags [.], cksum 0xfe28 (incorrect -> 0xb886), ack 6042, win 512, options [nop,nop,TS val 2853292168 ecr 2853292168], length 0
12:00:56.089936 IP (tos 0x0, ttl 64, id 16856, offset 0, flags [DF], proto TCP (6), length 84)
    127.0.0.1.34938 > 127.0.0.1.3389: Flags [P.], cksum 0xfe48 (incorrect -> 0x5df5), seq 6042:6074, ack 3953, win 512, options [nop,nop,TS val 2853292175 ecr 2853292168], length 32
12:00:56.097115 IP (tos 0x0, ttl 64, id 16857, offset 0, flags [DF], proto TCP (6), length 84)
    127.0.0.1.34938 > 127.0.0.1.3389: Flags [P.], cksum 0xfe48 (incorrect -> 0x1af8), seq 6074:6106, ack 3953, win 512, options [nop,nop,TS val 2853292182 ecr 2853292168], length 32
12:00:56.102741 IP (tos 0x0, ttl 64, id 16858, offset 0, flags [DF], proto TCP (6), length 84)
    127.0.0.1.34938 > 127.0.0.1.3389: Flags [P.], cksum 0xfe48 (incorrect -> 0x1af2), seq 6074:6106, ack 3953, win 512, options [nop,nop,TS val 2853292188 ecr 2853292168], length 32
12:00:56.102751 IP (tos 0x0, ttl 64, id 9632, offset 0, flags [DF], proto TCP (6), length 64)
    127.0.0.1.3389 > 127.0.0.1.34938: Flags [.], cksum 0xfe34 (incorrect -> 0xec76), ack 6106, win 512, options [nop,nop,TS val 2853292188 ecr 2853292175,nop,nop,sack 1 {6074:6106}], length 0
12:00:56.104204 IP (tos 0x0, ttl 64, id 16859, offset 0, flags [DF], proto TCP (6), length 84)
    127.0.0.1.34938 > 127.0.0.1.3389: Flags [P.], cksum 0xfe48 (incorrect -> 0xf33b), seq 6106:6138, ack 3953, win 512, options [nop,nop,TS val 2853292189 ecr 2853292188], length 32
12:00:56.104212 IP (tos 0x0, ttl 64, id 9633, offset 0, flags [DF], proto TCP (6), length 52)
    127.0.0.1.3389 > 127.0.0.1.34938: Flags [.], cksum 0xfe28 (incorrect -> 0xb7fc), ack 6138, win 512, options [nop,nop,TS val 2853292189 ecr 2853292189], length 0
12:00:56.111365 IP (tos 0x0, ttl 64, id 16860, offset 0, flags [DF], proto TCP (6), length 84)
    127.0.0.1.34938 > 127.0.0.1.3389: Flags [P.], cksum 0xfe48 (incorrect -> 0x0e81), seq 6138:6170, ack 3953, win 512, options [nop,nop,TS val 2853292196 ecr 2853292189], length 32
12:00:56.111377 IP (tos 0x0, ttl 64, id 9634, offset 0, flags [DF], proto TCP (6), length 52)
    127.0.0.1.3389 > 127.0.0.1.34938: Flags [.], cksum 0xfe28 (incorrect -> 0xb7ce), ack 6170, win 512, options [nop,nop,TS val 2853292196 ecr 2853292196], length 0
12:00:56.118557 IP (tos 0x0, ttl 64, id 16861, offset 0, flags [DF], proto TCP (6), length 84)
    127.0.0.1.34938 > 127.0.0.1.3389: Flags [P.], cksum 0xfe48 (incorrect -> 0xaaa9), seq 6170:6202, ack 3953, win 512, options [nop,nop,TS val 2853292203 ecr 2853292196], length 32
12:00:56.118566 IP (tos 0x0, ttl 64, id 9635, offset 0, flags [DF], proto TCP (6), length 52)
    127.0.0.1.3389 > 127.0.0.1.34938: Flags [.], cksum 0xfe28 (incorrect -> 0xb7a0), ack 6202, win 512, options [nop,nop,TS val 2853292203 ecr 2853292203], length 0
12:00:56.125629 IP (tos 0x0, ttl 64, id 16862, offset 0, flags [DF], proto TCP (6), length 84)
    127.0.0.1.34938 > 127.0.0.1.3389: Flags [P.], cksum 0xfe48 (incorrect -> 0x1e97), seq 6202:6234, ack 3953, win 512, options [nop,nop,TS val 2853292210 ecr 2853292203], length 32
12:00:56.125636 IP (tos 0x0, ttl 64, id 9636, offset 0, flags [DF], proto TCP (6), length 52)
    127.0.0.1.3389 > 127.0.0.1.34938: Flags [.], cksum 0xfe28 (incorrect -> 0xb772), ack 6234, win 512, options [nop,nop,TS val 2853292210 ecr 2853292210], length 0
12:00:56.132795 IP (tos 0x0, ttl 64, id 16863, offset 0, flags [DF], proto TCP (6), length 84)
    127.0.0.1.34938 > 127.0.0.1.3389: Flags [P.], cksum 0xfe48 (incorrect -> 0xf205), seq 6234:6266, ack 3953, win 512, options [nop,nop,TS val 2853292218 ecr 2853292210], length 32
12:00:56.132807 IP (tos 0x0, ttl 64, id 9637, offset 0, flags [DF], proto TCP (6), length 52)
    127.0.0.1.3389 > 127.0.0.1.34938: Flags [.], cksum 0xfe28 (incorrect -> 0xb742), ack 6266, win 512, options [nop,nop,TS val 2853292218 ecr 2853292218], length 0
12:00:56.139892 IP (tos 0x0, ttl 64, id 16864, offset 0, flags [DF], proto TCP (6), length 84)
    127.0.0.1.34938 > 127.0.0.1.3389: Flags [P.], cksum 0xfe48 (incorrect -> 0xaa6d), seq 6266:6298, ack 3953, win 512, options [nop,nop,TS val 2853292225 ecr 2853292218], length 32
12:00:56.139902 IP (tos 0x0, ttl 64, id 9638, offset 0, flags [DF], proto TCP (6), length 52)
    127.0.0.1.3389 > 127.0.0.1.34938: Flags [.], cksum 0xfe28 (incorrect -> 0xb714), ack 6298, win 512, options [nop,nop,TS val 2853292225 ecr 2853292225], length 0
12:00:56.146957 IP (tos 0x0, ttl 64, id 16865, offset 0, flags [DF], proto TCP (6), length 84)
    127.0.0.1.34938 > 127.0.0.1.3389: Flags [P.], cksum 0xfe48 (incorrect -> 0x0eb6), seq 6298:6330, ack 3953, win 512, options [nop,nop,TS val 2853292232 ecr 2853292225], length 32
12:00:56.146965 IP (tos 0x0, ttl 64, id 9639, offset 0, flags [DF], proto TCP (6), length 52)
    127.0.0.1.3389 > 127.0.0.1.34938: Flags [.], cksum 0xfe28 (incorrect -> 0xb6e6), ack 6330, win 512, options [nop,nop,TS val 2853292232 ecr 2853292232], length 0
12:00:56.154169 IP (tos 0x0, ttl 64, id 16866, offset 0, flags [DF], proto TCP (6), length 84).....
```

### Supporter

- [ ] I am a [sponsor](https://github.com/sponsors/nekohasekai/)

### Integrity requirements

- [x] I confirm that I have read the documentation, understand the meaning of all the configuration items I wrote, and did not pile up seemingly useful options or default values.
- [x] I confirm that I have provided the server and client configuration files and process that can be reproduced locally, instead of a complicated client configuration file that has been stripped of sensitive data.
- [x] I confirm that I have provided the simplest configuration that can be used to reproduce the error I reported, instead of depending on remote servers, TUN, graphical interface clients, or other closed-source software.
- [x] I confirm that I have provided the complete configuration files and logs, rather than just providing parts I think are useful out of confidence in my own intelligence.
