### ISSUE TITLE
ERR_SSL_PROTOCOL_ERROR * ssl_handshake returned: (-0x7780) SSL - A fatal alert message was received from our peer

### ISSUE THREAD

**Issue by megapro17** [SagerNet/sing-box#3697]
### Operating system

Linux

### System version

OpenWrt 25.12.0-rc1

### Installation type

Original sing-box Command Line

### Version

```shell
sing-box version 1.12.12

Environment: go1.25.5 linux/arm64
Tags: with_clash_api,with_gvisor,with_quic,with_tailscale,with_utls,with_wireguard
CGO: enabled
```

### Description

A very small number of websites fail to open and return an SSL error when using TProxy. I didn't noticed this problem in tun mode
There are no problems with connection to site, because http page is loading correctly
All others sites are working fine
Also, if you redirect a broken site to an outbound proxy, it's working normally
My connection is PPPoE with default MTU

Examples:
https://chat.qwen.ai https://alicdn.com https://2x2tv.ru https://banki.ru

### Reproduction

```
> cat /etc/sing-box/test.json

{
  "log": {
    "level": "trace",
    "timestamp": true
  },
  "dns": {
    "servers": [
      {
        "type": "https",
        "tag": "direct_dns",
        "server": "1.1.1.1"
      }
    ],
    "final": "direct_dns",
    "strategy": "ipv4_only"
  },
  "inbounds": [
    {
      "type": "tproxy",
      "tag": "tproxy_in",
      "listen": "::",
      "listen_port": 34567
    },
    {
      "type": "direct",
      "tag": "dns_in",
      "listen": "127.0.0.1",
      "listen_port": 5353
    }
  ],
  "outbounds": [
    {
      "tag": "direct_out",
      "type": "direct",
      "routing_mark": 255
    }
  ],
  "route": {
    "rules": [
      {
        "port": 5353,
        "action": "hijack-dns"
      },
      {
        "outbound": "direct_out"
      }
    ],
    "final": "direct_out",
    "auto_detect_interface": true,
    "default_domain_resolver": "direct_dns"
  }
```

```
> cat /etc/nftables.d/20-singbox.nft

chain singbox_prerouting {
    type filter hook prerouting priority mangle; policy accept;

    meta mark 1024 counter queue num 200 bypass
    meta mark { 255, 1024 } accept

    ip daddr { 127.0.0.0/8, 10.0.0.0/8, 172.16.0.0/12, 192.168.0.0/16, 224.0.0.0/4 } accept

    meta l4proto { tcp, udp } meta mark 1 tproxy to :34567 accept
    iifname "br-lan" meta l4proto { tcp, udp } th dport { 80, 443 } tproxy to :34567 meta mark set 1 accept
}

chain singbox_output {
    type route hook output priority mangle; policy accept;

    meta mark 1024 counter queue num 200 bypass
    meta mark { 255, 1024 } accept

    # My original configuration uses fakeip for all sites
    ip daddr 198.18.0.0/15 meta l4proto { tcp, udp } th dport { 80, 443 } meta mark set 1
}
```

```
> cat /etc/hotplug.d/iface/99-singbox-route

#!/bin/sh

[ "$ACTION" = "ifup" ] || exit 0

ip rule add fwmark 1 lookup 100 2>/dev/null

ip route add local default dev lo table 100 2>/dev/null

logger -t singbox-route "Rules applied: fwmark 1 and Fake-IP subnet"
```

```
> cat /etc/config/dhcp

config dnsmasq
        option domainneeded '1'
        option localise_queries '1'
        option rebind_protection '1'
        option rebind_localhost '1'
        option local '/lan/'
        option domain 'lan'
        option expandhosts '1'
        option cachesize '1000'
        option authoritative '1'
        option readethers '1'
        option leasefile '/tmp/dhcp.leases'
        option localservice '1'
        option ednspacket_max '1232'
        option noresolv '1'
        list rebind_domain '198.18.0.0/15'
        list server '127.0.0.1#5353'
        option filterwin2k '1'

config dhcp 'lan'
        option interface 'lan'
        option start '100'
        option limit '150'
        option leasetime '12h'
        option dhcpv4 'server'
        option dhcpv6 'server'
        option ra 'server'
        option ra_slaac '1'
        list ra_flags 'managed-config'
        list ra_flags 'other-config'

config dhcp 'wan'
        option interface 'wan'
        option ignore '1'

config odhcpd 'odhcpd'
        option maindhcp '0'
        option leasefile '/tmp/odhcpd.leases'
        option leasetrigger '/usr/sbin/odhcpd-update'
        option loglevel '4'
        option piodir '/tmp/odhcpd-piodir'
        option hostsdir '/tmp/hosts'

```

```
singbox run -c /etc/sing-box/test.json
curl https://chat.qwen.ai -v
```

### Logs

<details>
<summary>sing-box trace log, truncated</summary>

root@megapro17-openwrt:~# sing-box run -c /etc/sing-box/test.json
+0000 2026-01-14 02:12:55 INFO network: updated default interface pppoe-wan, index 9
+0000 2026-01-14 02:12:55 INFO inbound/tproxy[tproxy_in]: tcp server started at [::]:34567
+0000 2026-01-14 02:12:55 INFO inbound/tproxy[tproxy_in]: udp server started at [::]:34567
+0000 2026-01-14 02:12:55 INFO inbound/direct[dns_in]: tcp server started at 127.0.0.1:5353
+0000 2026-01-14 02:12:55 INFO inbound/direct[dns_in]: udp server started at 127.0.0.1:5353
+0000 2026-01-14 02:12:55 INFO sing-box started (0.11s)
...
+0000 2026-01-14 02:13:14 INFO [1896650655 0ms] inbound/direct[dns_in]: inbound packet connection from 127.0.0.1:51401
+0000 2026-01-14 02:13:14 INFO [1896650655 0ms] inbound/direct[dns_in]: inbound packet connection to 127.0.0.1:5353
+0000 2026-01-14 02:13:14 DEBUG [1896650655 0ms] router: match[0] port=5353 => hijack-dns
+0000 2026-01-14 02:13:14 DEBUG [1896650655 0ms] dns: exchange chat.qwen.ai. IN AAAA
+0000 2026-01-14 02:13:14 DEBUG [1896650655 0ms] dns: strategy rejected
+0000 2026-01-14 02:13:14 INFO [372253975 0ms] inbound/direct[dns_in]: inbound packet connection from 127.0.0.1:54067
+0000 2026-01-14 02:13:14 INFO [372253975 1ms] inbound/direct[dns_in]: inbound packet connection to 127.0.0.1:5353
+0000 2026-01-14 02:13:14 DEBUG [372253975 1ms] router: match[0] port=5353 => hijack-dns
+0000 2026-01-14 02:13:14 DEBUG [372253975 1ms] dns: exchange chat.qwen.ai. IN A
+0000 2026-01-14 02:13:14 DEBUG [372253975 6ms] dns: exchanged chat.qwen.ai NOERROR 219
+0000 2026-01-14 02:13:14 INFO [372253975 6ms] dns: exchanged CNAME chat.qwen.ai. 219 IN CNAME ga-bp126u6glc02vbpq9tob9.aliyunga0019.com.
+0000 2026-01-14 02:13:14 INFO [372253975 6ms] dns: exchanged A ga-bp126u6glc02vbpq9tob9.aliyunga0019.com. 219 IN A 47.254.175.31
+0000 2026-01-14 02:13:14 INFO [372253975 6ms] dns: exchanged A ga-bp126u6glc02vbpq9tob9.aliyunga0019.com. 219 IN A 47.91.78.155
+0000 2026-01-14 02:13:14 INFO [372253975 6ms] dns: exchanged OPT OPT PSEUDOSECTION: EDNS: version 0 flags: MBZ: 0x00db, udp: 1232
+0000 2026-01-14 17:01:48 INFO [720188899 0ms] inbound/direct[dns_in]: inbound packet connection from 127.0.0.1:58688
+0000 2026-01-14 17:01:48 INFO [720188899 0ms] inbound/direct[dns_in]: inbound packet connection to 127.0.0.1:5353
+0000 2026-01-14 17:01:48 DEBUG [720188899 0ms] router: match[0] port=5353 => hijack-dns
+0000 2026-01-14 17:01:48 DEBUG [720188899 0ms] dns: exchange chat.qwen.ai. IN A
+0000 2026-01-14 17:01:48 INFO [1560350556 0ms] inbound/direct[dns_in]: inbound packet connection from 127.0.0.1:34617
+0000 2026-01-14 17:01:48 INFO [1560350556 0ms] inbound/direct[dns_in]: inbound packet connection to 127.0.0.1:5353
+0000 2026-01-14 17:01:48 DEBUG [1560350556 0ms] router: match[0] port=5353 => hijack-dns
+0000 2026-01-14 17:01:48 DEBUG [1560350556 0ms] dns: exchange chat.qwen.ai. IN AAAA
+0000 2026-01-14 17:01:48 DEBUG [1560350556 0ms] dns: strategy rejected
+0000 2026-01-14 17:01:48 DEBUG [720188899 9ms] dns: exchanged chat.qwen.ai NOERROR 205
+0000 2026-01-14 17:01:48 INFO [720188899 9ms] dns: exchanged CNAME chat.qwen.ai. 205 IN CNAME ga-bp126u6glc02vbpq9tob9.aliyunga0019.com.
+0000 2026-01-14 17:01:48 INFO [720188899 9ms] dns: exchanged A ga-bp126u6glc02vbpq9tob9.aliyunga0019.com. 205 IN A 47.254.175.31
+0000 2026-01-14 17:01:48 INFO [720188899 9ms] dns: exchanged A ga-bp126u6glc02vbpq9tob9.aliyunga0019.com. 205 IN A 47.91.78.155
+0000 2026-01-14 17:01:48 INFO [720188899 9ms] dns: exchanged OPT OPT PSEUDOSECTION: EDNS: version 0 flags: MBZ: 0x00cd, udp: 1232

</details>

<details>
<summary>curl</summary>

root@megapro17-openwrt:~# curl chat.qwen.ai -v
> GET / HTTP/1.1
> Host: chat.qwen.ai
> User-Agent: curl/8.15.0
> Accept: */*
>
< HTTP/1.1 301 Moved Permanently
< Date: Wed, 14 Jan 2026 17:01:33 GMT
< Content-Type: text/html
< Content-Length: 183
< Connection: keep-alive
< Location: HTTPS://chat.qwen.ai:443/
< Via: HTTP/1.1 SLB.152
<
<html>
<head><title>301 Moved Permanently</title></head>
<body bgcolor="white">
<center><h1>301 Moved Permanently</h1></center>
<hr><center>alibaba-ga</center>
</body>
</html>
root@megapro17-openwrt:~# curl https://chat.qwen.ai -v
* ssl_handshake returned: (-0x7780) SSL - A fatal alert message was received from our peer
curl: (35) ssl_handshake returned: (-0x7780) SSL - A fatal alert message was received from our peer

PowerShell 7.5.4
 megapro17@megapro17-pc ~ curl https://chat.qwen.ai -v
* Host chat.qwen.ai:443 was resolved.
* IPv6: (none)
* IPv4: 47.254.175.31, 47.91.78.155
*   Trying 47.254.175.31:443...
* schannel: disabled automatic use of client certificate
* ALPN: curl offers http/1.1
* schannel: next InitializeSecurityContext failed: SEC_E_ILLEGAL_MESSAGE (0x80090326) - This error usually occurs when a fatal SSL/TLS alert is received (e.g. handshake failed). More detail may be available in the Windows System event log.
* closing connection #0
curl: (35) schannel: next InitializeSecurityContext failed: SEC_E_ILLEGAL_MESSAGE (0x80090326) - This error usually occurs when a fatal SSL/TLS alert is received (e.g. handshake failed). More detail may be available in the Windows System event log.

</details>

<details>
<summary>openssl</summary>

```
root@megapro17-openwrt:~# openssl s_client -connect chat.qwen.ai:443 -servername chat.qwen.ai -msg -state -debug
Connecting to 47.254.175.31
CONNECTED(00000003)
SSL_connect:before SSL initialization
>>> TLS 1.0, RecordHeader [length 0005]
    16 03 01 06 04
>>> TLS 1.3, Handshake [length 0604], ClientHello
    01 00 06 00 03 03 96 1e fb 53 db ea b3 ff c4 2e
    a7 d8 97 92 48 6d c2 bb 29 24 d3 c7 cf 7b ed d4
    fb 41 54 01 ff 5b 20 97 3c 81 73 4f 9d ce 2d 8c
    07 d5 4a a5 bc 1b f7 f0 11 05 e1 8e dc be c9 98
    85 5d b9 84 bd 6a 41 00 3c 13 02 13 03 13 01 c0
    2c c0 30 00 9f cc a9 cc a8 cc aa c0 2b c0 2f 00
    9e c0 24 c0 28 00 6b c0 23 c0 27 00 67 c0 0a c0
    14 00 39 c0 09 c0 13 00 33 00 9d 00 9c 00 3d 00
    3c 00 35 00 2f 01 00 05 7b ff 01 00 01 00 00 00
    00 11 00 0f 00 00 0c 63 68 61 74 2e 71 77 65 6e
    2e 61 69 00 0b 00 04 03 00 01 02 00 0a 00 12 00
    10 11 ec 00 1d 00 17 00 1e 00 18 00 19 01 00 01
    01 00 23 00 00 00 16 00 00 00 17 00 00 00 0d 00
    36 00 34 09 05 09 06 09 04 04 03 05 03 06 03 08
    07 08 08 08 1a 08 1b 08 1c 08 09 08 0a 08 0b 08
    04 08 05 08 06 04 01 05 01 06 01 03 03 03 01 03
    02 04 02 05 02 06 02 00 2b 00 05 04 03 04 03 03
    00 2d 00 02 01 01 00 33 04 ea 04 e8 11 ec 04 c0
    cb 56 83 17 89 47 ef 62 11 d4 d4 06 8f 79 90 02
    f9 a7 85 22 6b ac 67 40 d1 23 60 4b fb 35 61 44
    92 9e dc 8c 8b b8 3b 2c b8 5d 1d e6 97 0d 78 5e
    cc cb 44 60 45 45 e4 a7 10 1e 3a 82 ae 10 53 4b
    97 10 28 32 3b a9 e1 a3 aa a1 ae a3 08 8a c9 c2
    30 96 f1 39 4a 44 19 a2 38 10 15 19 bb 2f f3 51
    7c 51 28 12 07 2e 48 6c 9e 93 06 88 58 79 a6 23
    87 66 21 68 2f aa b9 57 0c e5 c1 93 00 98 88 91
    ab af a5 0d 28 ac c5 c4 d9 2d 40 89 cc 48 eb 4d
    53 22 a0 8f 11 4a 75 0c 49 32 49 11 e2 73 b3 83
    eb 80 0c 0c 9d a2 41 49 bd 1a 33 c3 43 b3 ff 49
    a7 4e 6c 22 94 4a 75 44 0a 70 c4 28 98 46 03 37
    b0 e3 8c 93 23 59 6d eb 44 ea f0 cc 94 50 bb 62
    a0 86 45 17 9a c9 b6 5a fc 11 c4 0f f8 75 02 d9
    57 40 28 38 a4 5a 5e 4d 8b 54 b8 a7 41 ea db c9
    e4 21 64 74 31 4b c9 7b 99 3f 44 4b bf d1 08 f2
    76 7a fd 27 3f ab b0 38 d6 00 85 6e 7c 89 89 5c
    78 2c f2 aa 1a 77 6a 3b d7 5b 62 67 bd 0f c2 1b
    d9 02 75 a5 d6 3b e6 93 5e 36 58 b3 12 fb 30 82
    8c 6b bb 88 7d 46 3a c2 3f 34 83 7d 80 55 33 32
    43 c7 41 41 cd da 23 b6 9a 4d a5 a2 84 01 24 8c
    e7 63 5d 4b f9 07 72 48 35 df eb 86 03 68 60 9f
    cb 9b 52 c2 ba dd 37 9a 6d 98 34 cb 74 69 72 83
    66 e9 d3 a1 2d 36 1c ad f1 bf 33 3c 5d a8 4c 47
    0d 4b 05 10 a5 18 90 14 02 4e 54 6c da 01 1e f2
    50 54 ec 6a 8e b9 5b be 87 27 0d 89 c0 0e 44 9b
    94 42 b1 04 c9 31 7a bb 7b 82 dd d4 34 b5 dc 8b
    1e 07 90 72 74 ac 75 ea b3 d9 bc 00 38 81 58 07
    98 a7 d8 f8 57 30 12 9c b3 29 4f 68 5c 96 34 12
    53 60 b2 b0 1a fa c4 fb 39 bc 74 c0 64 e2 86 25
    31 fb 94 55 99 87 2a 59 5e 55 fb 14 43 96 2b 7e
    63 42 f2 8a 72 3e 51 74 42 93 32 6f f6 20 74 69
    81 94 26 ab 79 db 01 61 70 09 c6 a4 c0 d0 8a 90
    e0 98 02 e0 20 7a 26 a5 b4 c1 e4 00 eb 79 37 0b
    b1 7f e9 da 56 db 51 06 ab 0a 62 8d 01 ce 2c 53
    98 fc 57 a1 a8 e9 0d a0 13 45 e6 15 56 22 a4 1e
    e7 17 88 41 d6 55 38 90 31 28 aa 8c d7 51 31 37
    94 ae 71 d5 06 32 a8 44 53 7c 59 73 c5 53 c2 17
    74 78 a4 27 b8 67 96 eb 2c be b9 e4 b2 11 e9 92
    4c 1a af d6 8c 6c cd e9 0f b2 9c b1 7f 8a af f0
    86 c2 99 c4 49 1f 43 b8 f3 c9 60 6d 15 a2 83 25
    34 40 ba 61 14 73 83 36 c5 47 f3 79 3a 1e 47 be
    db c9 36 52 5c 24 c5 48 4d fb 22 76 cc 33 58 59
    54 af 36 f7 92 e0 ab 27 63 44 b6 d6 51 91 a1 42
    66 2f d5 67 fe e9 cc 4a a9 3a 1c e4 bd 04 d9 bc
    28 81 80 3e 5c 01 b3 69 44 45 97 0b ad 59 ae b1
    d9 84 da 22 42 4d 40 1b 77 05 bd c5 97 96 3d a7
    54 8d 65 0a 1e 26 42 2e 85 2e 98 b2 30 44 c6 ad
    20 f6 3d 0f 93 7c 84 0c 19 20 a6 3e 61 d0 93 56
    f1 b7 59 ea a9 be 10 70 25 fc 71 0f 74 a3 2a 77
    c0 f4 f5 a6 1f 98 4c c9 6b 81 ff 26 73 ef 3a 34
    9e 0a 13 71 d4 94 8d e3 45 03 a2 a1 55 82 19 80
    a7 93 0f 60 04 e8 8c 46 fd 90 1e d6 37 a4 cc 22
    ba 70 60 6d f1 11 64 74 e0 2d dd 38 78 f8 56 28
    cf e2 62 e0 f0 67 2b c8 6e 4d 2b 92 f6 4c 3a 69
    e3 cb 19 ca 6c fa 07 2b 51 d6 71 93 28 cc 8b dc
    ad dd aa 3d c4 87 9e c0 0a 33 7c f4 c1 44 50 51
    58 87 59 d5 c3 24 25 a0 c2 b7 13 b7 f8 b1 18 42
    cb 67 80 54 c8 0e 6b 6d 8c 4b 46 9c 59 b0 da d3
    86 e1 7b b9 4b eb 3b d4 d0 a4 51 2c 7d 52 35 52
    27 79 b7 17 4b cb 36 a0 75 71 27 a5 ee 59 af 77
    a1 85 4f 15 36 ee 20 b7 c0 64 05 21 46 95 45 2b
    43 da 10 2b da bb 54 74 a6 bc 5b f2 09 5f db 17
    ce 90 33 5a e9 a7 3a 98 3c 93 72 5c e8 52 ad 79
    3b b2 6e 79 21 09 a8 26 a6 e1 75 5a a4 69 fa b7
    68 be b7 71 18 78 bd 10 62 34 82 60 ad 62 92 44
    e8 b8 82 0d 95 0f 99 62 c6 3e 15 25 cd 51 53 07
    51 43 5b 75 63 8b 07 ce e2 d6 73 0e f8 82 8b eb
    1f 7f 03 95 79 d4 85 77 18 b3 e4 e3 50 7f 50 b7
    52 20 78 b1 63 82 b7 69 9d 72 9a 45 bc 0c c5 64
    53 2c 27 13 23 2b 9b 57 f3 76 2f 91 4c a9 83 a0
    4c 1b d6 2d ee b9 03 bb fa c0 69 65 21 69 89 0a
    d4 4a cd 77 74 76 db a6 86 63 68 f3 f2 69 d3 58
    3d 6d 84 03 2e a8 d5 bc de ff a2 60 d1 28 b3 28
    e9 dd fc 01 46 b5 a0 53 8e 75 ad 7e 06 35 a3 5f
    61 a5 01 09 e6 1d 8b 0f a1 3b 91 77 45 4a bc 43
    00 1d 00 20 c3 98 4f 37 b5 87 d7 72 bb e3 98 af
    c7 16 37 02 38 58 b0 41 59 3b 43 17 ff 61 cc 23
    4f 61 d8 72
write to 0x7fb9bdbd90 [0x7fb9bad080] (1545 bytes => 1545 (0x609))
0000 - 16 03 01 06 04 01 00 06-00 03 03 96 1e fb 53 db   ..............S.
0010 - ea b3 ff c4 2e a7 d8 97-92 48 6d c2 bb 29 24 d3   .........Hm..)$.
0020 - c7 cf 7b ed d4 fb 41 54-01 ff 5b 20 97 3c 81 73   ..{...AT..[ .<.s
0030 - 4f 9d ce 2d 8c 07 d5 4a-a5 bc 1b f7 f0 11 05 e1   O..-...J........
0040 - 8e dc be c9 98 85 5d b9-84 bd 6a 41 00 3c 13 02   ......]...jA.<..
0050 - 13 03 13 01 c0 2c c0 30-00 9f cc a9 cc a8 cc aa   .....,.0........
0060 - c0 2b c0 2f 00 9e c0 24-c0 28 00 6b c0 23 c0 27   .+./...$.(.k.#.'
0070 - 00 67 c0 0a c0 14 00 39-c0 09 c0 13 00 33 00 9d   .g.....9.....3..
0080 - 00 9c 00 3d 00 3c 00 35-00 2f 01 00 05 7b ff 01   ...=.<.5./...{..
0090 - 00 01 00 00 00 00 11 00-0f 00 00 0c 63 68 61 74   ............chat
00a0 - 2e 71 77 65 6e 2e 61 69-00 0b 00 04 03 00 01 02   .qwen.ai........
00b0 - 00 0a 00 12 00 10 11 ec-00 1d 00 17 00 1e 00 18   ................
00c0 - 00 19 01 00 01 01 00 23-00 00 00 16 00 00 00 17   .......#........
00d0 - 00 00 00 0d 00 36 00 34-09 05 09 06 09 04 04 03   .....6.4........
00e0 - 05 03 06 03 08 07 08 08-08 1a 08 1b 08 1c 08 09   ................
00f0 - 08 0a 08 0b 08 04 08 05-08 06 04 01 05 01 06 01   ................
0100 - 03 03 03 01 03 02 04 02-05 02 06 02 00 2b 00 05   .............+..
0110 - 04 03 04 03 03 00 2d 00-02 01 01 00 33 04 ea 04   ......-.....3...
0120 - e8 11 ec 04 c0 cb 56 83-17 89 47 ef 62 11 d4 d4   ......V...G.b...
0130 - 06 8f 79 90 02 f9 a7 85-22 6b ac 67 40 d1 23 60   ..y....."k.g@.#`
0140 - 4b fb 35 61 44 92 9e dc-8c 8b b8 3b 2c b8 5d 1d   K.5aD......;,.].
0150 - e6 97 0d 78 5e cc cb 44-60 45 45 e4 a7 10 1e 3a   ...x^..D`EE....:
0160 - 82 ae 10 53 4b 97 10 28-32 3b a9 e1 a3 aa a1 ae   ...SK..(2;......
0170 - a3 08 8a c9 c2 30 96 f1-39 4a 44 19 a2 38 10 15   .....0..9JD..8..
0180 - 19 bb 2f f3 51 7c 51 28-12 07 2e 48 6c 9e 93 06   ../.Q|Q(...Hl...
0190 - 88 58 79 a6 23 87 66 21-68 2f aa b9 57 0c e5 c1   .Xy.#.f!h/..W...
01a0 - 93 00 98 88 91 ab af a5-0d 28 ac c5 c4 d9 2d 40   .........(....-@
01b0 - 89 cc 48 eb 4d 53 22 a0-8f 11 4a 75 0c 49 32 49   ..H.MS"...Ju.I2I
01c0 - 11 e2 73 b3 83 eb 80 0c-0c 9d a2 41 49 bd 1a 33   ..s........AI..3
01d0 - c3 43 b3 ff 49 a7 4e 6c-22 94 4a 75 44 0a 70 c4   .C..I.Nl".JuD.p.
01e0 - 28 98 46 03 37 b0 e3 8c-93 23 59 6d eb 44 ea f0   (.F.7....#Ym.D..
01f0 - cc 94 50 bb 62 a0 86 45-17 9a c9 b6 5a fc 11 c4   ..P.b..E....Z...
0200 - 0f f8 75 02 d9 57 40 28-38 a4 5a 5e 4d 8b 54 b8   ..u..W@(8.Z^M.T.
0210 - a7 41 ea db c9 e4 21 64-74 31 4b c9 7b 99 3f 44   .A....!dt1K.{.?D
0220 - 4b bf d1 08 f2 76 7a fd-27 3f ab b0 38 d6 00 85   K....vz.'?..8...
0230 - 6e 7c 89 89 5c 78 2c f2-aa 1a 77 6a 3b d7 5b 62   n|..\x,...wj;.[b
0240 - 67 bd 0f c2 1b d9 02 75-a5 d6 3b e6 93 5e 36 58   g......u..;..^6X
0250 - b3 12 fb 30 82 8c 6b bb-88 7d 46 3a c2 3f 34 83   ...0..k..}F:.?4.
0260 - 7d 80 55 33 32 43 c7 41-41 cd da 23 b6 9a 4d a5   }.U32C.AA..#..M.
0270 - a2 84 01 24 8c e7 63 5d-4b f9 07 72 48 35 df eb   ...$..c]K..rH5..
0280 - 86 03 68 60 9f cb 9b 52-c2 ba dd 37 9a 6d 98 34   ..h`...R...7.m.4
0290 - cb 74 69 72 83 66 e9 d3-a1 2d 36 1c ad f1 bf 33   .tir.f...-6....3
02a0 - 3c 5d a8 4c 47 0d 4b 05-10 a5 18 90 14 02 4e 54   <].LG.K.......NT
02b0 - 6c da 01 1e f2 50 54 ec-6a 8e b9 5b be 87 27 0d   l....PT.j..[..'.
02c0 - 89 c0 0e 44 9b 94 42 b1-04 c9 31 7a bb 7b 82 dd   ...D..B...1z.{..
02d0 - d4 34 b5 dc 8b 1e 07 90-72 74 ac 75 ea b3 d9 bc   .4......rt.u....
02e0 - 00 38 81 58 07 98 a7 d8-f8 57 30 12 9c b3 29 4f   .8.X.....W0...)O
02f0 - 68 5c 96 34 12 53 60 b2-b0 1a fa c4 fb 39 bc 74   h\.4.S`......9.t
0300 - c0 64 e2 86 25 31 fb 94-55 99 87 2a 59 5e 55 fb   .d..%1..U..*Y^U.
0310 - 14 43 96 2b 7e 63 42 f2-8a 72 3e 51 74 42 93 32   .C.+~cB..r>QtB.2
0320 - 6f f6 20 74 69 81 94 26-ab 79 db 01 61 70 09 c6   o. ti..&.y..ap..
0330 - a4 c0 d0 8a 90 e0 98 02-e0 20 7a 26 a5 b4 c1 e4   ......... z&....
0340 - 00 eb 79 37 0b b1 7f e9-da 56 db 51 06 ab 0a 62   ..y7.....V.Q...b
0350 - 8d 01 ce 2c 53 98 fc 57-a1 a8 e9 0d a0 13 45 e6   ...,S..W......E.
0360 - 15 56 22 a4 1e e7 17 88-41 d6 55 38 90 31 28 aa   .V".....A.U8.1(.
0370 - 8c d7 51 31 37 94 ae 71-d5 06 32 a8 44 53 7c 59   ..Q17..q..2.DS|Y
0380 - 73 c5 53 c2 17 74 78 a4-27 b8 67 96 eb 2c be b9   s.S..tx.'.g..,..
0390 - e4 b2 11 e9 92 4c 1a af-d6 8c 6c cd e9 0f b2 9c   .....L....l.....
03a0 - b1 7f 8a af f0 86 c2 99-c4 49 1f 43 b8 f3 c9 60   .........I.C...`
03b0 - 6d 15 a2 83 25 34 40 ba-61 14 73 83 36 c5 47 f3   m...%4@.a.s.6.G.
03c0 - 79 3a 1e 47 be db c9 36-52 5c 24 c5 48 4d fb 22   y:.G...6R\$.HM."
03d0 - 76 cc 33 58 59 54 af 36-f7 92 e0 ab 27 63 44 b6   v.3XYT.6....'cD.
03e0 - d6 51 91 a1 42 66 2f d5-67 fe e9 cc 4a a9 3a 1c   .Q..Bf/.g...J.:.
03f0 - e4 bd 04 d9 bc 28 81 80-3e 5c 01 b3 69 44 45 97   .....(..>\..iDE.
0400 - 0b ad 59 ae b1 d9 84 da-22 42 4d 40 1b 77 05 bd   ..Y....."BM@.w..
0410 - c5 97 96 3d a7 54 8d 65-0a 1e 26 42 2e 85 2e 98   ...=.T.e..&B....
0420 - b2 30 44 c6 ad 20 f6 3d-0f 93 7c 84 0c 19 20 a6   .0D.. .=..|... .
0430 - 3e 61 d0 93 56 f1 b7 59-ea a9 be 10 70 25 fc 71   >a..V..Y....p%.q
0440 - 0f 74 a3 2a 77 c0 f4 f5-a6 1f 98 4c c9 6b 81 ff   .t.*w......L.k..
0450 - 26 73 ef 3a 34 9e 0a 13-71 d4 94 8d e3 45 03 a2   &s.:4...q....E..
0460 - a1 55 82 19 80 a7 93 0f-60 04 e8 8c 46 fd 90 1e   .U......`...F...
0470 - d6 37 a4 cc 22 ba 70 60-6d f1 11 64 74 e0 2d dd   .7..".p`m..dt.-.
0480 - 38 78 f8 56 28 cf e2 62-e0 f0 67 2b c8 6e 4d 2b   8x.V(..b..g+.nM+
0490 - 92 f6 4c 3a 69 e3 cb 19-ca 6c fa 07 2b 51 d6 71   ..L:i....l..+Q.q
04a0 - 93 28 cc 8b dc ad dd aa-3d c4 87 9e c0 0a 33 7c   .(......=.....3|
04b0 - f4 c1 44 50 51 58 87 59-d5 c3 24 25 a0 c2 b7 13   ..DPQX.Y..$%....
04c0 - b7 f8 b1 18 42 cb 67 80-54 c8 0e 6b 6d 8c 4b 46   ....B.g.T..km.KF
04d0 - 9c 59 b0 da d3 86 e1 7b-b9 4b eb 3b d4 d0 a4 51   .Y.....{.K.;...Q
04e0 - 2c 7d 52 35 52 27 79 b7-17 4b cb 36 a0 75 71 27   ,}R5R'y..K.6.uq'
04f0 - a5 ee 59 af 77 a1 85 4f-15 36 ee 20 b7 c0 64 05   ..Y.w..O.6. ..d.
0500 - 21 46 95 45 2b 43 da 10-2b da bb 54 74 a6 bc 5b   !F.E+C..+..Tt..[
0510 - f2 09 5f db 17 ce 90 33-5a e9 a7 3a 98 3c 93 72   .._....3Z..:.<.r
0520 - 5c e8 52 ad 79 3b b2 6e-79 21 09 a8 26 a6 e1 75   \.R.y;.ny!..&..u
0530 - 5a a4 69 fa b7 68 be b7-71 18 78 bd 10 62 34 82   Z.i..h..q.x..b4.
0540 - 60 ad 62 92 44 e8 b8 82-0d 95 0f 99 62 c6 3e 15   `.b.D.......b.>.
0550 - 25 cd 51 53 07 51 43 5b-75 63 8b 07 ce e2 d6 73   %.QS.QC[uc.....s
0560 - 0e f8 82 8b eb 1f 7f 03-95 79 d4 85 77 18 b3 e4   .........y..w...
0570 - e3 50 7f 50 b7 52 20 78-b1 63 82 b7 69 9d 72 9a   .P.P.R x.c..i.r.
0580 - 45 bc 0c c5 64 53 2c 27-13 23 2b 9b 57 f3 76 2f   E...dS,'.#+.W.v/
0590 - 91 4c a9 83 a0 4c 1b d6-2d ee b9 03 bb fa c0 69   .L...L..-......i
05a0 - 65 21 69 89 0a d4 4a cd-77 74 76 db a6 86 63 68   e!i...J.wtv...ch
05b0 - f3 f2 69 d3 58 3d 6d 84-03 2e a8 d5 bc de ff a2   ..i.X=m.........
05c0 - 60 d1 28 b3 28 e9 dd fc-01 46 b5 a0 53 8e 75 ad   `.(.(....F..S.u.
05d0 - 7e 06 35 a3 5f 61 a5 01-09 e6 1d 8b 0f a1 3b 91   ~.5._a........;.
05e0 - 77 45 4a bc 43 00 1d 00-20 c3 98 4f 37 b5 87 d7   wEJ.C... ..O7...
05f0 - 72 bb e3 98 af c7 16 37-02 38 58 b0 41 59 3b 43   r......7.8X.AY;C
0600 - 17 ff 61 cc 23 4f 61 d8-72                        ..a.#Oa.r
SSL_connect:SSLv3/TLS write client hello
read from 0x7fb9bdbd90 [0x7fb9ba15f3] (5 bytes => 5 (0x5))
0000 - 15 03 03 00 02                                    .....
<<< TLS 1.2, RecordHeader [length 0005]
    15 03 03 00 02
read from 0x7fb9bdbd90 [0x7fb9ba15f8] (2 bytes => 2 (0x2))
0000 - 02 32                                             .2
<<< TLS 1.3, Alert [length 0002], fatal decode_error
    02 32
SSL3 alert read:fatal:decode error
SSL_connect:error in error
30AD32BA7F000000:error:0A00041A:SSL routines:ssl3_read_bytes:tlsv1 alert decode error:ssl/record/rec_layer_s3.c:916:SSL alert number 50
---
no peer certificate available
---
No client certificate CA names sent
Negotiated TLS1.3 group: <NULL>
---
SSL handshake has read 7 bytes and written 1545 bytes
Verification: OK
---
New, (NONE), Cipher is (NONE)
Protocol: TLSv1.3
This TLS version forbids renegotiation.
No ALPN negotiated
Early data was not sent
Verify return code: 0 (ok)
---
read from 0x7fb9bdbd90 [0x7fb9d201f0] (16384 bytes => 0)

```

<details>
<summary>tcpdump</summary>

```
root@megapro17-openwrt:~# tcpdump -i any -nn -v -X 'host 47.254.175.31 and port 443'
tcpdump: WARNING: any: That device doesn't support promiscuous mode
(Promiscuous mode not supported on the "any" device)
tcpdump: listening on any, link-type LINUX_SLL2 (Linux cooked v2), snapshot length 262144 bytes
20:06:06.628680 pppoe-wan Out IP (tos 0x0, ttl 64, id 33009, offset 0, flags [DF], proto TCP (6), length 60)
    176.99.211.220.48962 > 47.254.175.31.443: Flags [S], cksum 0x5101 (correct), seq 983017937, win 65340, options [mss 1452,sackOK,TS val 1426168326 ecr 0,nop,wscale 5], length 0
        0x0000:  4500 003c 80f1 4000 4006 566d b063 d3dc  E..<..@.@.Vm.c..
        0x0010:  2ffe af1f bf42 01bb 3a97 a9d1 0000 0000  /....B..:.......
        0x0020:  a002 ff3c 5101 0000 0204 05ac 0402 080a  ...<Q...........
        0x0030:  5501 9a06 0000 0000 0103 0305            U...........
20:06:06.671262 pppoe-wan In  IP (tos 0x34, ttl 52, id 0, offset 0, flags [DF], proto TCP (6), length 52)
    47.254.175.31.443 > 176.99.211.220.48962: Flags [S.], cksum 0x0b1a (correct), seq 4248025223, ack 983017938, win 42340, options [mss 1460,nop,nop,sackOK,nop,wscale 9], length 0
        0x0000:  4534 0034 0000 4000 3406 e332 2ffe af1f  E4.4..@.4..2/...
        0x0010:  b063 d3dc 01bb bf42 fd33 b887 3a97 a9d2  .c.....B.3..:...
        0x0020:  8012 a564 0b1a 0000 0204 05b4 0101 0402  ...d............
        0x0030:  0103 0309                                ....
20:06:06.671611 pppoe-wan Out IP (tos 0x0, ttl 64, id 33010, offset 0, flags [DF], proto TCP (6), length 40)
    176.99.211.220.48962 > 47.254.175.31.443: Flags [.], cksum 0xe958 (correct), ack 1, win 2042, length 0
        0x0000:  4500 0028 80f2 4000 4006 5680 b063 d3dc  E..(..@.@.V..c..
        0x0010:  2ffe af1f bf42 01bb 3a97 a9d2 fd33 b888  /....B..:....3..
        0x0020:  5010 07fa e958 0000                      P....X..
20:06:06.677431 pppoe-wan Out IP (tos 0x0, ttl 64, id 33011, offset 0, flags [DF], proto TCP (6), length 196)
    176.99.211.220.48962 > 47.254.175.31.443: Flags [.], cksum 0x91fd (correct), seq 1:157, ack 1, win 2042, length 156
        0x0000:  4500 00c4 80f3 4000 4006 55e3 b063 d3dc  E.....@.@.U..c..
        0x0010:  2ffe af1f bf42 01bb 3a97 a9d2 fd33 b888  /....B..:....3..
        0x0020:  5010 07fa 91fd 0000 1603 0106 0401 0006  P...............
        0x0030:  0003 036e 93b1 1f43 230a 58f2 eb35 82a4  ...n...C#.X..5..
        0x0040:  0753 fc02 b78a f296 786d 96f5 5471 8fd6  .S......xm..Tq..
        0x0050:  2fe0 8720 24f1 7033 353d c04a 93d7 1138  /...$.p35=.J...8
        0x0060:  0440 76f9 70c3 adca ecbd 1b3e 8370 7f69  .@v.p......>.p.i
        0x0070:  3ac9 6942 003c 1302 1303 1301 c02c c030  :.iB.<.......,.0
        0x0080:  009f cca9 cca8 ccaa c02b c02f 009e c024  .........+./...$
        0x0090:  c028 006b c023 c027 0067 c00a c014 0039  .(.k.#.'.g.....9
        0x00a0:  c009 c013 0033 009d 009c 003d 003c 0035  .....3.....=.<.5
        0x00b0:  002f 0100 057b ff01 0001 0000 0000 1100  ./...{..........
        0x00c0:  0f00 000c                                ....
20:06:06.677488 pppoe-wan Out IP (tos 0x0, ttl 64, id 33012, offset 0, flags [DF], proto TCP (6), length 64)
    176.99.211.220.48962 > 47.254.175.31.443: Flags [.], cksum 0x3ce5 (correct), seq 157:181, ack 1, win 2042, length 24
        0x0000:  4500 0040 80f4 4000 4006 5666 b063 d3dc  E..@..@.@.Vf.c..
        0x0010:  2ffe af1f bf42 01bb 3a97 aa6e fd33 b888  /....B..:..n.3..
        0x0020:  5010 07fa 3ce5 0000 080a b3a9 92c4 a3f5  P...<...........
        0x0030:  6015 0101 772e 676f 6f67 6c65 2e63 6f6d  `...w.google.com
20:06:06.677516 pppoe-wan Out IP (tos 0x0, ttl 64, id 33012, offset 0, flags [DF], proto TCP (6), length 64)
    176.99.211.220.48962 > 47.254.175.31.443: Flags [.], cksum 0x3ce5 (correct), seq 157:181, ack 1, win 2042, length 24
        0x0000:  4500 0040 80f4 4000 4006 5666 b063 d3dc  E..@..@.@.Vf.c..
        0x0010:  2ffe af1f bf42 01bb 3a97 aa6e fd33 b888  /....B..:..n.3..
        0x0020:  5010 07fa 3ce5 0000 080a b3a9 92c4 a3f5  P...<...........
        0x0030:  6015 0101 772e 676f 6f67 6c65 2e63 6f6d  `...w.google.com
20:06:06.677542 pppoe-wan Out IP (tos 0x0, ttl 64, id 33012, offset 0, flags [DF], proto TCP (6), length 64)
    176.99.211.220.48962 > 47.254.175.31.443: Flags [.], cksum 0x3ce5 (correct), seq 157:181, ack 1, win 2042, length 24
        0x0000:  4500 0040 80f4 4000 4006 5666 b063 d3dc  E..@..@.@.Vf.c..
        0x0010:  2ffe af1f bf42 01bb 3a97 aa6e fd33 b888  /....B..:..n.3..
        0x0020:  5010 07fa 3ce5 0000 080a b3a9 92c4 a3f5  P...<...........
        0x0030:  6015 0101 772e 676f 6f67 6c65 2e63 6f6d  `...w.google.com
20:06:06.677567 pppoe-wan Out IP (tos 0x0, ttl 64, id 33012, offset 0, flags [DF], proto TCP (6), length 64)
    176.99.211.220.48962 > 47.254.175.31.443: Flags [.], cksum 0x3ce5 (correct), seq 157:181, ack 1, win 2042, length 24
        0x0000:  4500 0040 80f4 4000 4006 5666 b063 d3dc  E..@..@.@.Vf.c..
        0x0010:  2ffe af1f bf42 01bb 3a97 aa6e fd33 b888  /....B..:..n.3..
        0x0020:  5010 07fa 3ce5 0000 080a b3a9 92c4 a3f5  P...<...........
        0x0030:  6015 0101 772e 676f 6f67 6c65 2e63 6f6d  `...w.google.com
20:06:06.677599 pppoe-wan Out IP (tos 0x0, ttl 64, id 33013, offset 0, flags [DF], proto TCP (6), length 52)
    176.99.211.220.48962 > 47.254.175.31.443: Flags [.], cksum 0xae65 (correct), seq 157:169, ack 1, win 2042, length 12
        0x0000:  4500 0034 80f5 4000 4006 5671 b063 d3dc  E..4..@.@.Vq.c..
        0x0010:  2ffe af1f bf42 01bb 3a97 aa6e fd33 b888  /....B..:..n.3..
        0x0020:  5010 07fa ae65 0000 6368 6174 2e71 7765  P....e..chat.qwe
        0x0030:  6e2e 6169                                n.ai
20:06:06.677627 pppoe-wan Out IP (tos 0x0, ttl 64, id 33014, offset 0, flags [DF], proto TCP (6), length 64)
    176.99.211.220.48962 > 47.254.175.31.443: Flags [.], cksum 0x3ce5 (correct), seq 157:181, ack 1, win 2042, length 24
        0x0000:  4500 0040 80f6 4000 4006 5664 b063 d3dc  E..@..@.@.Vd.c..
        0x0010:  2ffe af1f bf42 01bb 3a97 aa6e fd33 b888  /....B..:..n.3..
        0x0020:  5010 07fa 3ce5 0000 080a b3a9 92c4 a3f5  P...<...........
        0x0030:  6015 0101 772e 676f 6f67 6c65 2e63 6f6d  `...w.google.com
20:06:06.677652 pppoe-wan Out IP (tos 0x0, ttl 64, id 33014, offset 0, flags [DF], proto TCP (6), length 64)
    176.99.211.220.48962 > 47.254.175.31.443: Flags [.], cksum 0x3ce5 (correct), seq 157:181, ack 1, win 2042, length 24
        0x0000:  4500 0040 80f6 4000 4006 5664 b063 d3dc  E..@..@.@.Vd.c..
        0x0010:  2ffe af1f bf42 01bb 3a97 aa6e fd33 b888  /....B..:..n.3..
        0x0020:  5010 07fa 3ce5 0000 080a b3a9 92c4 a3f5  P...<...........
        0x0030:  6015 0101 772e 676f 6f67 6c65 2e63 6f6d  `...w.google.com
20:06:06.677677 pppoe-wan Out IP (tos 0x0, ttl 64, id 33014, offset 0, flags [DF], proto TCP (6), length 64)
    176.99.211.220.48962 > 47.254.175.31.443: Flags [.], cksum 0x3ce5 (correct), seq 157:181, ack 1, win 2042, length 24
        0x0000:  4500 0040 80f6 4000 4006 5664 b063 d3dc  E..@..@.@.Vd.c..
        0x0010:  2ffe af1f bf42 01bb 3a97 aa6e fd33 b888  /....B..:..n.3..
        0x0020:  5010 07fa 3ce5 0000 080a b3a9 92c4 a3f5  P...<...........
        0x0030:  6015 0101 772e 676f 6f67 6c65 2e63 6f6d  `...w.google.com
20:06:06.677702 pppoe-wan Out IP (tos 0x0, ttl 64, id 33014, offset 0, flags [DF], proto TCP (6), length 64)
    176.99.211.220.48962 > 47.254.175.31.443: Flags [.], cksum 0x3ce5 (correct), seq 157:181, ack 1, win 2042, length 24
        0x0000:  4500 0040 80f6 4000 4006 5664 b063 d3dc  E..@..@.@.Vd.c..
        0x0010:  2ffe af1f bf42 01bb 3a97 aa6e fd33 b888  /....B..:..n.3..
        0x0020:  5010 07fa 3ce5 0000 080a b3a9 92c4 a3f5  P...<...........
        0x0030:  6015 0101 772e 676f 6f67 6c65 2e63 6f6d  `...w.google.com
20:06:06.677731 pppoe-wan Out IP (tos 0x0, ttl 64, id 33015, offset 0, flags [DF], proto TCP (6), length 1324)
    176.99.211.220.48962 > 47.254.175.31.443: Flags [.], cksum 0x9c91 (correct), seq 169:1453, ack 1, win 2042, length 1284
        0x0000:  4500 052c 80f7 4000 4006 5177 b063 d3dc  E..,..@.@.Qw.c..
        0x0010:  2ffe af1f bf42 01bb 3a97 aa7a fd33 b888  /....B..:..z.3..
        0x0020:  5010 07fa 9c91 0000 000b 0004 0300 0102  P...............
        0x0030:  000a 0012 0010 11ec 001d 0017 001e 0018  ................
        0x0040:  0019 0100 0101 0023 0000 0016 0000 0017  .......#........
        0x0050:  0000 000d 0036 0034 0905 0906 0904 0403  .....6.4........
        0x0060:  0503 0603 0807 0808 081a 081b 081c 0809  ................
        0x0070:  080a 080b 0804 0805 0806 0401 0501 0601  ................
        0x0080:  0303 0301 0302 0402 0502 0602 002b 0005  .............+..
        0x0090:  0403 0403 0300 2d00 0201 0100 3304 ea04  ......-.....3...
        0x00a0:  e811 ec04 c0b8 5c10 5c18 537a e905 ca7c  ......\.\.Sz...|
        0x00b0:  6a2d 6cbc 5e32 2ae5 8595 fb18 cba7 4c7d  j-l.^2*.......L}
        0x00c0:  8ea0 7329 63b7 cb30 727b a119 0cf2 bca8  ..s)c..0r{......
        0x00d0:  2053 00d5 cb09 a975 e494 4a00 98b1 2661  .S.....u..J...&a
        0x00e0:  698c 1490 9af2 ad4f 363e 8f59 a635 941a  i......O6>.Y.5..
        0x00f0:  9c52 6d94 2b64 528c 6861 e428 eb22 1ddc  .Rm.+dR.ha.(."..
        0x0100:  ba5c 9bac b3d2 ea3a 8929 8790 f3a6 02d6  .\.....:.)......
        0x0110:  96a8 c10c 6ac8 046d d7c6 5653 4f33 a81d  ....j..m..VSO3..
        0x0120:  ec22 7654 db95 0f49 6921 ab53 3155 4000  ."vT...Ii!.S1U@.
        0x0130:  59a7 884c 1ead b06b ff07 53e1 221c f4b8  Y..L...k..S."...
        0x0140:  7487 cb6a a429 ab77 4aa6 a085 1494 8965  t..j.).wJ......e
        0x0150:  51f7 8993 cb7b 2391 4aa3 01bc 608c cf4d  Q....{#.J...`..M
        0x0160:  15a1 6f81 9a97 3968 3e01 0174 f05a a1fc  ..o...9h>..t.Z..
        0x0170:  49de 0002 15b7 5613 8baf 08ba ac4a 14a4  I.....V......J..
        0x0180:  09e9 20f6 9a48 bda3 652b 572a 15c3 8fea  .....H..e+W*....
        0x0190:  d9ca cb77 862a 9986 5f07 2ac9 a598 5fa0  ...w.*.._.*..._.
        0x01a0:  1360 58bd ccb5 bfe4 cc11 deab 9368 5c55  .`X..........h\U
        0x01b0:  d5d9 142a 67cd 9e30 9a7d 8135 232b c829  ...*g..0.}.5#+.)
        0x01c0:  db7a 8a2c bf59 16b4 a7e5 03bb a156 7738  .z.,.Y.......Vw8
        0x01d0:  8d35 3b91 2611 3091 d48c 0313 6a18 f07e  .5;.&.0.....j..~
        0x01e0:  cf2c ada6 b686 9ff5 8841 e639 9f6c 38a7  .,.......A.9.l8.
        0x01f0:  a50e 9e45 55b2 8255 28e9 3a81 2741 5789  ...EU..U(.:.'AW.
        0x0200:  6000 fc26 cb24 ab0e 04ba 6c38 9056 f53a  `..&.$....l8.V.:
        0x0210:  d0aa 1ff9 b808 003a 9d43 1115 bac8 c5a5  .......:.C......
        0x0220:  1a79 4db8 8874 ea8c f0f3 31a7 d009 47cc  .yM..t....1...G.
        0x0230:  46bc e865 7c32 9cfa 17c7 cb76 4839 565b  F..e|2.....vH9V[
        0x0240:  22e7 42fe 381a 1d92 020e 7990 824c 5a8a  ".B.8.....y..LZ.
        0x0250:  1997 8401 1e14 67b2 15d7 9f4b d920 8f97  ......g....K....
        0x0260:  6d6b 174d 08b3 c392 6b44 f801 3537 c062  mk.M....kD..57.b
        0x0270:  43fb 3d32 e19c 1662 2efe 7c03 4068 457f  C.=2...b..|.@hE.
        0x0280:  3ca4 63c1 88bc 5793 2238 cf39 1781 8586  <.c...W."8.9....
        0x0290:  72a3 a473 719a 657a 80be b86b 29bb 5a66  r..sq.ez...k).Zf
        0x02a0:  3be8 a2c3 1970 c5b5 8631 90bb b086 0459  ;....p...1.....Y
        0x02b0:  496e 49a2 05d3 3014 a538 199d a559 0259  InI...0..8...Y.Y
        0x02c0:  93ff 3456 9c69 2863 23b8 ad6a cc19 ab4f  ..4V.i(c#..j...O
        0x02d0:  bc87 aa7e e221 b19b 1f6f b709 48ec b679  ...~.!...o..H..y
        0x02e0:  1a4b c5da 2d46 92a1 7a82 a938 9b7a f748  .K..-F..z..8.z.H
        0x02f0:  c965 210f b687 62b4 e18f 1d34 6470 5519  .e!...b....4dpU.
        0x0300:  f094 3439 5300 f7fa 351e 7679 4afb 1a88  ..49S...5.vyJ...
        0x0310:  ec87 99ec 8684 96a8 4306 46f8 6c59 3ee0  ........C.F.lY>.
        0x0320:  4e66 a126 eb4c 9431 f584 a944 3f4b 2535  Nf.&.L.1...D?K%5
        0x0330:  e0aa 0638 b298 6b86 6741 0a41 51fa a38e  ...8..k.gA.AQ...
        0x0340:  5025 1d76 4ed1 9843 12d1 3ea9 d51e f081  P%.vN..C..>.....
        0x0350:  9ae3 617c 10c3 3d01 1821 aac1 c509 c26c  ..a|..=..!.....l
        0x0360:  dab4 c21e a490 9b4a 7cf7 181c 5e0a b1e1  .......J|...^...
        0x0370:  4970 ef22 504c 740a 74cb 9a47 c787 1c02  Ip."PLt.t..G....
        0x0380:  ca73 c98d f467 1063 b7ca 1fd0 6823 b4b3  .s...g.c....h#..
        0x0390:  eab3 3d21 d414 6875 86c1 171a 71d0 c07b  ..=!..hu....q..{
        0x03a0:  d8a0 5062 3095 f5b5 0986 b981 6450 08a5  ..Pb0.......dP..
        0x03b0:  4b56 3979 553b 2d9d 4276 8fe7 c30a b18b  KV9yU;-.Bv......
        0x03c0:  2e68 50e4 d46d 95d9 b64c b4cb 6fb8 07d5  .hP..m...L..o...
        0x03d0:  4467 3562 49c9 540e 9503 bdaf 84c0 1dc7  Dg5bI.T.........
        0x03e0:  3913 9114 0921 8323 495a 67d0 3020 ec09  9....!.#IZg.0...
        0x03f0:  cdf6 3259 255d 80d9 4136 744e c314 6adc  ..2Y%]..A6tN..j.
        0x0400:  9540 643a 0898 d683 6070 2fc0 c615 57bc  .@d:....`p/...W.
        0x0410:  0647 7caf 3f50 054c a16f 4fb3 aeb9 f87b  .G|.?P.L.oO....{
        0x0420:  0b91 292c 01c2 4462 04a5 23a9 8de3 bfe6  ..),..Db..#.....
        0x0430:  b035 1df9 3a16 d978 a48a 8e9f f8b2 e133  .5..:..x.......3
        0x0440:  68d2 2880 be06 bf87 2646 46a4 ba09 8865  h.(.....&FF....e
        0x0450:  e5e0 c4b6 5085 3602 891c f69b 7006 5b2c  ....P.6.....p.[,
        0x0460:  5bc4 71b1 b6b7 0855 3da9 8b05 b719 4059  [.q....U=.....@Y
        0x0470:  c34b b996 b149 55bd e210 a398 bb33 a8c6  .K...IU......3..
        0x0480:  c812 2e64 93ca f9e8 946f db5f 24b4 5bc4  ...d.....o._$.[.
        0x0490:  0947 4a6c 0a78 73ce 5f15 9523 421e 0340  .GJl.xs._..#B..@
        0x04a0:  310f bc0f 33fa adf1 49c6 2184 0bc7 c4cb  1...3...I.!.....
        0x04b0:  67e1 51d8 4a84 6f64 9c0e 8a07 3039 58f1  g.Q.J.od....09X.
        0x04c0:  7206 afb8 471b ec24 3415 c277 7411 0366  r...G..$4..wt..f
        0x04d0:  3515 93a6 5c34 b393 566c d549 3924 0310  5...\4..Vl.I9$..
        0x04e0:  70f9 adc2 d0b4 3da8 4d63 125b b920 9686  p.....=.Mc.[....
        0x04f0:  f61b e3f0 1859 3675 8ab7 3c1d e0cc 5e65  .....Y6u..<...^e
        0x0500:  093e 5a57 7863 5fc5 9623 c5ea 2d3e 341f  .>ZWxc_..#..->4.
        0x0510:  166b 3ed9 21c1 e7c4 7a1d 42c8 1008 2e6f  .k>.!...z.B....o
        0x0520:  05a3 66e7 bf8e b2a6 2e52 24ee            ..f......R$.
20:06:06.677776 pppoe-wan Out IP (tos 0x0, ttl 64, id 33016, offset 0, flags [DF], proto TCP (6), length 133)
    176.99.211.220.48962 > 47.254.175.31.443: Flags [P.], cksum 0xc122 (correct), seq 1453:1546, ack 1, win 2042, length 93
        0x0000:  4500 0085 80f8 4000 4006 561d b063 d3dc  E.....@.@.V..c..
        0x0010:  2ffe af1f bf42 01bb 3a97 af7e fd33 b888  /....B..:..~.3..
        0x0020:  5018 07fa c122 0000 0b25 9d66 fe24 7dad  P...."...%.f.$}.
        0x0030:  8eab 60bb 0671 9c20 4a58 57d9 0f6f 6ad4  ..`..q..JXW..oj.
        0x0040:  5341 e261 0c13 9c80 175e ea5f 4f93 d3db  SA.a.....^._O...
        0x0050:  22c4 0f29 d369 d089 01b3 e43f 2af1 3210  "..).i.....?*.2.
        0x0060:  6e00 1d00 20f1 a6a0 c1cd 36fd 479f 2527  n.........6.G.%'
        0x0070:  4f54 c33e e2e6 85ff 88a1 057f da7f 92bf  OT.>............
        0x0080:  ffbb a066 64                             ...fd
20:06:06.719904 pppoe-wan In  IP (tos 0x34, ttl 52, id 31414, offset 0, flags [DF], proto TCP (6), length 40)
    47.254.175.31.443 > 176.99.211.220.48962: Flags [.], cksum 0xf063 (correct), ack 157, win 83, length 0
        0x0000:  4534 0028 7ab6 4000 3406 6888 2ffe af1f  E4.(z.@.4.h./...
        0x0010:  b063 d3dc 01bb bf42 fd33 b888 3a97 aa6e  .c.....B.3..:..n
        0x0020:  5010 0053 f063 0000                      P..S.c..
20:06:06.719904 pppoe-wan In  IP (tos 0x34, ttl 52, id 31419, offset 0, flags [DF], proto TCP (6), length 52)
    47.254.175.31.443 > 176.99.211.220.48962: Flags [.], cksum 0xf01c (correct), ack 181, win 83, options [nop,nop,sack 1 {157:169}], length 0
        0x0000:  4534 0034 7abb 4000 3406 6877 2ffe af1f  E4.4z.@.4.hw/...
        0x0010:  b063 d3dc 01bb bf42 fd33 b888 3a97 aa86  .c.....B.3..:...
        0x0020:  8010 0053 f01c 0000 0101 050a 3a97 aa6e  ...S........:..n
        0x0030:  3a97 aa7a                                :..z
20:06:06.719904 pppoe-wan In  IP (tos 0x34, ttl 52, id 31420, offset 0, flags [DF], proto TCP (6), length 52)
    47.254.175.31.443 > 176.99.211.220.48962: Flags [.], cksum 0xf010 (correct), ack 181, win 83, options [nop,nop,sack 1 {157:181}], length 0
        0x0000:  4534 0034 7abc 4000 3406 6876 2ffe af1f  E4.4z.@.4.hv/...
        0x0010:  b063 d3dc 01bb bf42 fd33 b888 3a97 aa86  .c.....B.3..:...
        0x0020:  8010 0053 f010 0000 0101 050a 3a97 aa6e  ...S........:..n
        0x0030:  3a97 aa86                                :...
20:06:06.719904 pppoe-wan In  IP (tos 0x34, ttl 52, id 31421, offset 0, flags [DF], proto TCP (6), length 52)
    47.254.175.31.443 > 176.99.211.220.48962: Flags [.], cksum 0xf010 (correct), ack 181, win 83, options [nop,nop,sack 1 {157:181}], length 0
        0x0000:  4534 0034 7abd 4000 3406 6875 2ffe af1f  E4.4z.@.4.hu/...
        0x0010:  b063 d3dc 01bb bf42 fd33 b888 3a97 aa86  .c.....B.3..:...
        0x0020:  8010 0053 f010 0000 0101 050a 3a97 aa6e  ...S........:..n
        0x0030:  3a97 aa86                                :...
20:06:06.719904 pppoe-wan In  IP (tos 0x34, ttl 52, id 31415, offset 0, flags [DF], proto TCP (6), length 40)
    47.254.175.31.443 > 176.99.211.220.48962: Flags [.], cksum 0xf04b (correct), ack 181, win 83, length 0
        0x0000:  4534 0028 7ab7 4000 3406 6887 2ffe af1f  E4.(z.@.4.h./...
        0x0010:  b063 d3dc 01bb bf42 fd33 b888 3a97 aa86  .c.....B.3..:...
        0x0020:  5010 0053 f04b 0000                      P..S.K..
20:06:06.719904 pppoe-wan In  IP (tos 0x34, ttl 52, id 31416, offset 0, flags [DF], proto TCP (6), length 52)
    47.254.175.31.443 > 176.99.211.220.48962: Flags [.], cksum 0xf010 (correct), ack 181, win 83, options [nop,nop,sack 1 {157:181}], length 0
        0x0000:  4534 0034 7ab8 4000 3406 687a 2ffe af1f  E4.4z.@.4.hz/...
        0x0010:  b063 d3dc 01bb bf42 fd33 b888 3a97 aa86  .c.....B.3..:...
        0x0020:  8010 0053 f010 0000 0101 050a 3a97 aa6e  ...S........:..n
        0x0030:  3a97 aa86                                :...
20:06:06.719904 pppoe-wan In  IP (tos 0x34, ttl 52, id 31417, offset 0, flags [DF], proto TCP (6), length 52)
    47.254.175.31.443 > 176.99.211.220.48962: Flags [.], cksum 0xf010 (correct), ack 181, win 83, options [nop,nop,sack 1 {157:181}], length 0
        0x0000:  4534 0034 7ab9 4000 3406 6879 2ffe af1f  E4.4z.@.4.hy/...
        0x0010:  b063 d3dc 01bb bf42 fd33 b888 3a97 aa86  .c.....B.3..:...
        0x0020:  8010 0053 f010 0000 0101 050a 3a97 aa6e  ...S........:..n
        0x0030:  3a97 aa86                                :...
20:06:06.719905 pppoe-wan In  IP (tos 0x34, ttl 52, id 31422, offset 0, flags [DF], proto TCP (6), length 52)
    47.254.175.31.443 > 176.99.211.220.48962: Flags [.], cksum 0xf010 (correct), ack 181, win 83, options [nop,nop,sack 1 {157:181}], length 0
        0x0000:  4534 0034 7abe 4000 3406 6874 2ffe af1f  E4.4z.@.4.ht/...
        0x0010:  b063 d3dc 01bb bf42 fd33 b888 3a97 aa86  .c.....B.3..:...
        0x0020:  8010 0053 f010 0000 0101 050a 3a97 aa6e  ...S........:..n
        0x0030:  3a97 aa86                                :...
20:06:06.719914 pppoe-wan In  IP (tos 0x34, ttl 52, id 31423, offset 0, flags [DF], proto TCP (6), length 52)
    47.254.175.31.443 > 176.99.211.220.48962: Flags [.], cksum 0xf010 (correct), ack 181, win 83, options [nop,nop,sack 1 {157:181}], length 0
        0x0000:  4534 0034 7abf 4000 3406 6873 2ffe af1f  E4.4z.@.4.hs/...
        0x0010:  b063 d3dc 01bb bf42 fd33 b888 3a97 aa86  .c.....B.3..:...
        0x0020:  8010 0053 f010 0000 0101 050a 3a97 aa6e  ...S........:..n
        0x0030:  3a97 aa86                                :...
20:06:06.719915 pppoe-wan In  IP (tos 0x34, ttl 52, id 31418, offset 0, flags [DF], proto TCP (6), length 52)
    47.254.175.31.443 > 176.99.211.220.48962: Flags [.], cksum 0xf010 (correct), ack 181, win 83, options [nop,nop,sack 1 {157:181}], length 0
        0x0000:  4534 0034 7aba 4000 3406 6878 2ffe af1f  E4.4z.@.4.hx/...
        0x0010:  b063 d3dc 01bb bf42 fd33 b888 3a97 aa86  .c.....B.3..:...
        0x0020:  8010 0053 f010 0000 0101 050a 3a97 aa6e  ...S........:..n
        0x0030:  3a97 aa86                                :...
20:06:06.720236 pppoe-wan In  IP (tos 0x34, ttl 52, id 31424, offset 0, flags [DF], proto TCP (6), length 52)
    47.254.175.31.443 > 176.99.211.220.48962: Flags [.], cksum 0xeb0c (correct), ack 1453, win 83, options [nop,nop,sack 1 {169:181}], length 0
        0x0000:  4534 0034 7ac0 4000 3406 6872 2ffe af1f  E4.4z.@.4.hr/...
        0x0010:  b063 d3dc 01bb bf42 fd33 b888 3a97 af7e  .c.....B.3..:..~
        0x0020:  8010 0053 eb0c 0000 0101 050a 3a97 aa7a  ...S........:..z
        0x0030:  3a97 aa86                                :...
20:06:06.720237 pppoe-wan In  IP (tos 0x34, ttl 52, id 31426, offset 0, flags [DF], proto TCP (6), length 47)
    47.254.175.31.443 > 176.99.211.220.48962: Flags [P.], cksum 0x9ee2 (correct), seq 1:8, ack 1546, win 83, length 7
        0x0000:  4534 002f 7ac2 4000 3406 6875 2ffe af1f  E4./z.@.4.hu/...
        0x0010:  b063 d3dc 01bb bf42 fd33 b888 3a97 afdb  .c.....B.3..:...
        0x0020:  5018 0053 9ee2 0000 1503 0300 0202 32    P..S..........2
20:06:06.720237 pppoe-wan In  IP (tos 0x34, ttl 52, id 31425, offset 0, flags [DF], proto TCP (6), length 40)
    47.254.175.31.443 > 176.99.211.220.48962: Flags [.], cksum 0xeaf6 (correct), ack 1546, win 83, length 0
        0x0000:  4534 0028 7ac1 4000 3406 687d 2ffe af1f  E4.(z.@.4.h}/...
        0x0010:  b063 d3dc 01bb bf42 fd33 b888 3a97 afdb  .c.....B.3..:...
        0x0020:  5010 0053 eaf6 0000                      P..S....
20:06:06.720237 pppoe-wan In  IP (tos 0x34, ttl 52, id 31427, offset 0, flags [DF], proto TCP (6), length 40)
    47.254.175.31.443 > 176.99.211.220.48962: Flags [F.], cksum 0xeaee (correct), seq 8, ack 1546, win 83, length 0
        0x0000:  4534 0028 7ac3 4000 3406 687b 2ffe af1f  E4.(z.@.4.h{/...
        0x0010:  b063 d3dc 01bb bf42 fd33 b88f 3a97 afdb  .c.....B.3..:...
        0x0020:  5011 0053 eaee 0000                      P..S....
20:06:06.721214 pppoe-wan Out IP (tos 0x0, ttl 64, id 33013, offset 0, flags [DF], proto TCP (6), length 40)
    176.99.211.220.48962 > 47.254.175.31.443: Flags [.], cksum 0xe348 (correct), ack 8, win 2042, length 0
        0x0000:  4500 0028 80f5 4000 4006 567d b063 d3dc  E..(..@.@.V}.c..
        0x0010:  2ffe af1f bf42 01bb 3a97 afdb fd33 b88f  /....B..:....3..
        0x0020:  5010 07fa e348 0000                      P....H..
20:06:06.721310 pppoe-wan Out IP (tos 0x0, ttl 64, id 33014, offset 0, flags [DF], proto TCP (6), length 40)
    176.99.211.220.48962 > 47.254.175.31.443: Flags [.], cksum 0xe348 (correct), ack 8, win 2042, length 0
        0x0000:  4500 0028 80f6 4000 4006 567c b063 d3dc  E..(..@.@.V|.c..
        0x0010:  2ffe af1f bf42 01bb 3a97 afdb fd33 b88f  /....B..:....3..
        0x0020:  5010 07fa e348 0000                      P....H..
20:06:06.721360 pppoe-wan Out IP (tos 0x0, ttl 64, id 33015, offset 0, flags [DF], proto TCP (6), length 40)
    176.99.211.220.48962 > 47.254.175.31.443: Flags [F.], cksum 0xe346 (correct), seq 1546, ack 9, win 2042, length 0
        0x0000:  4500 0028 80f7 4000 4006 567b b063 d3dc  E..(..@.@.V{.c..
        0x0010:  2ffe af1f bf42 01bb 3a97 afdb fd33 b890  /....B..:....3..
        0x0020:  5011 07fa e346 0000                      P....F..
20:06:06.763858 pppoe-wan In  IP (tos 0x34, ttl 52, id 31428, offset 0, flags [DF], proto TCP (6), length 40)
    47.254.175.31.443 > 176.99.211.220.48962: Flags [.], cksum 0xeaed (correct), ack 1547, win 83, length 0
        0x0000:  4534 0028 7ac4 4000 3406 687a 2ffe af1f  E4.(z.@.4.hz/...
        0x0010:  b063 d3dc 01bb bf42 fd33 b890 3a97 afdc  .c.....B.3..:...
        0x0020:  5010 0053 eaed 0000                      P..S....
```

</details>

### Supporter

- [ ] I am a [sponsor](https://github.com/sponsors/nekohasekai/)

### Integrity requirements

- [x] I confirm that I have read the documentation, understand the meaning of all the configuration items I wrote, and did not pile up seemingly useful options or default values.
- [x] I confirm that I have provided the server and client configuration files and process that can be reproduced locally, instead of a complicated client configuration file that has been stripped of sensitive data.
- [x] I confirm that I have provided the simplest configuration that can be used to reproduce the error I reported, instead of depending on remote servers, TUN, graphical interface clients, or other closed-source software.
- [x] I confirm that I have provided the complete configuration files and logs, rather than just providing parts I think are useful out of confidence in my own intelligence.

**Comment by nekohasekai** [comment]
I do not accept any reports of complex tproxy integration scenarios. Please use tun + *auto_redirect* instead, as it generates more complete nftables rules and has better performance.

**Comment by megapro17** [comment]
It would be good idea to write about it here https://sing-box.sagernet.org/configuration/inbound/tproxy/ not only under auto_redirect option
