### ISSUE TITLE
Windows system/mixed TUN TCP NAT reuses stale session for same source port with different destinations

### ISSUE THREAD

**Issue by Zxneric** [SagerNet/sing-box#4224]
### 操作系统

Windows

### 系统版本

Microsoft Windows 11 专业版 10.0.26200，Build 26200，amd64

### 安装类型

sing-box 原始命令行程序

### 版本

```shell
sing-box version 1.14.0-alpha.31

Environment: go1.25.11 windows/amd64
Tags: with_gvisor,with_quic,with_dhcp,with_wireguard,with_utls,with_acme,with_clash_api,with_tailscale,with_ccm,with_ocm,with_cloudflared,with_naive_outbound,with_purego,badlinkname,tfogo_checklinkname0
Revision: fc25cedc25e9b1fcecb4f1589453cb381d518031
CGO: disabled
```

### 描述

Windows TUN inbound 使用 `stack: system` 或 `stack: mixed` 时，TCP 连接可能因为 `sing-tun` 的 system stack NAT 表只以源地址端口作为 key 而发生 session 串用。

具体代码位置：

```go
// vendor/github.com/sagernet/sing-tun/stack_system_nat.go
type TCPNat struct {
    addrMap map[netip.AddrPort]uint16
}

func (n *TCPNat) Lookup(source netip.AddrPort, destination netip.AddrPort, handler Handler) (uint16, error) {
    port, loaded := n.addrMap[source]
    if loaded {
        return port, nil
    }
    ...
    n.addrMap[source] = nextPort
    n.portMap[nextPort] = &TCPSession{
        Source:      source,
        Destination: destination,
    }
}
```

`source` 相同但 `destination` 不同的 TCP SYN 会复用同一个 NAT session。随后 `stack_system.go` 反向改写时使用旧的 `session.Destination`，导致返回包的源地址被改写成另一个历史目标地址，Windows TCP/IP 因找不到对应 endpoint 丢弃该包。

在我的环境中，WSL2 NAT 后进入 TUN 的 TCP SYN 为：

```text
172.19.0.1:53855 -> 1.1.1.1:80
```

system stack 内部改写到本地 listener：

```text
172.19.0.2:16692 -> 172.19.0.1:49730
```

listener 返回 SYN-ACK 后，预期应改写为：

```text
1.1.1.1:80 -> 172.19.0.1:53855
```

实际抓包看到的是：

```text
172.64.155.209:443 -> 172.19.0.1:53855
```

随后 Windows 丢包：

```text
DropReason INET: transport endpoint was not found
```

结果是 WSL 内部 `curl http://1.1.1.1/`、`curl https://www.google.com/`、`curl https://www.baidu.com/` 均超时；Windows 宿主机直接 curl 正常。

### 重现方式

Windows 端最小 TUN 配置：

```json
{
  "log": {
    "level": "trace"
  },
  "inbounds": [
    {
      "type": "tun",
      "tag": "tun-in",
      "interface_name": "singbox",
      "address": [
        "172.19.0.1/30"
      ],
      "auto_route": true,
      "strict_route": false,
      "stack": "mixed"
    }
  ],
  "outbounds": [
    {
      "type": "direct",
      "tag": "direct"
    }
  ],
  "route": {
    "auto_detect_interface": true,
    "final": "direct"
  }
}
```

WSL2 NAT 环境：

```shell
ip addr show eth0
# eth0: 172.26.117.194/20

ip route
# default via 172.26.112.1 dev eth0
```

触发命令：

```shell
curl -4 -v --local-port 42123 --connect-timeout 3 --max-time 4 http://1.1.1.1/
```

Windows 侧用 pktmon 观察：

```powershell
sudo pktmon filter remove
sudo pktmon filter add ORIG -i 1.1.1.1 -t TCP -p 80
sudo pktmon filter add TUNINT -i 172.19.0.0/30 -t TCP
sudo pktmon start --capture --pkt-size 0 --file-name focused.etl
# run curl in WSL
sudo pktmon stop
sudo pktmon etl2txt focused.etl -o focused.txt
```

### 日志

```shell
WSL 中 curl：


*   Trying 1.1.1.1:80...
* Local port: 42123
* Connection timed out after 3003 milliseconds
curl: (28) Connection timed out after 3003 milliseconds


pktmon 关键路径：


# WSL SYN reaches Windows
172.26.117.194.42123 > 1.1.1.1.80: Flags [S], seq 317966539

# Windows NAT sends it to singbox TUN
172.19.0.1.53855 > 1.1.1.1.80: Flags [S], seq 317966539

# sing-tun system stack rewrites it to the local TCP listener
172.19.0.2.16692 > 172.19.0.1.49730: Flags [S], seq 317966539

# local listener returns SYN-ACK
172.19.0.1.49730 > 172.19.0.2.16692: Flags [S.], seq 1701596520, ack 317966540

# reverse rewrite used stale destination from another session
172.64.155.209.443 > 172.19.0.1.53855: Flags [S.], seq 1701596520, ack 317966540

# Windows drops it
DropReason INET: transport endpoint was not found
delete: 172.64.155.209.443 > 172.19.0.1.53855: Flags [S.]
```

### 支持我们

- [ ] 我已经 [赞助](https://github.com/sponsors/nekohasekai/)

### 完整性要求

- [x] 我保证阅读了文档，了解所有我编写的配置文件项的含义，而不是大量堆砌看似有用的选项或默认值。
- [x] 我保证提供了可以在本地重现该问题的服务器、客户端配置文件与流程，而不是一个脱敏的复杂客户端配置文件。
- [x] 我保证提供了可用于重现我报告的错误的最简配置，而不是依赖远程服务器、TUN、图形界面客户端或者其他闭源软件。
- [x] 我保证提供了完整的配置文件与日志，而不是出于对自身智力的自信而仅提供了部分认为有用的部分。
