### ISSUE TITLE
Linux: TUN + auto_route breaks DNS and HTTPS connectivity (SSL_ERROR_SYSCALL, connection reset)

### ISSUE THREAD

**Issue by Sogl** [SagerNet/sing-box#3693]
## Description

I am using **sing-box (v1.12.x)** on **Ubuntu Server 22.04** as a TUN-based gateway for a local network.

The goal is:
- sing-box runs on a dedicated Linux machine
- LAN clients use it as their default gateway 192.168.100.2
- traffic is routed through a TUN interface
- DNS is provided by the local router (Mikrotik hAP ax3, 192.168.100.1) via DHCP
- HTTPS/TLS connections should work normally

### Actual behavior

When sing-box is running with **TUN + auto_route** enabled:

- DNS resolution stops working
- HTTPS connections fail
- `curl` and `curl via socks5` fail with `SSL_ERROR_SYSCALL`
- Browsers fail to load HTTPS pages (connection reset / infinite loading)
- IP connectivity still works (e.g. `ping 8.8.8.8`)

Stopping sing-box immediately restores DNS and HTTPS connectivity.

---

## Environment

- OS: Ubuntu Server 22.04 LTS (5.15.0-164-generic)
- sing-box: 1.12.14 (stable)
- systemd-resolved: **disabled**
- `/etc/resolv.conf`: regular file (not a symlink)
- DNS server: local router (via DHCP, e.g. 192.168.100.1)
- sing-box is used as a LAN gateway

## Minimal Reproducible Configuration

```json
{
  "log": {
    "level": "info"
  },

  "dns": {
    "servers": [
      {
        "tag": "local",
        "type": "dhcp",
        "detour": "direct"
      }
    ],
    "final": "local"
  },

  "inbounds": [
    {
      "type": "tun",
      "tag": "tun-in",
      "interface_name": "singtun0",
      "address": ["172.19.0.1/30"],
      "mtu": 1500,
      "auto_route": true,
      "strict_route": true,
      "sniff": true
    },
    {
      "type": "socks",
      "tag": "socks-in",
      "listen": "0.0.0.0",
      "listen_port": 1080
    }
  ],

  "outbounds": [
    {
      "type": "direct",
      "tag": "direct"
    },
    {
      "type": "vless",
      "tag": "vless-reality",
      "server": "server.example",
      "server_port": 443,
      "uuid": "UUID",
      "flow": "xtls-rprx-vision",
      "packet_encoding": "xudp",

      "tls": {
        "enabled": true,
        "server_name": "example.com",
        "reality": {
          "enabled": true,
          "public_key": "PUBLIC_KEY",
          "short_id": "SHORT_ID"
        },
        "utls": {
          "enabled": true,
          "fingerprint": "firefox"
        }
      }
    }
  ]
}
```

### IP connectivity works

```bash
ping 8.8.8.8
# OK
```

### DNS fails

```
ping google.com
# Temporary failure in name resolution
```

```
dig google.com
# no servers could be reached
```

### HTTPS / TLS fails

curl (no proxy):
```
curl https://google.com
curl: (35) SSL_ERROR_SYSCALL in connection to google.com:443
```

```
curl https://ipinfo.io
curl: (35) SSL_ERROR_SYSCALL in connection to ipinfo.io:443
```

curl via socks5 (sing-box):
```
curl -x socks5h://192.168.100.2:1080 https://google.com
curl: (35) SSL_ERROR_SYSCALL in connection to google.com:443
```

Browser behavior:
- HTTPS pages do not load
- connection is reset or stalls during TLS handshake
- typical behavior: ERR_CONNECTION_RESET or infinite loading

## Additional Observations

- The issue occurs only when TUN is enabled
- SOCKS-only mode (without TUN) works correctly
- Disabling auto_route or removing the TUN inbound restores connectivity
- The problem appears to be related to:
    - policy routing
    - DNS traffic being routed into TUN
    - asymmetric routing / conntrack drops
    - resulting TLS handshake failures (SSL_ERROR_SYSCALL)
- I found a related issue searching by `SSL_ERROR_SYSCALL` error: https://github.com/SagerNet/sing-box/issues/218
While that issue focuses on DNS, in my case the problem extends further to HTTPS/TLS failures as well.

## Expected Behavior

- TUN + auto_route should not silently break DNS and HTTPS connectivity
- If DNS handling is mandatory in this mode, it should be clearly documented
- dns.type = dhcp or system DNS should work reliably, or explicit DNS integration should be required

## Questions

1. Is this behavior expected when using TUN + auto_route on Linux without systemd-resolved?
2. Is systemd-resolved considered a required component for this mode?
3. Is DNS inbound / hijacking mandatory for stable TUN operation?
4. Is there a recommended minimal configuration for: Linux, TUN, preserving DNS and HTTPS connectivity?

## Why I opened this issue

I could not find:
- a documented requirement for systemd-resolved when using TUN + auto_route
- a working example of TUN + auto_route + DHCP DNS on Linux without resolved
- documentation explaining that DNS and TLS may break silently without additional setup

The behavior is difficult to diagnose, as IP connectivity continues to work while DNS and TLS fail.

**Comment by megapro17** [comment]
No basic respect for the open source community, AI slop!

**Comment by Sogl** [comment]
> No basic respect for the open source community, AI slop!

I'm a human, not a bot. Issue describes my real reproducible problem with sing-box. If you think something is technically wrong in the report, point it out.

**Comment by Sogl** [comment]
@nekohasekai Ok, I see my issue is closed.

Quick question: is systemd-resolved expected for TUN + auto_route on Linux?

**Comment by nekohasekai** [comment]
Since your issue didn't include any logs, we have absolutely no idea about this.

**Comment by Sogl** [comment]
@nekohasekai 

I use this `curl` command on a testing machine with 192.168.100.2 Linux sing-box gateway:
```
curl https://ya.ru    
curl: (35) LibreSSL SSL_connect: SSL_ERROR_SYSCALL in connection to ya.ru:443
```

Linux `tcpdump` on ya.ru IPs:
```
sogl@pi-testlab:~$ sudo tcpdump -i singtun0 -nn 'host 77.88.55.242 or host 77.88.44.242'
tcpdump: verbose output suppressed, use -v[v]... for full protocol decode
listening on singtun0, link-type RAW (Raw IP), snapshot length 262144 bytes
16:22:26.180469 IP 192.168.100.87.49485 > 77.88.44.242.443: Flags [S], seq 2810186250, win 65535, options [mss 1460,nop,wscale 6,nop,nop,TS val 2803994685 ecr 0,sackOK,eol], length 0
16:22:26.677428 IP 77.88.44.242.443 > 192.168.100.87.49485: Flags [S.], seq 2776384996, ack 2810186251, win 65160, options [mss 1460,sackOK,TS val 3052034552 ecr 2803994685,nop,wscale 7], length 0
16:22:26.699154 IP 192.168.100.87.49485 > 77.88.44.242.443: Flags [.], ack 1, win 2059, options [nop,nop,TS val 2803995209 ecr 3052034552], length 0
16:22:26.699700 IP 192.168.100.87.49485 > 77.88.44.242.443: Flags [P.], seq 1:316, ack 1, win 2059, options [nop,nop,TS val 2803995209 ecr 3052034552], length 315
16:22:26.853618 IP 172.19.0.1.59634 > 77.88.44.242.443: Flags [S], seq 2132137555, win 64240, options [mss 1460,sackOK,TS val 2096850285 ecr 0,nop,wscale 7], length 0
16:22:27.028325 IP 77.88.44.242.443 > 192.168.100.87.49485: Flags [.], ack 316, win 507, options [nop,nop,TS val 3052034968 ecr 2803995209], length 0
16:22:27.168526 IP 77.88.44.242.443 > 172.19.0.1.59634: Flags [S.], seq 1997950976, ack 2132137556, win 65160, options [mss 1460,sackOK,TS val 3052035153 ecr 2096850285,nop,wscale 7], length 0
16:22:27.168580 IP 172.19.0.1.59634 > 77.88.44.242.443: Flags [.], ack 1, win 502, options [nop,nop,TS val 2096850600 ecr 3052035153], length 0
16:22:27.169442 IP 172.19.0.1.59634 > 77.88.44.242.443: Flags [P.], seq 1:316, ack 1, win 502, options [nop,nop,TS val 2096850601 ecr 3052035153], length 315
16:22:27.354040 IP 172.19.0.1.59640 > 77.88.44.242.443: Flags [S], seq 1218899374, win 64240, options [mss 1460,sackOK,TS val 2096850786 ecr 0,nop,wscale 7], length 0
16:22:27.500272 IP 77.88.44.242.443 > 172.19.0.1.59634: Flags [.], ack 316, win 507, options [nop,nop,TS val 3052035465 ecr 2096850601], length 0
16:22:27.714046 IP 77.88.44.242.443 > 172.19.0.1.59640: Flags [S.], seq 2509022852, ack 1218899375, win 65160, options [mss 1460,sackOK,TS val 3052035649 ecr 2096850786,nop,wscale 7], length 0
16:22:27.714137 IP 172.19.0.1.59640 > 77.88.44.242.443: Flags [.], ack 1, win 502, options [nop,nop,TS val 2096851146 ecr 3052035649], length 0
16:22:27.738184 IP 172.19.0.1.59640 > 77.88.44.242.443: Flags [P.], seq 1:316, ack 1, win 502, options [nop,nop,TS val 2096851170 ecr 3052035649], length 315
16:22:27.932370 IP 172.19.0.1.59652 > 77.88.44.242.443: Flags [S], seq 3300481932, win 64240, options [mss 1460,sackOK,TS val 2096851364 ecr 0,nop,wscale 7], length 0
16:22:28.047441 IP 77.88.44.242.443 > 172.19.0.1.59640: Flags [.], ack 316, win 507, options [nop,nop,TS val 3052036033 ecr 2096851170], length 0
16:22:28.956781 IP 172.19.0.1.59652 > 77.88.44.242.443: Flags [S], seq 3300481932, win 64240, options [mss 1460,sackOK,TS val 2096852389 ecr 0,nop,wscale 7], length 0
16:22:30.972781 IP 172.19.0.1.59652 > 77.88.44.242.443: Flags [S], seq 3300481932, win 64240, options [mss 1460,sackOK,TS val 2096854405 ecr 0,nop,wscale 7], length 0
16:22:33.118184 IP 77.88.44.242.443 > 172.19.0.1.59640: Flags [R.], seq 1, ack 316, win 507, options [nop,nop,TS val 3052041059 ecr 2096851170], length 0
16:22:33.305477 IP 77.88.44.242.443 > 172.19.0.1.59634: Flags [F.], seq 1, ack 316, win 507, options [nop,nop,TS val 3052041257 ecr 2096850601], length 0
16:22:33.308789 IP 172.19.0.1.59634 > 77.88.44.242.443: Flags [.], ack 2, win 502, options [nop,nop,TS val 2096856741 ecr 3052041257], length 0
16:22:33.315033 IP 172.19.0.1.59634 > 77.88.44.242.443: Flags [F.], seq 316, ack 2, win 502, options [nop,nop,TS val 2096856747 ecr 3052041257], length 0
16:22:33.501929 IP 77.88.44.242.443 > 192.168.100.87.49485: Flags [F.], seq 1, ack 316, win 507, options [nop,nop,TS val 3052041438 ecr 2803995209], length 0
16:22:33.505832 IP 192.168.100.87.49485 > 77.88.44.242.443: Flags [.], ack 2, win 2059, options [nop,nop,TS val 2804002014 ecr 3052041438], length 0
16:22:33.506456 IP 192.168.100.87.49485 > 77.88.44.242.443: Flags [F.], seq 316, ack 2, win 2059, options [nop,nop,TS val 2804002014 ecr 3052041438], length 0
16:22:33.641171 IP 77.88.44.242.443 > 172.19.0.1.59634: Flags [.], ack 317, win 507, options [nop,nop,TS val 3052041626 ecr 2096856747], length 0
16:22:33.840926 IP 77.88.44.242.443 > 192.168.100.87.49485: Flags [.], ack 317, win 507, options [nop,nop,TS val 3052041802 ecr 2804002014], length 0
^C
27 packets captured
27 packets received by filter
0 packets dropped by kernel
```

sing-box journal:
```
sogl@pi-testlab:~$ sudo journalctl -u sing-box -f -o short-precise --no-pager | grep -E 'tcp|TLS|connection:' | grep -v quic
Jan 17 16:22:51.890463 pi-testlab sing-box[1260]: +0000 2026-01-17 16:22:51 DEBUG [340352121 7.77s] connection: connection download finished
Jan 17 16:22:51.972044 pi-testlab sing-box[1260]: +0000 2026-01-17 16:22:51 DEBUG [81968904 8.48s] connection: connection download finished
Jan 17 16:22:52.169945 pi-testlab sing-box[1260]: +0000 2026-01-17 16:22:52 DEBUG [1177143871 9.29s] connection: connection download finished
Jan 17 16:22:52.197584 pi-testlab sing-box[1260]: +0000 2026-01-17 16:22:52 DEBUG [1038527077 9.71s] connection: connection upload finished
Jan 17 16:22:52.445151 pi-testlab sing-box[1260]: +0000 2026-01-17 16:22:52 DEBUG [543093009 9.48s] connection: connection upload finished
Jan 17 16:22:52.452078 pi-testlab sing-box[1260]: +0000 2026-01-17 16:22:52 DEBUG [3241984492 10.7s] connection: connection download finished
Jan 17 16:22:52.538761 pi-testlab sing-box[1260]: +0000 2026-01-17 16:22:52 ERROR [4127156432 5.36s] connection: open connection to 34.54.84.110:443 using outbound/direct[direct]: dial tcp 34.54.84.110:443: i/o timeout
Jan 17 16:22:52.538761 pi-testlab sing-box[1260]: +0000 2026-01-17 16:22:52 ERROR [2999780374 5.24s] connection: open connection to 34.54.84.110:443 using outbound/direct[direct]: dial tcp 34.54.84.110:443: i/o timeout
Jan 17 16:22:52.570153 pi-testlab sing-box[1260]: +0000 2026-01-17 16:22:52 ERROR [1030620310 5.11s] connection: open connection to 34.54.84.110:443 using outbound/direct[direct]: dial tcp 34.54.84.110:443: i/o timeout
Jan 17 16:22:52.596433 pi-testlab sing-box[1260]: +0000 2026-01-17 16:22:52 DEBUG [1961248807 10.80s] connection: connection download finished
Jan 17 16:22:52.625429 pi-testlab sing-box[1260]: +0000 2026-01-17 16:22:52 DEBUG [1515139588 9.13s] connection: connection upload finished
Jan 17 16:22:52.886098 pi-testlab sing-box[1260]: +0000 2026-01-17 16:22:52 DEBUG [403700413 11.58s] connection: connection download finished
Jan 17 16:22:52.886098 pi-testlab sing-box[1260]: +0000 2026-01-17 16:22:52 DEBUG [3271559655 8.84s] connection: connection upload finished
Jan 17 16:22:52.925532 pi-testlab sing-box[1260]: +0000 2026-01-17 16:22:52 DEBUG [3900653176 6.61s] connection: connection download finished
Jan 17 16:22:52.944645 pi-testlab sing-box[1260]: +0000 2026-01-17 16:22:52 DEBUG [4127168928 6.30s] connection: connection download finished
Jan 17 16:22:53.089267 pi-testlab sing-box[1260]: +0000 2026-01-17 16:22:53 DEBUG [701866117 12.36s] connection: connection download finished
Jan 17 16:22:53.095005 pi-testlab sing-box[1260]: +0000 2026-01-17 16:22:53 DEBUG [1728709003 8.55s] connection: connection upload finished
Jan 17 16:22:53.144853 pi-testlab sing-box[1260]: +0000 2026-01-17 16:22:53 DEBUG [2960776668 6.83s] connection: connection download finished
Jan 17 16:22:53.291263 pi-testlab sing-box[1260]: +0000 2026-01-17 16:22:53 DEBUG [3639223640 8.16s] connection: connection upload finished
Jan 17 16:22:53.291926 pi-testlab sing-box[1260]: +0000 2026-01-17 16:22:53 DEBUG [3465395462 13.25s] connection: connection download finished
Jan 17 16:22:53.467850 pi-testlab sing-box[1260]: +0000 2026-01-17 16:22:53 DEBUG [2571823956 7.61s] connection: connection download finished
Jan 17 16:22:53.616515 pi-testlab sing-box[1260]: +0000 2026-01-17 16:22:53 DEBUG [3735107290 13.97s] connection: connection download finished
Jan 17 16:22:53.620354 pi-testlab sing-box[1260]: +0000 2026-01-17 16:22:53 DEBUG [1765041723 7.78s] connection: connection upload finished
Jan 17 16:22:53.644525 pi-testlab sing-box[1260]: +0000 2026-01-17 16:22:53 DEBUG [123037176 2.11s] connection: connection upload finished
Jan 17 16:22:53.645237 pi-testlab sing-box[1260]: +0000 2026-01-17 16:22:53 DEBUG [17762445 4.50s] connection: connection upload finished
Jan 17 16:22:53.754197 pi-testlab sing-box[1260]: +0000 2026-01-17 16:22:53 ERROR [1232916545 5.9s] connection: open connection to 17.248.214.70:443 using outbound/direct[direct]: dial tcp 17.248.214.70:443: i/o timeout
```

Looks like reply packets for TUN connections are not consistently returning through the same path when `auto_route` + `strict_route` are enabled, causing TCP connections to break.
