### ISSUE TITLE
使用fakeip时，如果节点为urltest，udp无法使用

### ISSUE THREAD

**Issue by YUeH885** [SagerNet/sing-box#3594]
### 操作系统

Linux

### 系统版本

Arch Linux

### 安装类型

sing-box 原始命令行程序

### 版本

```shell
sing-box version 1.12.12

Environment: go1.25.3 linux/amd64
Tags: with_gvisor,with_quic,with_dhcp,with_wireguard,with_utls,with_acme,with_clash_api,with_tailscale
Revision: 54ed58499d7063136ed52dabf87d179d252425d0
CGO: disabled
```

### 描述

使用fakeip时，如果节点为urltest，udp无法使用
不是fakeip，或者节点不是urltest，则正常使用

### 重现方式

`server.json`
```
{
  "dns": {
    "servers": [
      {
        "type": "local",
        "tag": "local"
      }
    ]
  },
  "inbounds": [
    {
      "type": "anytls",
      "listen": "192.168.31.1",
      "listen_port": 1443,
      "tls": {
        "enabled": true,
        "certificate_path": "./cert.pem",
        "key_path": "./key.pem"
      },
      "users": [
        {
          "password": "efLAY21HBme0Thk+OVQNnw=="
        }
      ]
    }
  ],
  "outbounds": [
    {
      "type": "direct",
      "tag": "direct"
    }
  ]
}
```
`client.json`
```
{
  "dns": {
    "servers": [
      {
        "type": "udp",
        "tag": "cf",
        "server": "1.1.1.1",
        "server_port": 53
      },
      {
        "type": "fakeip",
        "tag": "fakeip",
        "inet4_range": "198.18.0.0/15",
        "inet6_range": "2001:2:0:31fe::/64"
      }
    ],
    "rules": [
      {
        "query_type": [
          "A",
          "AAAA"
        ],
        "server": "fakeip"
      }
    ]
  },
  "inbounds": [
    {
      "type": "tun",
      "tag": "tun-in",
      "interface_name": "tun0",
      "address": [
        "172.18.0.1/30",
        "fdfe:dcba:9876::1/126"
      ],
      "mtu": 9000,
      "auto_route": true,
      "auto_redirect": true
    }
  ],
  "outbounds": [
    {
      "type": "selector",
      "tag": "proxy",
      "outbounds": [
        "anytls-out",
        "urltest-out"
      ],
      "default": "urltest-out"
    },
    {
      "type": "urltest",
      "tag": "urltest-out",
      "outbounds": [
        "anytls-out"
      ]
    },
    {
      "type": "anytls",
      "tag": "anytls-out",
      "server": "192.168.31.1",
      "server_port": 1443,
      "tls": {
        "enabled": true,
        "server_name": "example.com"
      },
      "password": "efLAY21HBme0Thk+OVQNnw=="
    }
  ],
  "route": {
    "rules": [
      {
        "port": 53,
        "action": "hijack-dns"
      }
    ],
    "auto_detect_interface": true
  }
}
```

### 日志

```shell
# sing-box run -c server.json
INFO[0000] network: updated default interface wlp0s20f3, index 2
INFO[0000] inbound/anytls[0]: tcp server started at 192.168.31.1:1443
INFO[0000] sing-box started (0.00s)
INFO[0002] [180745676 0ms] inbound/anytls[0]: inbound connection from 192.168.31.2:38952
INFO[0002] [180745676 28ms] inbound/anytls[0]: inbound connection to www.gstatic.com:443
INFO[0002] [180745676 28ms] outbound/direct[direct]: outbound connection to www.gstatic.com:443
DEBUG[0002] [180745676 28ms] dns: lookup domain www.gstatic.com
DEBUG[0002] [180745676 33ms] dns: exchanged www.gstatic.com NOERROR 38
DEBUG[0002] [180745676 33ms] dns: exchanged A www.gstatic.com. 38 IN A 142.250.186.131
DEBUG[0002] [180745676 33ms] dns: exchanged www.gstatic.com NOERROR 155
DEBUG[0002] [180745676 33ms] dns: exchanged AAAA www.gstatic.com. 155 IN AAAA 2a00:1450:4001:82a::2003
DEBUG[0002] [180745676 33ms] dns: lookup succeed for www.gstatic.com: 142.250.186.131 2a00:1450:4001:82a::2003
TRACE[0003] [180745676 579ms] connection: connection download closed
TRACE[0003] [180745676 579ms] connection: connection upload closed
INFO[0007] [180745676 5.3s] inbound/anytls[0]: inbound connection to sp.v2.udp-over-tcp.arpa:0
ERROR[0007] [180745676 5.3s] inbound/anytls[0]: process connection from 192.168.31.2:38952: UoT read request: use of closed network connection
INFO[0008] [180745676 6.3s] inbound/anytls[0]: inbound connection to sp.v2.udp-over-tcp.arpa:0
ERROR[0008] [180745676 6.3s] inbound/anytls[0]: process connection from 192.168.31.2:38952: UoT read request: use of closed network connection


# sing-box run -c client.json
INFO[0000] network: updated default interface sing-box-ns, index 3
TRACE[0000] inbound/tun[tun-in]: creating stack
INFO[0000] inbound/tun[tun-in]: started at tun0
INFO[0000] sing-box started (0.11s)
INFO[0000] outbound/anytls[anytls-out]: outbound connection to www.gstatic.com:443
DEBUG[0000] outbound/urltest[urltest-out]: outbound anytls-out available: 579ms
INFO[0005] [2734798373 0ms] inbound/tun[tun-in]: inbound packet connection from 192.168.31.2:56994
INFO[0005] [2734798373 0ms] inbound/tun[tun-in]: inbound packet connection to 172.18.0.2:53
DEBUG[0005] [2734798373 0ms] router: match[0] port=53 => hijack-dns
DEBUG[0005] [2734798373 0ms] dns: exchange cloudflare.com. IN AAAA
DEBUG[0005] [2734798373 0ms] dns: match[1] query_type=[A AAAA] => route(fakeip)
DEBUG[0005] [2734798373 0ms] dns: exchange cloudflare.com. IN A
DEBUG[0005] [2734798373 0ms] dns: exchanged cloudflare.com NOERROR 600
DEBUG[0005] [2734798373 0ms] dns: match[1] query_type=[A AAAA] => route(fakeip)
INFO[0005] [2734798373 0ms] dns: exchanged AAAA cloudflare.com. 600 IN AAAA 2001:2:0:31fe::3
DEBUG[0005] [2734798373 0ms] dns: exchanged cloudflare.com NOERROR 600
INFO[0005] [2734798373 0ms] dns: exchanged A cloudflare.com. 600 IN A 198.18.0.3
DEBUG[0005] router: found fakeip domain: cloudflare.com
INFO[0005] [2896956969 0ms] inbound/tun[tun-in]: inbound packet connection from 192.168.31.2:57566
INFO[0005] [2896956969 0ms] inbound/tun[tun-in]: inbound packet connection to 198.18.0.3:443
DEBUG[0005] [2896956969 0ms] router: found fakeip domain: cloudflare.com
INFO[0005] [2896956969 0ms] outbound/anytls[anytls-out]: outbound UoT packet connection to cloudflare.com:443
DEBUG[0005] [2896956969 0ms] connection: packet upload closed: (unsupported address | write handshake failure: invalid argument)
TRACE[0005] [2896956969 0ms] connection: packet download closed
DEBUG[0006] router: found fakeip domain: cloudflare.com
INFO[0006] [3936862116 0ms] inbound/tun[tun-in]: inbound packet connection from 192.168.31.2:57566
INFO[0006] [3936862116 0ms] inbound/tun[tun-in]: inbound packet connection to 198.18.0.3:443
DEBUG[0006] [3936862116 0ms] router: found fakeip domain: cloudflare.com
INFO[0006] [3936862116 0ms] outbound/anytls[anytls-out]: outbound UoT packet connection to cloudflare.com:443
DEBUG[0006] [3936862116 0ms] connection: packet upload closed: (unsupported address | write handshake failure: invalid argument)
TRACE[0006] [3936862116 0ms] connection: packet download closed
```

### 支持我们

- [ ] 我已经 [赞助](https://github.com/sponsors/nekohasekai/)

### 完整性要求

- [x] 我保证阅读了文档，了解所有我编写的配置文件项的含义，而不是大量堆砌看似有用的选项或默认值。
- [x] 我保证提供了可以在本地重现该问题的服务器、客户端配置文件与流程，而不是一个脱敏的复杂客户端配置文件。
- [x] 我保证提供了可用于重现我报告的错误的最简配置，而不是依赖远程服务器、TUN、图形界面客户端或者其他闭源软件。
- [x] 我保证提供了完整的配置文件与日志，而不是出于对自身智力的自信而仅提供了部分认为有用的部分。

**Comment by YUeH885** [comment]
开启`udp_connect`之后，回包的源端口会变成代理服务器的端口，会被内核丢弃
```
12:59:48.167891 tun0  Out IP 192.168.31.2.43943 > 198.18.0.3.443: UDP, length 1200
12:59:48.382517 tun0  In  IP 198.18.0.3.1443 > 192.168.31.2.43943: UDP, length 1200
12:59:48.382617 sing-box-ns Out IP 192.168.31.2 > 198.18.0.3: ICMP 192.168.31.2 udp port 43943 unreachable, length 556
```

**Comment by maimaobing** [comment]
https://github.com/SagerNet/sing-box/issues/3204 感觉和我发的issue是一样的问题呢？
