### ISSUE TITLE
sing-box WireGuard outbound 使用 ipv6 连接拥有多个 ipv6 地址的 peer 大概率握手失败

### ISSUE THREAD

**Issue by yv-code** [SagerNet/sing-box#1730]
### 操作系统

其他

### 系统版本

所有系统均可复现

### 安装类型

sing-box 原始命令行程序

### 版本

1.8.12 和 1.9.0-rc.14 都可以复现。（本人实测平台 iOS, macOS, Android）

### 描述

sing-box 在连接多 IPv6 地址的远端 WireGuard peer 时，peer 回复握手可能会使用另一个 IPv6 源 IP，sing-box 不能很好的处理这种情况，导致握手失败。如果 sing-box 填写的 WireGuard 服务器 IPv6 地址正好是服务器对外发起请求的地址，那么不会有任何问题。而 WireGuard 的官方 APP 在这种情况下完全正常。

服务端的 tcpdump 如下（客户端 sing-box ipv6 地址 fd00::c00，服务端有两个地址  fd00::100 和  fd00::200）：
```
13:17:32.943384 IP6 fd00::c00.56936 > fd00::100.51820: UDP, length 148
13:17:32.944278 IP6 fd00::200.51820 > fd00::c00.56936: UDP, length 92
13:17:38.223492 IP6 fd00::c00.56936 > fd00::100.51820: UDP, length 148
13:17:38.224126 IP6 fd00::200.51820 > fd00::c00.56936: UDP, length 92
13:17:43.365998 IP6 fd00::c00.56936 > fd00::100.51820: UDP, length 148
13:17:43.366585 IP6 fd00::200.51820 > fd00::c00.56936: UDP, length 92
```
sing-box 日志如下：
```
2024-05-01 13:17:31 DEBUG outbound/wireguard[wg-out]: peer(ZQ2n…4HGY) - sending handshake initiation
2024-05-01 13:17:37 DEBUG outbound/wireguard[wg-out]: peer(ZQ2n…4HGY) - handshake did not complete after 5 seconds, retrying (try 2)
2024-05-01 13:17:37 DEBUG outbound/wireguard[wg-out]: peer(ZQ2n…4HGY) - sending handshake initiation
2024-05-01 13:17:42 DEBUG outbound/wireguard[wg-out]: peer(ZQ2n…4HGY) - handshake did not complete after 5 seconds, retrying (try 2)
2024-05-01 13:17:42 DEBUG outbound/wireguard[wg-out]: peer(ZQ2n…4HGY) - sending handshake initiation
```

### 重现方式

创建一个有多 IPv6 地址的 Debian Linux server，通过 `curl ifconfig.me` 确认服务器对外发起连接的 IPv6 地址，使用 sing-box 填入其余的 ipv6 地址去连接，无法握手成功。

<details>
  <summary>最小 sing-box 配置：</summary>

```json
{
    "log": {
        "level": "debug"
    },
    "dns": {
        "servers": [
            {
                "tag": "local",
                "address": "local"
            },
            {
                "tag": "block",
                "address": "rcode://refused"
            }
        ],
        "final": "local",
        "strategy": "prefer_ipv4"
    },
    "inbounds": [
      {
        "type": "mixed",
        "tag": "mixed-in",
        "listen": "::",
        "listen_port": 2080,
        "set_system_proxy": false
      }
    ],
    "outbounds": [
        {
            "type": "direct",
            "tag": "direct"
        },
        {
            "type": "block",
            "tag": "block"
        },
        {
            "type": "dns",
            "tag": "dns-out"
        },
        {
            "type": "wireguard",
            "tag": "wg-out",
            "server": "server-with-multi-ipv6-address.domain",
            "server_port": 51820,
            "system_interface": false,
            "local_address": [
                "10.8.0.3/24"
            ],
            "private_key": "kBGr6Bs3Uw3S5YvR0rSGnUZJs8K83aSImJQA9dTVGlg=",
            "peer_public_key": "ZQ2nvYrz5acw5G9iYZV96D0k5HftWf1y4q44X4u4HGY=",
            "pre_shared_key": "s8AlLW+h8FZ79DX3DSwtSKGB30rFJIHwJcqvJJeNy34=",
            "mtu": 1280
        }
    ],
    "route": {
        "rules": [
            {
                "protocol": "dns",
                "outbound": "dns-out"
            }
        ],
        "auto_detect_interface": true,
        "final": "wg-out"
    }
}
```

</details >

### 支持我们

- [X] 我已经 [赞助](https://github.com/sponsors/nekohasekai/)

### 完整性要求

- [X] 我保证阅读了文档，了解所有我编写的配置文件项的含义，而不是大量堆砌看似有用的选项或默认值。
- [X] 我保证提供了可以在本地重现该问题的服务器、客户端配置文件与流程，而不是一个脱敏的复杂客户端配置文件。
- [X] 我保证提供了可用于重现我报告的错误的最简配置，而不是依赖远程服务器、TUN、图形界面客户端或者其他闭源软件。
- [X] 我保证提供了完整的配置文件与日志，而不是出于对自身智力的自信而仅提供了部分认为有用的部分。

**Comment by madswaord** [comment]
我也出现了握手失败的问题， 跟你一样"local_address"只有一个ipv4地址段，server域名为AAAA单ipv6解析，clash跟nekobox4A同样的配置连接无问题。![Screenshot_2024-05-02-09-08-32-544_io.nekohasekai.sfa.jpg](https://github.com/SagerNet/sing-box/assets/86275875/58181a84-7c9c-465b-b29c-35110bec194a)

**Comment by oborrm** [comment]
> 我也出现了握手失败的问题， 跟你一样"local_address"只有一个ipv4地址段，server域名为AAAA单ipv6解析，clash跟nekobox4A同样的配置连接无问题。![Screenshot_2024-05-02-09-08-32-544_io.nekohasekai.sfa.jpg](https://private-user-images.githubusercontent.com/86275875/327287329-58181a84-7c9c-465b-b29c-35110bec194a.jpg?jwt=eyJhbGciOiJIUzI1NiIsInR5cCI6IkpXVCJ9.eyJpc3MiOiJnaXRodWIuY29tIiwiYXVkIjoicmF3LmdpdGh1YnVzZXJjb250ZW50LmNvbSIsImtleSI6ImtleTUiLCJleHAiOjE3MTUwMDg1ODcsIm5iZiI6MTcxNTAwODI4NywicGF0aCI6Ii84NjI3NTg3NS8zMjcyODczMjktNTgxODFhODQtN2M5Yy00NjViLWIyOWMtMzUxMTBiZWMxOTRhLmpwZz9YLUFtei1BbGdvcml0aG09QVdTNC1ITUFDLVNIQTI1NiZYLUFtei1DcmVkZW50aWFsPUFLSUFWQ09EWUxTQTUzUFFLNFpBJTJGMjAyNDA1MDYlMkZ1cy1lYXN0LTElMkZzMyUyRmF3czRfcmVxdWVzdCZYLUFtei1EYXRlPTIwMjQwNTA2VDE1MTEyN1omWC1BbXotRXhwaXJlcz0zMDAmWC1BbXotU2lnbmF0dXJlPWE1ODlmODc1ODY2Y2FiODkzMTc3ZjIxYTkxOWQyYzI3YzBjOGJmMjk3MmE4YzBmNDYyNDBmNGIxZGZiZmRmNWEmWC1BbXotU2lnbmVkSGVhZGVycz1ob3N0JmFjdG9yX2lkPTAma2V5X2lkPTAmcmVwb19pZD0wIn0.8yCtWLpJDcKPIJSAr_2mdoFz5hbj-R2apRuf69tcEH8)

你试下把wireguard里的workers的数量调高试下，8 or 16 or 32之类的

**Comment by vvveeerrr** [comment]
sing-box可以用wireguard协议吗？我怎么不知道？这样岂不是可以用warp了？

**Comment by godfather216** [comment]
怎么配置 wireguard 的呢？有具体教程不？

**Comment by M00nBack** [comment]
遇到相同的问题

**Comment by llity** [comment]
> 怎么配置 wireguard 的呢？有具体教程不？

会配了吗？
