### ISSUE TITLE
After enabling sing-box, UDP 123 is blocked, causing the robot vacuum to be unable to connect to the internet

### ISSUE THREAD

**Issue by zhjh0521** [SagerNet/sing-box#4215]
### Operating system

Others

### System version

ImmortalWRT 25.12.0

### Installation type

Original sing-box Command Line

### Version

```shell
sing-box version 1.12.25 Environment: go1.26.2 linux/amd64 Tags: with_acme,with_clash_api,with_dhcp,with_gvisor,with_quic,with_tailscale,with_utls,with_wireguard CGO: enabled
```

### Description

I recently upgraded ImmortalWrt (from 24.10 to 25.12.0) and found that my robot vacuum (DJI Romo P, static IP 192.168.10.103) can no longer connect via the app. After much troubleshooting, I discovered that the issue resolves when I disable sing-box.

sing-box is running as a raw kernel process on ImmortalWrt. I tried adjusting the configuration to bypass the robot's IP (direct connection) and filter out DJI's domains, but neither worked. Finally, through packet capture, I found that when sing-box is running, the service requested by the robot is directly rejected. (IP 192.168.10.1 > 192.168.10.103: ICMP 119.28.183.184 udp port 123 unreachable, length 84)

```
root@Will:~# tcpdump -i br-lan host 192.168.10.103 -n -c 30
tcpdump: verbose output suppressed, use -v[v]... for full protocol decode
listening on br-lan, link-type EN10MB (Ethernet), snapshot length 262144 bytes
18:04:33.862409 IP 192.168.10.103 > 192.168.10.1: ICMP echo request, id 39940, seq 20, length 136
18:04:33.862437 IP 192.168.10.1 > 192.168.10.103: ICMP echo reply, id 39940, seq 20, length 136
18:04:34.055420 ARP, Request who-has 192.168.10.1 (e4:3a:6e:5f:39:19) tell 192.168.10.103, length 46
18:04:34.055427 ARP, Reply 192.168.10.1 is-at e4:3a:6e:5f:39:19, length 28
18:04:35.862416 IP 192.168.10.103 > 192.168.10.1: ICMP echo request, id 39940, seq 21, length 136
18:04:35.862437 IP 192.168.10.1 > 192.168.10.103: ICMP echo reply, id 39940, seq 21, length 136
18:04:37.862403 IP 192.168.10.103 > 192.168.10.1: ICMP echo request, id 39940, seq 22, length 136
18:04:37.862420 IP 192.168.10.1 > 192.168.10.103: ICMP echo reply, id 39940, seq 22, length 136
18:04:39.320903 ARP, Request who-has 192.168.10.103 tell 192.168.10.2, length 46
18:04:39.320950 ARP, Request who-has 192.168.10.103 tell 192.168.10.2, length 46
18:04:39.862426 IP 192.168.10.103 > 192.168.10.1: ICMP echo request, id 39940, seq 23, length 136
18:04:39.862442 IP 192.168.10.1 > 192.168.10.103: ICMP echo reply, id 39940, seq 23, length 136
18:04:40.015469 IP 192.168.10.103.52990 > 119.28.183.184.123: NTPv4, Client, length 48
18:04:40.015488 IP 192.168.10.1 > 192.168.10.103: ICMP 119.28.183.184 udp port 123 unreachable, length 84
18:04:40.015473 IP 192.168.10.103.47158 > 162.159.200.1.123: NTPv4, Client, length 48
18:04:40.015500 IP 192.168.10.1 > 192.168.10.103: ICMP 162.159.200.1 udp port 123 unreachable, length 84
18:04:40.015476 IP 192.168.10.103.60781 > 106.55.184.199.123: NTPv4, Client, length 48
18:04:40.015510 IP 192.168.10.1 > 192.168.10.103: ICMP 106.55.184.199 udp port 123 unreachable, length 84
18:04:40.016336 IP 192.168.10.103.38017 > 118.31.3.89.123: NTPv4, Client, length 48
18:04:40.016348 IP 192.168.10.1 > 192.168.10.103: ICMP 118.31.3.89 udp port 123 unreachable, length 84
18:04:41.861400 IP 192.168.10.103 > 192.168.10.1: ICMP echo request, id 39940, seq 24, length 136
18:04:41.861418 IP 192.168.10.1 > 192.168.10.103: ICMP echo reply, id 39940, seq 24, length 136
18:04:43.863395 IP 192.168.10.103 > 192.168.10.1: ICMP echo request, id 39940, seq 25, length 136
18:04:43.863414 IP 192.168.10.1 > 192.168.10.103: ICMP echo reply, id 39940, seq 25, length 136
18:04:45.861396 IP 192.168.10.103 > 192.168.10.1: ICMP echo request, id 39940, seq 26, length 136
18:04:45.861416 IP 192.168.10.1 > 192.168.10.103: ICMP echo reply, id 39940, seq 26, length 136
18:04:47.861389 IP 192.168.10.103 > 192.168.10.1: ICMP echo request, id 39940, seq 27, length 136
18:04:47.861405 IP 192.168.10.1 > 192.168.10.103: ICMP echo reply, id 39940, seq 27, length 136
18:04:48.913616 ARP, Request who-has 192.168.10.103 tell 192.168.10.1, length 28
18:04:48.981363 ARP, Reply 192.168.10.103 is-at 8c:58:23:e4:9b:b8, length 46
30 packets captured
30 packets received by filter
0 packets dropped by kernel
```
I asked an AI how to resolve this. Since my sing-box version is 1.12.25, I eventually solved the problem by adding a rule to the nftables to bypass the robot's MAC address.

This method feels a bit unconventional. Why does sing-box block UDP port 123 requests in the first place? Is there a more elegant solution?

### Reproduction

As detailed in the description.

### Logs

```shell

```

### Supporter

- [ ] I am a [sponsor](https://github.com/sponsors/nekohasekai/)

### Integrity requirements

- [x] I confirm that I have read the documentation, understand the meaning of all the configuration items I wrote, and did not pile up seemingly useful options or default values.
- [x] I confirm that I have provided the server and client configuration files and process that can be reproduced locally, instead of a complicated client configuration file that has been stripped of sensitive data.
- [x] I confirm that I have provided the simplest configuration that can be used to reproduce the error I reported, instead of depending on remote servers, TUN, graphical interface clients, or other closed-source software.
- [x] I confirm that I have provided the complete configuration files and logs, rather than just providing parts I think are useful out of confidence in my own intelligence.
