### ISSUE TITLE
Request timed out (occasional)

### ISSUE THREAD

**Issue by kanebay** [SagerNet/sing-box#3783]
### 操作系统

Linux

### 系统版本

Rocky Linux release 9.7 (Blue Onyx)

### 安装类型

sing-box 原始命令行程序

### 版本

```shell
sing-box version 1.12.20

Environment: go1.25.7 linux/amd64
Tags: with_gvisor,with_quic,with_dhcp,with_wireguard,with_utls,with_acme,with_clash_api,with_tailscale
Revision: 0f3774e50116afef049c6d7ce33a50574071529e
CGO: disabled

Additionally, on the Linux x86 architecture, I have encountered this issue from version 1.12.12 up to the latest release.
```

## Background:
Singbox employs tun mode as a transparent proxy gateway for the local area network (LAN). All LAN traffic is encapsulated by Singbox and forwarded to the destination. The total number of connections from LAN clients hovers around 2000 (as per Clash API statistics).

## Issue:
Recently, I and several other LAN users have noticed that during occasional periods, any device attempting to access any website experiences timeout errors. Repeated refreshes or reconnections fail, with outages lasting from several minutes to over ten minutes.

### 1. During affected periods, DNS resolution functions normally. Debug-level logs from Singbox show:
Feb 10 13:02:33 wg-sing-bj sing-box[59502]: INFO[71371] [4258295769 0ms] inbound/tun[tun-in]: inbound packet connection from 172.16.136.1:32524
Feb 10 13:02:33 wg-sing-bj sing-box[59502]: INFO[71371] [4258295769 0ms] inbound/tun[tun-in]: inbound packet connection to 223.5.5.5:53
Feb 10 13:02:33 wg-sing-bj sing-box[59502]: DEBUG[71371] [4258295769 0ms] router: match[0] inbound=tun-in => sniff
Feb 10 13:02:33 wg-sing-bj sing-box[59502]: DEBUG[71371] [4258295769 0ms] router: sniffed packet protocol: dns
Feb 10 13:02:33 wg-sing-bj sing-box[59502]: DEBUG[71371] [4258295769 0ms] router: match[1] protocol=dns => hijack-dns
Feb 10 13:02:33 wg-sing-bj sing-box[59502]: DEBUG[71371] [4258295769 0ms] dns: exchange www.baidu.com. IN A
Feb 10 13:02:33 wg-sing-bj sing-box[59502]: DEBUG[71371] [4258295769 0ms] dns: match[9] rule_set=GeoSite-CN => route(Local-DNS)
Feb 10 13:02:33 wg-sing-bj sing-box[59502]: DEBUG[71371] [4258295769 0ms] dns: cached www.baidu.com NOERROR 64
Feb 10 13:02:33 wg-sing-bj sing-box[59502]: INFO[71371] [4258295769 0ms] dns: cached CNAME www.baidu.com. 64 IN CNAME www.a.shifen.com.
Feb 10 13:02:33 wg-sing-bj sing-box[59502]: INFO[71371] [4258295769 0ms] dns: cached A www.a.shifen.com. 64 IN A 110.242.69.21
Feb 10 13:02:33 wg-sing-bj sing-box[59502]: INFO[71371] [4258295769 0ms] dns: cached A www.a.shifen.com. 64 IN A 110.242.70.57

### 2. Packet capture using tcpdump on the Singbox server reveals no response packets received, or more critically, SYN packets are not being sent out at all. Captured data shows:
[host ~]#  tcpdump  -vv -nn -i any host 172.16.136.1 and host www.baidu.com
16:08:32.067459 enp1s0 In  IP (tos 0x0, ttl 63, id 0, offset 0, flags [DF], proto TCP (6), length 64)
    172.16.136.1.64105 > 110.242.69.21.443: Flags [S], cksum 0x824c (correct), seq 2611090213, win 65535, options [mss 1250,nop,wscale 6,nop,nop,TS val 638844008 ecr 0,sackOK,eol], length 0
16:08:32.067472 tun0  Out IP (tos 0x0, ttl 62, id 0, offset 0, flags [DF], proto TCP (6), length 64)
    172.16.136.1.64105 > 110.242.69.21.443: Flags [S], cksum 0x824c (correct), seq 2611090213, win 65535, options [mss 1250,nop,wscale 6,nop,nop,TS val 638844008 ecr 0,sackOK,eol], length 0
16:08:33.068919 enp1s0 In  IP (tos 0x0, ttl 63, id 0, offset 0, flags [DF], proto TCP (6), length 64)
    172.16.136.1.64105 > 110.242.69.21.443: Flags [S], cksum 0x7e62 (correct), seq 2611090213, win 65535, options [mss 1250,nop,wscale 6,nop,nop,TS val 638845010 ecr 0,sackOK,eol], length 0
16:08:33.068927 tun0  Out IP (tos 0x0, ttl 62, id 0, offset 0, flags [DF], proto TCP (6), length 64)
    172.16.136.1.64105 > 110.242.69.21.443: Flags [S], cksum 0x7e62 (correct), seq 2611090213, win 65535, options [mss 1250,nop,wscale 6,nop,nop,TS val 638845010 ecr 0,sackOK,eol], length 0
16:08:34.070123 enp1s0 In  IP (tos 0x0, ttl 63, id 0, offset 0, flags [DF], proto TCP (6), length 64)
    172.16.136.1.64105 > 110.242.69.21.443: Flags [S], cksum 0x7a79 (correct), seq 2611090213, win 65535, options [mss 1250,nop,wscale 6,nop,nop,TS val 638846011 ecr 0,sackOK,eol], length 0
16:08:34.070132 tun0  Out IP (tos 0x0, ttl 62, id 0, offset 0, flags [DF], proto TCP (6), length 64)
    172.16.136.1.64105 > 110.242.69.21.443: Flags [S], cksum 0x7a79 (correct), seq 2611090213, win 65535, options [mss 1250,nop,wscale 6,nop,nop,TS val 638846011 ecr 0,sackOK,eol], length 0

### 3. Connection status checked via conntrack, as follows:
[host ~]# conntrack -L | grep SYN_SENT|grep "172.16.136.1 "
tcp      6 59 SYN_SENT src=172.16.136.1 dst=116.130.220.29 sport=60684 dport=443 [UNREPLIED] src=116.130.220.29 dst=172.16.136.1 sport=443 dport=60684 mark=0 use=1
tcp      6 81 SYN_SENT src=172.16.136.1 dst=116.130.220.29 sport=60754 dport=443 [UNREPLIED] src=116.130.220.29 dst=172.16.136.1 sport=443 dport=60754 mark=0 use=1
tcp      6 81 SYN_SENT src=172.16.136.1 dst=125.36.181.236 sport=60756 dport=443 [UNREPLIED] src=125.36.181.236 dst=172.16.136.1 sport=443 dport=60756 mark=0 use=1
tcp      6 81 SYN_SENT src=172.16.136.1 dst=116.130.220.29 sport=60755 dport=443 [UNREPLIED] src=116.130.220.29 dst=172.16.136.1 sport=443 dport=60755 mark=0 use=2
tcp      6 79 SYN_SENT src=172.16.136.1 dst=110.242.69.21 sport=60748 dport=443 [UNREPLIED] src=110.242.69.21 dst=172.16.136.1 sport=443 dport=60748 mark=0 use=1
tcp      6 79 SYN_SENT src=172.16.136.1 dst=110.242.69.21 sport=60750 dport=443 [UNREPLIED] src=110.242.69.21 dst=172.16.136.1 sport=443 dport=60750 mark=0 use=1
tcp      6 111 SYN_SENT src=172.16.136.1 dst=116.130.220.29 sport=60853 dport=443 [UNREPLIED] src=116.130.220.29 dst=172.16.136.1 sport=443 dport=60853 mark=0 use=1
tcp      6 81 SYN_SENT src=172.16.136.1 dst=116.130.220.29 sport=60758 dport=443 [UNREPLIED] src=116.130.220.29 dst=172.16.136.1 sport=443 dport=60758 mark=0 use=1
tcp      6 111 SYN_SENT src=172.16.136.1 dst=116.130.220.29 sport=60851 dport=443 [UNREPLIED] src=116.130.220.29 dst=172.16.136.1 sport=443 dport=60851 mark=0 use=1    

### Please excuse me for not providing a concise configuration file excerpt, as I am currently unsure which specific configuration might be causing the issue. Therefore, I have only obscured critical privacy data, while the rest of the configuration remains intact.

`{
  "log": {
    "disabled": false,
    "level": "trace",
    "output": "",
    "timestamp": false
  },
  "experimental": {
    "clash_api": {
      "external_controller": "127.0.0.1:9090",
      "external_ui": "",
      "external_ui_download_url": "",
      "external_ui_download_detour": "🎯 全球直连",
      "secret": "1111111111111111111111111111111111111111111111111111",
      "default_mode": "rule",
      "access_control_allow_origin": [
        "https://sing.test.com"
      ],
      "access_control_allow_private_network": true
    },
    "cache_file": {
      "enabled": true,
      "path": "cache.db",
      "cache_id": "",
      "store_fakeip": true,
      "store_rdrc": true,
      "rdrc_timeout": "7d"
    }
  },
  "inbounds": [
    {
      "type": "tun",
      "tag": "tun-in",
      "interface_name": "",
      "address": [
        "172.18.0.1/30",
        "fdfe:dcba:9876::1/126"
      ],
      "mtu": 9000,
      "auto_route": true,
      "loopback_address": [
        "10.7.0.1"
      ],
      "strict_route": true,
      "endpoint_independent_nat": false,
      "stack": "mixed",
      "exclude_interface": "wg0"
    }
  ],
  "outbounds": [
    {
      "type": "selector",
      "tag": "🚀 节点选择",
      "interrupt_exist_connections": true,
      "outbounds": [
        "🎈 自动选择",
        "server1",
        "server2"
      ]
    },
    {
      "type": "urltest",
      "tag": "🎈 自动选择",
      "url": "https://www.gstatic.com/generate_204",
      "interval": "1m",
      "tolerance": 150,
      "interrupt_exist_connections": true,
      "outbounds": [
        "server1",
        "server2"
      ]
    },
    {
      "type": "direct",
      "tag": "🎯 全球直连"
    },
    {
      "type": "selector",
      "tag": "🐟 漏网之鱼",
      "interrupt_exist_connections": true,
      "outbounds": [
        "🚀 节点选择"
      ]
    },
    {
      "type": "selector",
      "tag": "GLOBAL",
      "interrupt_exist_connections": true,
      "outbounds": [
        "🚀 节点选择"
      ]
    },
    {
      "type": "hysteria2",
      "tag": "server1",
      "server": "1.1.1.1",
      "server_port": 443,
      "server_ports": [
        "60001:65000"
      ],
      "hop_interval": "30s",
      "up_mbps": 100,
      "down_mbps": 100,
      "password": "xxxxxxxxxxxxxxxxxxxx",
      "tls": {
        "enabled": true,
        "insecure": true,
        "disable_sni": false,
        "server_name": "bing.com"
      }
    },
    {
      "type": "hysteria2",
      "tag": "server2",
      "server": "2.2.2.2",
      "server_port": 443,
      "server_ports": [
        "60001:65000"
      ],
      "hop_interval": "30s",
      "up_mbps": 100,
      "down_mbps": 100,
      "password": "xxxxxxxxxxxxxxxxxxxx",
      "tls": {
        "enabled": true,
        "insecure": true,
        "disable_sni": false,
        "server_name": "bing.com"
      }
    },
    {
      "type": "hysteria2",
      "tag": "server",
      "server": "3.3.3.3",
      "server_port": 443,
      "server_ports": [
        "60001:65000"
      ],
      "hop_interval": "30s",
      "up_mbps": 100,
      "down_mbps": 100,
      "password": "xxxxxxxxxxxxxxxxxxxx",
      "tls": {
        "enabled": true,
        "insecure": true,
        "disable_sni": false,
        "server_name": "bing.com"
      }
    }
  ],
  "route": {
    "rules": [
      {
        "action": "sniff",
        "inbound": "tun-in"
      },
      {
        "action": "hijack-dns",
        "protocol": "dns"
      },
      {
        "action": "route",
        "clash_mode": "direct",
        "outbound": "🎯 全球直连"
      },
      {
        "action": "route",
        "clash_mode": "global",
        "outbound": "GLOBAL"
      },
      {
        "action": "route",
        "network": "icmp",
        "outbound": "🎯 全球直连"
      },
      {
        "action": "reject",
        "protocol": "quic",
        "method": ""
      },
      {
        "action": "route",
        "domain_suffix": [
          "hf.co",
          "cdn-apple.com"
        ],
        "outbound": "🎯 全球直连"        
      },
      {
        "action": "reject",
        "rule_set": [
          "GeoSite-OpenAI-Ads"
        ],
        "method": ""
      },
      {
        "action": "reject",
        "rule_set": [
          "GeoSite-Category-Ads"
        ],
        "method": ""
      },
      {
        "action": "route",
        "rule_set": [
          "GeoSite-Private"
        ],
        "outbound": "🎯 全球直连"
      },
      {
        "action": "route",
        "rule_set": [
          "GeoSite-OpenAI"
        ],
        "outbound": "🚀 节点选择"
      },
      {
        "action": "route",
        "rule_set": [
          "GeoSite-CN"
        ],
        "outbound": "🎯 全球直连"
      },
      {
        "action": "route",
        "rule_set": [
          "GeoLocation-!CN"
        ],
        "outbound": "🚀 节点选择"
      },
      {
        "action": "route",
        "rule_set": [
          "GeoIP-Private"
        ],
        "outbound": "🎯 全球直连"
      },
      {
        "action": "route",
        "rule_set": [
          "GeoIP-CN"
        ],
        "outbound": "🎯 全球直连"
      }
    ],
    "rule_set": [
      {
        "tag": "GeoSite-Category-Ads",
        "type": "remote",
        "url": "https://testingcf.jsdelivr.net/gh/MetaCubeX/meta-rules-dat@sing/geo/geosite/category-ads-all.srs",
        "format": "binary",
        "download_detour": "🎯 全球直连"
      },
      {
        "tag": "GeoSite-Private",
        "type": "remote",
        "url": "https://testingcf.jsdelivr.net/gh/MetaCubeX/meta-rules-dat@sing/geo/geosite/private.srs",
        "format": "binary",
        "download_detour": "🎯 全球直连"
      },
      {
        "tag": "GeoSite-CN",
        "type": "remote",
        "url": "https://testingcf.jsdelivr.net/gh/MetaCubeX/meta-rules-dat@sing/geo/geosite/cn.srs",
        "format": "binary",
        "download_detour": "🎯 全球直连"
      },
      {
        "tag": "GeoLocation-!CN",
        "type": "remote",
        "url": "https://testingcf.jsdelivr.net/gh/MetaCubeX/meta-rules-dat@sing/geo/geosite/geolocation-!cn.srs",
        "format": "binary",
        "download_detour": "🎯 全球直连"
      },
      {
        "tag": "GeoSite-OpenAI-Ads",
        "type": "remote",
        "url": "https://cdn.jsdelivr.net/gh/MetaCubeX/meta-rules-dat@sing/geo/geosite/openai%40ads.srs",
        "format": "binary",
        "download_detour": "🎯 全球直连"
      },
      {
        "tag": "GeoSite-OpenAI",
        "type": "remote",
        "url": "https://cdn.jsdelivr.net/gh/MetaCubeX/meta-rules-dat@sing/geo/geosite/openai.srs",
        "format": "binary",
        "download_detour": "🎯 全球直连"
      },
      {
        "tag": "GeoIP-Private",
        "type": "remote",
        "url": "https://testingcf.jsdelivr.net/gh/MetaCubeX/meta-rules-dat@sing/geo/geoip/private.srs",
        "format": "binary",
        "download_detour": "🎯 全球直连"
      },
      {
        "tag": "GeoIP-CN",
        "type": "remote",
        "url": "https://testingcf.jsdelivr.net/gh/MetaCubeX/meta-rules-dat@sing/geo/geoip/cn.srs",
        "format": "binary",
        "download_detour": "🎯 全球直连"
      }
    ],
    "auto_detect_interface": true,
    "final": "🐟 漏网之鱼",
    "default_domain_resolver": {
      "server": "Local-DNS"
    }
  },
  "dns": {
    "servers": [
      {
        "type": "fakeip",
        "tag": "fakeip",
        "inet4_range": "198.18.0.0/15",
        "inet6_range": "fc00::/18"
      },
      {
        "tag": "hosts",
        "type": "hosts",
        "path": [],
        "predefined": {}
      },
      {
        "tag": "Local-DNS",
        "type": "https",
        "domain_resolver": "Local-DNS-Resolver",
        "server_port": 443,
        "server": "223.5.5.5",
        "path": "/dns-query"
      },
      {
        "tag": "Local-DNS-Resolver",
        "type": "udp",
        "server_port": 53,
        "server": "223.5.5.5"
      },
      {
        "tag": "Remote-DNS",
        "type": "tls",
        "detour": "server",
        "domain_resolver": "Remote-DNS-Resolver",
        "server_port": 853,
        "server": "8.8.8.8"
      },
      {
        "tag": "Remote-DNS-Resolver",
        "type": "udp",
        "detour": "server",
        "server_port": 53,
        "server": "8.8.8.8"
      }
    ],
    "rules": [
      {
        "action": "route",
        "domain_suffix": [
          "hf.co",
          "cdn-apple.com"
        ],
        "server": "Local-DNS"
      },
      {
        "action": "route",
        "domain_suffix": "lc.a",
        "server": "hosts",
        "strategy": "ipv4_only",
        "disable_cache": true
      },
      {
        "action": "route",
        "clash_mode": "direct",
        "server": "Local-DNS"
      },
      {
        "action": "route",
        "clash_mode": "global",
        "server": "Remote-DNS"
      },
      {
        "action": "route",
        "rule_set": [
          "GeoSite-CN"
        ],
        "server": "Local-DNS"
      },
      {
        "action": "route",
        "rule_set": [
          "GeoLocation-!CN"
        ],
        "server": "Remote-DNS"
      }
    ],
    "disable_cache": false,
    "disable_expire": false,
    "independent_cache": false,
    "final": "Remote-DNS",
    "strategy": "ipv4_only"
  }
}
`

### 日志

```shell
When connection timeout issues occur, neither debug-level logs nor trace-level logs record any logs related to the timeout requests.
```

### 支持我们

- [ ] 我已经 [赞助](https://github.com/sponsors/nekohasekai/)

### 完整性要求

- [x] 我保证阅读了文档，了解所有我编写的配置文件项的含义，而不是大量堆砌看似有用的选项或默认值。
- [x] 我保证提供了可以在本地重现该问题的服务器、客户端配置文件与流程，而不是一个脱敏的复杂客户端配置文件。
- [x] 我保证提供了可用于重现我报告的错误的最简配置，而不是依赖远程服务器、TUN、图形界面客户端或者其他闭源软件。
- [x] 我保证提供了完整的配置文件与日志，而不是出于对自身智力的自信而仅提供了部分认为有用的部分。
